payment_id,booking_id,customer_email,amount_gross,currency,tax_amount,fee_amount,amount_net,status,payment_method,gateway,gateway_payment_ref,invoice_no,receipt_no,paid_at,refunded_at,refund_ref,country_of_card,card_brand,last4,installments,chargeback_flag,created_at,source_system,notes
900001,648,saralind@gmail.com,35,sek,,2.52,NaN,FAILED,card,manual,pi_8164L9HBBA6L,INV-202403-5626,,2024-02-30 12:00,NaN,NULL,NULL,NULL,7525,1,,2024/03/15 11:22,manual_sheet,duplicate
900002,310,user3786@gmail.com,20,€,5.0,"1,50",,failed,bank transfer,square,pi_4ANCK8L9YU0T,,,2024/02/05 09:25,,,SE,mastercard,,NaN,,,square_export,NaN
900003,714,erikholm288@gmail.com,60,sek,,3.24,56.76,payd,invoice,adyen,,INV-202402-7684,,Feb 03 2024 14:17,,,,,n/a,,no,,,partial refund
900004,1078,NULL,40,SEK,10.0,2.66,,paid,bank transfer,,pi_4ZLO0ALEB1NV,n/a,,13/03/2024 08:43,n/a,NaN,SE,visa,7868,1,,2024-03-13 08:43,square_export,
900005,831,davidsto777@company.se,60,€,,,56.76,Paid,SWISH,square,pi_EDUD3YND7KZP,,,2024-02-01T20:35:00,NaN,NULL,,amex,9456,1,yes,2024-02-01 20:35,square_export,
900006,406,jonasnil345@email.com,20,€,5.0,"1,50",,paid,swish,klarna,,,,,NaN,NULL,,amex,,1,,2024-03-21 19:13,pos,
900007,590,davidsto391@company.se,,Sek,6.25,,,payed,invoice,square,pi_W75QFGS2UPIV,n/a,,2024-02-25T17:20:00,,NULL,PT,,,,n/a,,,manual correction
900008,148,maríalóp700@gmail.com,35,€,,2.52,,paid,cash,manual,pi_OVVKCQ7EXA4J,INV-202401-2874,RCPT_YVJE7XF,18/01/2024 22:00,,,SE,n/a,,,n/a,2024-01-18 22:00,manual_sheet,duplicate
900009,672,,15,sek,,,,Paid,Card,square,n/a,NaN,,2024/01/24 13:14,,NaN,,,NULL,NULL,no,2024-01-24 13:14,manual_sheet,NULL
900010,661,mikaelås734@outlook.com,15,Sek,3.75,,NaN,FAILED,cash,manual,,,,2024-03-21T08:12:00,NaN,,NULL,NULL,,one,,,,
900011,864,fridakar136@outlook.com,15,SEK,3.75,,,payed,cash,klarna,,,NaN,,,,NO,mastercard,,1,n/a,2024/03/24 22:38,pos,
900012,1025,maríalóp21@company.se,NaN,SEK ,5.0,"1,50",,refunded,cash,n/a,,,,10/03/2024 19:31,NULL,,,,6101,n/a,NULL,2024/03/10 19:31,manual_sheet,
900013,643,user4788@email.com,40,SEK ,10.0,,37.34,refunded,card,square,pi_CU1U7RYEHHHN,,RCPT_1FALHC0,,,n/a,ES,,8187,,NaN,2024/01/22 07:57,,manual correction
900014,219,user1999@gmail.com,35,SEK,8.75,"1,50",,paid,Card,stripe,,INV-202404-8832,RCPT_ZGRLLCB,2024-04-29 12:59,,NULL,PT,amex,,NULL,n/a,,stripe_export,partial refund
900015,173,liamande@email.com,20,sek,,,,Refunded,invoice,stripe,,,,2024-02-02 08:51,,,SE,VISA,,,NaN,,stripe_export,partial refund
900016,45,karinlun@email.com,40,SEK ,10.0,,,n/a,swish,stripe,ch_9ZMPHW68G7,,RCPT_5D37KDL,,NULL,,NULL,VISA,,,n/a,,stripe_export,manual correction
900017,313,oscarber@gmail.com,15,EUR,3.75,1.94,,payd,cash,square,pi_KDJ9M77LLSJB,INV-202403-3617,,2024-03-17T21:42:00,,n/a,GB,,,3,,2024-03-17 21:42,pos,
900018,469,n/a,40,sek,10.0,2.66,,payed,card,adyen,ch_MM3QXGJ8PH,,,2024-01-21 20:07,,n/a,,,,,,,,manual correction
900019,526,user6344@gmail.com,15,€,3.75,"1,50",13.06,PAID,swish,manual,ch_4O9XQLK99L,,,,NaN,,SE,VISA,,one,0,2024/01/16 11:57,,
900020,251,ellaberg691@outlook.com,60,SEK ,15.0,NULL,,failed,SWISH,square,,INV-202404-1896,,2024/04/18 22:52,n/a,n/a,,,,NULL,n/a,n/a,manual_sheet,manual correction
900021,182,user1998@gmail.com,25,SEK ,,"1,50",,pending,,klarna,,,RCPT_8YAARTC,,,NULL,ES,,,,,2024-03-13 07:27,square_export,NaN
900022,919,user1278@email.com,15,SEK ,,1.94,,Refunded,invoice,manual,,,RCPT_E19PQVA,2024-03-14T09:20:00,NaN,n/a,ES,NaN,n/a,3,NaN,,square_export,
900023,998,user9217@email.com,35,SEK ,NaN,2.52,,PAID,SWISH,klarna,ch_J1B8I0X7PR,n/a,,Feb 26 2024 08:39,NaN,n/a,,,,3,NULL,,pos,partial refund
900024,641,oscarber650@outlook.com,40,SEK,10.0,,NaN,payd,card,square,ch_1OPHF7B7PY,,,2024-01-09 11:08,,NULL,,,,one,1,2024-01-09 11:08,pos,NULL
900025,916,oskarber667@gmail.com,60,€,15.0,3.24,56.76,FAILED,card,adyen,pi_3XDGHI37Z958,,RCPT_RWX4J2O,,,re_X6WRCO93QM,,mastercard,,2,NULL,,square_export,
900026,1095,maríalóp@gmail.com,25,€,,,,Refunded,Klarna,manual,,INV-202402-2880,,29/02/2024 14:21,2024-02-29 14:21,n/a,,visa,n/a,n/a,no,2024/02/29 14:21,pos,manual correction
900027,759,,60,€,15.0,,,Paid,Klarna,adyen,ch_BVZ78277R9,INV-202403-2710,,Mar 02 2024 14:49,,NULL,,NULL,,,n/a,2024/03/02 14:49,manual_sheet,manual correction
900028,1047,user9578@email.com,15.00,sek,,,13.06,refunded,swish,manual,ch_JIK8FN8U8D,,RCPT_FPCW7HL,2024-04-09 15:50,,NULL,,,,,,2024/04/09 15:50,stripe_export,n/a
900029,496,ellaberg952@outlook.com,15,Sek,3.75,"1,50",13.06,NULL,SWISH,manual,ch_GHHFJHN4TQ,,,2024-05-08 14:09,,NaN,,NaN,,,n/a,2024-05-08 14:09,square_export,manual correction
900030,392,anagarci517@outlook.com,60,€,15.0,,56.76,paid,invoice,manual,pi_S1LEP2SKIKT8,INV-202403-9542,,2024/03/01 18:16,,NULL,,VISA,,2,1,NULL,stripe_export,
900031,1021,,15,€,3.75,,,Pending,Card,square,ch_E5LCBUNAOW,n/a,NULL,2024-04-02 11:49,,re_PUDLXI5VOI,NO,,NULL,,no,,,NULL
900032,977,fridakar22@company.se,20,Sek,5.0,,,FAILED,bank_transfer,square,,,,yesterday,,re_FVU92W7AC9,ES,VISA,,,,,,
900033,1168,elinsven661@email.com,35,sek,,NULL,,refunded,bank_transfer,adyen,ch_KB2APPRU50,NaN,,2024/02/10 13:57,,,NaN,mastercard,,,1,,square_export,NaN
900034,192,ahmedali594@email.com,40,sek,,"1,50",37.34,Refunded,bank transfer,,,INV-202401-4380,,2024-01-21 15:21,,NaN,,amex,,3,n/a,2024/01/21 15:21,stripe_export,
900035,2581,ahmedali255@outlook.com,20,sek,,n/a,,payd,,klarna,,,,NULL,,,PT,n/a,NaN,NaN,n/a,,manual_sheet,manual correction
900036,1101,user2607@email.com,15,SEK,3.75,1.94,,Refunded,cash,adyen,,,NaN,NULL,n/a,NULL,NO,,NULL,one,yes,2024-03-15 09:55,stripe_export,
900037,1169,user9644@gmail.com,40,NULL,,NULL,,failed,SWISH,manual,,,,,NULL,,,amex,,2,1,,manual_sheet,NaN
900038,256,anagarci844@company.se,20,,,2.08,,Pending,bank_transfer,square,,,RCPT_HF0TV39,2024-03-25 13:45,n/a,n/a,,VISA,,,n/a,,square_export,
900039,1046,norahans@email.com,,Sek,3.75,,,Pending,cash,manual,ch_3C0NBH70RY,INV-202401-3229,RCPT_8FTG1A4,Jan 15 2024 14:58,n/a,,GB,visa,9564,NaN,NaN,2024/01/15 14:58,pos,duplicate
900040,278,user5458@email.com,40,EUR,,n/a,,PAID,Klarna,stripe,,,,2024/01/01 13:40,,re_FYXVL5OROP,ES,,,,,NaN,pos,n/a
900041,521,saralind135@email.com,20,SEK,5.0,n/a,,Refunded,bank_transfer,stripe,pi_ZTO248J4QBD6,,RCPT_7H7903O,2024-01-29 12:43,,,n/a,VISA,,,,,pos,
900042,218,NaN,35,sek,,2.52,32.48,failed,Klarna,square,,INV-202402-3332,,2024-02-03T13:30:00,,NaN,ES,,8442,2,0,,,manual correction
900043,951,user2448@gmail.com,,SEK ,,,32.48,Paid,cash,manual,n/a,,RCPT_2Y020AX,2024-01-27 14:55,,NaN,ES,VISA,7110,1,,,stripe_export,duplicate
900044,1136,linchen811@email.com,20,Sek,,,,failed,Card,manual,,,,02/02/2024 19:43,n/a,NaN,GB,,,,0,,pos,
900045,283,fatimakh311@gmail.com,15,€,,,,FAILED,Card,square,,INV-202403-4760,,,n/a,n/a,,n/a,4081,,yes,,,
900046,96,davidsto777@company.se,25,SEK,,,,payed,cash,,,,,,,n/a,SE,amex,,,yes,NaN,stripe_export,partial refund
900047,1132,user3383@gmail.com,20,EUR,,,,refunded,Klarna,manual,n/a,,,2024/01/10 11:36,,NaN,ES,NULL,NaN,3,NaN,,,duplicate
900048,231,mikaelås@gmail.com,35,EUR,n/a,2.52,,failed,NULL,square,,,RCPT_NHMH79P,2024/02/03 09:09,NaN,NaN,SE,,,3,NaN,2024/02/03 09:09,pos,
900049,507,,"25,00",EUR,6.25,,22.77,payed,Klarna,square,ch_VL4XT50HBL,INV-202401-8606,,2024/01/31 16:36,,n/a,SE,VISA,,1,,,pos,
900050,630,anagarci713@email.com,NaN,sek,,,32.48,PAID,SWISH,stripe,pi_Y8XQJD5O9KT5,,,2024-01-25 12:11,,,NaN,visa,,NULL,,2024-01-25 12:11,,
900051,735,user8419@gmail.com,60,€,15.0,,,FAILED,SWISH,manual,,INV-202403-9002,RCPT_HE3DV3H,Mar 02 2024 21:03,NaN,,,VISA,6825,n/a,,,manual_sheet,
900052,361,oscarber569@company.se,,SEK ,10.0,2.66,,paid,card,adyen,ch_E5DFXYBS77,INV-202404-3912,,2024/04/15 10:53,NULL,n/a,,visa,1097,1,1,,stripe_export,
900053,826,oscarber650@outlook.com,15,SEK,3.75,,NaN,Paid,invoice,klarna,,NULL,,27/01/2024 10:58,,NULL,,n/a,,one,,2024/01/27 10:58,pos,partial refund
900054,122,liamande293@outlook.com,25,Sek,6.25,2.23,22.77,paid,n/a,manual,,,,2024-02-21T10:28:00,,,NO,mastercard,6760,2,,,manual_sheet,NaN
900055,1034,ellaberg734@gmail.com,20,sek,NULL,2.08,,payed,Klarna,manual,,,,2024-03-08 12:48,,NULL,GB,n/a,,one,0,2024/03/08 12:48,manual_sheet,
900056,521,fatimakh27@email.com,NaN,EUR,NaN,2.23,,Pending,Klarna,manual,ch_9FRQTGQ8AV,NaN,,May 07 2024 14:26,,,ES,mastercard,2006,NULL,0,,,partial refund
900057,217,pedrosil754@gmail.com,15,Sek,3.75,"1,50",,FAILED,SWISH,manual,,INV-202402-3954,NaN,Feb 06 2024 20:46,NULL,NaN,GB,mastercard,,,0,2024/02/06 20:46,stripe_export,partial refund
900058,397,user6286@gmail.com,40,,,,37.34,paid,bank_transfer,adyen,,,,2024-03-12 21:23,NULL,,NO,mastercard,,3,yes,2024-03-12 21:23,NULL,manual correction
900059,844,user7388@gmail.com,25,€,,2.23,,Pending,cash,klarna,,,,2024-02-02T20:53:00,,n/a,NO,VISA,9413,3,no,2024/02/02 20:53,stripe_export,
900060,523,NULL,35.00,SEK ,8.75,,n/a,paid,card,stripe,pi_X8QD8QMG6I1A,,,19/01/2024 11:08,,re_6MFBU8PYXD,NO,NULL,NaN,3,1,2024-01-19 11:08,pos,
900061,23,fatimakh509@gmail.com,40,EUR,10.0,"1,50",,PAID,bank transfer,manual,ch_OHYOGOCYXW,,,2024-01-21 12:35,,NULL,GB,visa,NaN,one,yes,2024/01/21 12:35,stripe_export,manual correction
900062,60,NaN,40,SEK ,10.0,,,Pending,swish,,ch_0P2B4AUABP,INV-202403-6953,,Mar 30 2024 12:18,,,GB,mastercard,,3,1,2024-03-30 12:18,,NaN
900063,98,mariamal755@email.com,35 SEK,EUR,NaN,,,pending,card,klarna,ch_HQQFPGSQT0,,RCPT_DKRKZQI,,,,SE,visa,,3,1,2024-02-25 07:29,,
900064,64,user8207@email.com,60,SEK ,,,,payd,SWISH,stripe,pi_QBHG1DUZ7OGX,,RCPT_PVACZS5,2024-01-11 22:56,,,,,,one,NULL,2024/01/11 22:56,square_export,partial refund
900065,1114,mariamal@email.com,20,sek,,,n/a,PAID,bank_transfer,manual,,,RCPT_6ZV0MKZ,NULL,NULL,,ES,visa,,one,NaN,2024-04-26 11:37,manual_sheet,manual correction
900066,430,user9538@gmail.com,15,€,,,13.06,Paid,Card,klarna,pi_W94GZLCKMWND,INV-202404-9231,,2024-04-09T15:39:00,,NULL,NO,VISA,,1,n/a,2024/04/09 15:39,square_export,NULL
900067,829,karinlun374@outlook.com,60,Sek,15.0,,,Paid,bank_transfer,klarna,ch_GM6ZFZJULW,INV-202402-3904,RCPT_D0SH7BJ,2024/02/13 07:41,NaN,,PT,,NULL,1,0,2024/02/13 07:41,manual_sheet,partial refund
900068,1036,,NaN,sek,5.0,2.08,17.92,Refunded,SWISH,stripe,n/a,,,2024-01-05 08:02,,,GB,VISA,,3,n/a,2024/01/05 08:02,stripe_export,
900069,53,norahans@gmail.com,,EUR,3.75,,,payd,Klarna,manual,NaN,,RCPT_N9DKIUI,,,NULL,GB,NULL,,,NULL,2024/04/21 11:16,manual_sheet,
900070,57,user9974@email.com,40,EUR,10.0,,,refunded,swish,square,,,,08/02/2024 13:37,n/a,n/a,SE,amex,,one,0,,square_export,
900071,493,luispere760@company.se,15 SEK,Sek,3.75,,,paid,Klarna,adyen,,,NULL,03/04/2024 15:35,n/a,n/a,PT,amex,2200,,0,2024/04/03 15:35,,
900072,1155,user3469@gmail.com,20,sek,,2.08,,paid,invoice,adyen,NaN,NaN,RCPT_QPPL277,Jan 22 2024 13:41,n/a,NaN,SE,VISA,,,no,2024/01/22 13:41,stripe_export,manual correction
900073,740,,20,€,,,,payed,swish,klarna,NaN,INV-202401-9394,NaN,2024-01-27 15:41,n/a,,,visa,5952,one,NaN,2024-01-27 15:41,manual_sheet,n/a
900074,612,pedrosil754@gmail.com,35,EUR,,"1,50",NULL,payed,cash,klarna,n/a,,,Feb 29 2024 17:08,NaN,n/a,,,NaN,NaN,NaN,,,duplicate
900075,114,user2105@email.com,15,SEK ,,n/a,,paid,card,klarna,,NULL,,17/02/2024 10:57,,,ES,mastercard,NULL,1,yes,2024-02-17 10:57,stripe_export,manual correction
900076,379,erikholm65@gmail.com,15,SEK,,"1,50",13.06,refunded,invoice,manual,,,,2024-02-19T07:29:00,n/a,,SE,VISA,,NaN,,2024/02/19 07:29,pos,
900077,1169,ahmedali167@company.se,NaN,sek,6.25,,NULL,PAID,Klarna,klarna,ch_OS4IFFEQMO,INV-202402-2929,,2024-02-22T10:20:00,,n/a,,visa,NaN,n/a,n/a,2024/02/22 10:20,pos,
900078,390,user2692@gmail.com,35,sek,,"1,50",n/a,refunded,bank transfer,adyen,ch_79GT7A67JH,,,Jan 29 2024 12:37,NULL,NaN,,,,,0,2024/01/29 12:37,stripe_export,partial refund
900079,303,mikaelås734@outlook.com,25 SEK,SEK,n/a,n/a,,paid,swish,manual,,,,2024-04-22T08:22:00,,,,,,,yes,2024-04-22 08:22,NULL,partial refund
900080,615,norahans@email.com,15,€,3.75,,n/a,payed,card,klarna,NULL,INV-202403-8920,RCPT_6UXTXQD,2024/03/01 18:46,,,,,NULL,,1,2024/03/01 18:46,square_export,NULL
900081,162,user9541@email.com,60,Sek,,,NULL,payd,cash,adyen,n/a,,RCPT_38PX0OL,26/04/2024 13:48,n/a,n/a,,NULL,,1,0,2024/04/26 13:48,,duplicate
900082,41,,,sek,15.0,"1,50",,Pending,Klarna,adyen,,,,Apr 08 2024 11:43,,NULL,GB,amex,,3,,2024/04/08 11:43,square_export,manual correction
900083,502,saralind694@outlook.com,35,SEK ,8.75,2.52,NULL,paid,cash,adyen,pi_X95D8MOV5F94,,,2024-04-01 10:21,,re_VXQQ6CN4ZO,PT,amex,9208,2,no,2024/04/01 10:21,,
900084,181,emmajoha610@email.com,15,Sek,,,13.06,payd,bank transfer,square,,,,2024-01-06 22:33,n/a,,NO,,,n/a,0,,square_export,manual correction
900085,393,emmajoha446@gmail.com,20,EUR,5.0,2.08,,Pending,invoice,stripe,,,,,,NULL,NaN,visa,,n/a,,2024-02-23 16:45,stripe_export,
900086,1012,oskarber957@company.se,20,€,,,,FAILED,card,klarna,ch_NM295NENMN,INV-202404-5758,,2024-04-03T13:36:00,,n/a,,visa,8295,one,NaN,2024-04-03 13:36,stripe_export,manual correction
900087,832,liamande127@company.se,15 SEK,€,3.75,,,pending,invoice,adyen,pi_OD9TSPCSYZR0,,RCPT_OL5XLK2,2024-02-24T17:19:00,,,,,,one,1,2024-02-24 17:19,manual_sheet,
900088,40,anagarci@gmail.com,n/a,sek,,,37.34,Paid,bank transfer,square,ch_VQ5FRGYAI7,,,,,,SE,VISA,NULL,,,,square_export,partial refund
900089,94,NaN,35,€,8.75,,,failed,card,stripe,,,RCPT_99DFBTN,21/01/2024 22:28,,,SE,mastercard,1920,1,,,manual_sheet,n/a
900090,998,,15,EUR,,NaN,,n/a,swish,manual,n/a,,,2024/03/11 21:18,NaN,n/a,,visa,4364,NaN,0,,,NaN
900091,628,luispere745@outlook.com,NaN,Sek,,,NULL,PAID,Klarna,stripe,ch_98MQASPBB7,NULL,NULL,2024-03-13 17:59,NaN,,GB,amex,,1,no,2024/03/13 17:59,stripe_export,
900092,482,noaherik618@outlook.com,,EUR,,,,failed,swish,manual,pi_GBTWPNZ3WLDL,,NULL,2024-02-12T09:21:00,,,,NaN,5816,n/a,,2024-02-12 09:21,stripe_export,
900093,37,user8057@email.com,25,Sek,,,,refunded,Klarna,manual,ch_IST6FMF7Z0,INV-202402-8102,,,NULL,re_U8SSCOQR9I,,mastercard,,,,,stripe_export,
900094,656,norahans@gmail.com,35,€,,,32.48,PAID,Card,adyen,pi_1932K1RKCLK0,n/a,RCPT_LEZJM5Z,,NULL,NULL,SE,visa,,1,NaN,2024-03-22 11:26,stripe_export,manual correction
900095,1107,NaN,15,SEK,NaN,1.94,,refunded,Klarna,manual,,INV-202403-9831,,Mar 07 2024 09:33,,,,,NaN,,1,2024-03-07 09:33,stripe_export,manual correction
900096,708,fatimakh311@gmail.com,15,sek,,1.94,n/a,failed,bank_transfer,adyen,pi_AJ6FZGL94OIQ,INV-202401-1944,,Jan 08 2024 18:14,,n/a,GB,mastercard,,,,2024/01/08 18:14,pos,partial refund
900097,481,n/a,40,SEK ,,,,Pending,SWISH,NULL,NaN,,,2024/02/05 12:02,,NULL,GB,visa,,,,,pos,partial refund
900098,1150,emmajoha610@email.com,15,€,,"1,50",,failed,card,manual,pi_ZJMGOHTMVQJW,,n/a,n/a,,n/a,,VISA,,1,no,,square_export,NaN
900099,194,davidsto100@outlook.com,60,SEK,,,,Pending,bank transfer,klarna,,,,NULL,n/a,,NO,,,2,NaN,,pos,
900100,684,,40,sek,10.0,,37.34,Paid,bank transfer,square,ch_2JI749IZE1,,,,,NULL,,,,3,0,,,partial refund
900101,546,,60,SEK ,15.0,3.24,56.76,Pending,cash,adyen,,,RCPT_HKLH24B,,,NaN,,VISA,,,,,,partial refund
900102,1012,anagarci844@company.se,,Sek,,"1,50",,paid,Klarna,adyen,pi_U00MGTQC7MMC,n/a,,2024/01/29 18:04,,NaN,,VISA,2353,2,NaN,,,duplicate
900103,457,,15,EUR,3.75,NULL,,Paid,invoice,stripe,ch_65SIQ4BNB8,INV-202401-5017,NaN,31/01/2024 20:23,,,SE,,,,,,,duplicate
900104,125,user996@email.com,"25,00",€,,"1,50",22.77,FAILED,invoice,adyen,pi_LGP14NVV4NMU,,,Feb 25 2024 07:07,,NULL,GB,n/a,,,0,2024-02-25 07:07,manual_sheet,partial refund
900105,471,karinlun422@outlook.com,40 SEK,€,10.0,,,paid,card,klarna,pi_DUHEEM5ZAKAH,n/a,,,,NaN,,,,,n/a,2024-05-08 17:57,manual_sheet,manual correction
900106,1090,mariamal136@company.se,15,SEK ,,,,Refunded,,manual,ch_3I3RNFX47D,NULL,,,NaN,,ES,,3057,n/a,no,2024/05/03 13:24,manual_sheet,partial refund
900107,663,saralind414@email.com,,Sek,,2.08,NaN,payed,Klarna,stripe,ch_RXJOT5QUHE,,NULL,2024/04/25 22:10,,NaN,ES,VISA,,NULL,0,,pos,manual correction
900108,1014,jonasnil950@outlook.com,20,sek,,,17.92,pending,bank_transfer,square,pi_ZWJUAD8H9KL4,,RCPT_R8XGPRY,,,,PT,n/a,,n/a,yes,2024-05-07 08:51,stripe_export,
900109,215,NULL,NaN,SEK ,,3.24,,PAID,bank transfer,klarna,n/a,INV-202402-7548,n/a,23/02/2024 14:27,NaN,,SE,amex,,,NULL,2024-02-23 14:27,square_export,manual correction
900110,714,elinsven653@email.com,60,EUR,n/a,3.24,,Paid,,manual,pi_Q7EY6M8Y7BVN,NaN,,Jan 07 2024 19:52,,,ES,NULL,1999,n/a,,,square_export,manual correction
900111,739,pedrosil754@gmail.com,40,EUR,10.0,2.66,,paid,bank_transfer,adyen,ch_7W3VXZIW53,,RCPT_OUOFQST,Jan 03 2024 19:35,n/a,,,mastercard,,,n/a,,square_export,
900112,1114,fatimakh322@outlook.com,25,sek,,,,paid,invoice,adyen,ch_AVIRZXW2FO,,RCPT_NB4QK7Y,,,re_YHXLRBAB7J,GB,,,,n/a,,,manual correction
900113,146,NULL,60,sek,15.0,,,Pending,cash,manual,,,,2024-03-15 22:05,,,n/a,amex,NULL,,1,2024-03-15 22:05,stripe_export,NULL
900114,125,anagarci844@company.se,,€,,n/a,13.06,Paid,bank transfer,NULL,ch_C0Y9R2ZJG4,,,,NULL,NULL,,amex,9951,1,yes,2024-05-02 16:30,manual_sheet,
900115,329,liamande@email.com,40,€,10.0,,,n/a,Klarna,square,,n/a,,,,re_UDYCNAZ1KT,,visa,,,0,,pos,
900116,467,user511@gmail.com,40,EUR,,2.66,37.34,PAID,swish,square,ch_LHX63558A2,NULL,,2024-05-03 18:11,n/a,n/a,ES,visa,,3,yes,2024-05-03 18:11,,
900117,552,liamande293@outlook.com,20,NaN,,"1,50",,FAILED,bank_transfer,klarna,,NaN,RCPT_86D04J8,,NaN,,,amex,,3,NULL,2024-02-11 21:49,stripe_export,
900118,1117,pedrosil@email.com,25,sek,,NaN,,FAILED,card,klarna,,,NULL,10/04/2024 20:35,,NULL,,n/a,,,,2024-04-10 20:35,square_export,manual correction
900119,1001,sofiaand@gmail.com,20,Sek,,,17.92,FAILED,bank transfer,klarna,,,,26/02/2024 07:26,NULL,n/a,,amex,3086,2,NaN,2024-02-26 07:26,manual_sheet,
900120,1073,,35 SEK,SEK ,8.75,NaN,,Refunded,Klarna,stripe,,INV-202402-7601,,2024-02-05 08:18,,n/a,SE,visa,,n/a,,,stripe_export,
900121,602,user6549@email.com,25,SEK ,,"1,50",22.77,Paid,card,klarna,ch_WVUXUC488W,INV-202405-2428,n/a,2024-05-07T14:51:00,,NaN,,visa,1259,,n/a,n/a,manual_sheet,manual correction
900122,646,,,EUR,,,56.76,pending,cash,NaN,,INV-202403-2237,,,,,ES,,,1,,2024-03-24 10:10,n/a,
900123,881,erikholm328@company.se,"35,00",EUR,8.75,2.52,,n/a,bank_transfer,adyen,,,,2024/01/10 18:30,,NULL,GB,NaN,8871,,,2024-01-10 18:30,stripe_export,n/a
900124,287,user4585@email.com,n/a,EUR,3.75,1.94,,payd,SWISH,stripe,ch_X3CLTJU2CC,NaN,,2024/05/09 08:17,NULL,,,mastercard,NULL,n/a,,2024/05/09 08:17,manual_sheet,duplicate
900125,839,saralind733@gmail.com,25,Sek,,,22.77,Pending,SWISH,stripe,ch_2S2MNNUFG6,,,yesterday,NULL,,GB,mastercard,,2,,NULL,pos,duplicate
900126,921,user6486@email.com,40,EUR,,,NaN,Paid,cash,manual,ch_3I8G9AOR97,,RCPT_8FKT98E,03/01/2024 10:09,NULL,re_JC6SUMITC3,PT,NULL,1276,NULL,NaN,2024-01-03 10:09,stripe_export,partial refund
900127,1187,n/a,35.00,NULL,8.75,"1,50",32.48,Refunded,Card,,,,NULL,08/04/2024 10:44,,NULL,n/a,,,n/a,0,2024/04/08 10:44,,
900128,274,user5712@email.com,60,SEK,,,NaN,pending,bank transfer,stripe,,,,,,n/a,ES,visa,,3,,2024-01-18 15:39,,n/a
900129,862,user6248@email.com,35,EUR,8.75,,,paid,swish,square,,,RCPT_MQGZCA8,,,,,,1095,,NULL,,,partial refund
900130,1150,karinlun@gmail.com,25 SEK,SEK,,,NULL,paid,swish,manual,pi_BS7IZ8ISW5MM,,,Jan 12 2024 17:02,NULL,,NaN,,5352,2,,2024/01/12 17:02,stripe_export,NaN
900131,33,sofiaand850@gmail.com,20,€,,,,refunded,swish,adyen,,INV-202403-5672,,,2024-03-20 07:25,NULL,SE,mastercard,,,1,2024/03/20 07:25,stripe_export,
900132,845,user6981@email.com,25,sek,6.25,2.23,,Pending,cash,klarna,,,,11/02/2024 15:22,,,NO,,9585,NaN,no,,stripe_export,partial refund
900133,940,fridakar823@gmail.com,35,€,,,,failed,bank_transfer,NULL,ch_257LSUT436,,n/a,May 08 2024 22:18,,n/a,NaN,amex,1451,n/a,,2024-05-08 22:18,stripe_export,n/a
900134,544,ellaberg146@outlook.com,40,Sek,NULL,n/a,NaN,Refunded,card,manual,ch_V4FOZYIGE6,,RCPT_4B19I3X,2024-01-18 15:34,,NaN,PT,,6619,,,2024/01/18 15:34,,NaN
900135,390,maríalóp229@email.com,35,SEK ,8.75,,32.48,n/a,swish,adyen,ch_189E54RQ5O,,,2024-04-26T16:40:00,NULL,,n/a,,,,,2024-04-26 16:40,stripe_export,
900136,961,,25,Sek,,,22.77,Pending,Card,stripe,ch_2O4I9XQT9E,,,2024-05-01T12:35:00,,NaN,SE,,,one,n/a,2024-05-01 12:35,manual_sheet,n/a
900137,911,linchen450@email.com,25,SEK,6.25,2.23,,payd,bank transfer,stripe,ch_VFZ2CAJ6R4,,NaN,,,,,,,1,NULL,2024/02/20 19:10,pos,
900138,1025,user6721@gmail.com,15,SEK ,,,,payd,card,manual,,NaN,RCPT_DAG6Z4P,2024-01-19T10:07:00,n/a,NaN,NO,mastercard,,,yes,,stripe_export,manual correction
900139,1190,luispere582@gmail.com,15,€,NULL,,13.06,payd,Card,adyen,,,RCPT_1N0FDY3,2024/02/02 16:40,NULL,,PT,mastercard,4966,,,2024-02-02 16:40,,
900140,25,linchen811@email.com,25,SEK,6.25,,22.77,payed,bank_transfer,stripe,,,RCPT_GD6DFKM,,NaN,,NaN,amex,,3,NULL,,,duplicate
900141,51,user689@email.com,15,SEK ,3.75,"1,50",NULL,refunded,SWISH,stripe,pi_4CNG88PPUAZ3,NaN,,n/a,,NULL,GB,NULL,,NULL,NULL,2024-04-15 17:49,pos,NULL
900142,858,emmajoha@gmail.com,40 SEK,EUR,10.0,,37.34,failed,Klarna,adyen,ch_3CT4Z207FM,,,2024/05/06 07:42,,n/a,SE,NaN,,,1,,pos,NULL
900143,608,jonasnil@email.com,40,sek,,2.66,,refunded,bank transfer,square,,,,2024/01/15 15:01,,NULL,SE,amex,,2,,2024/01/15 15:01,pos,duplicate
900144,675,karinlun413@email.com,40,sek,10.0,,n/a,FAILED,bank_transfer,manual,,,,2024/04/06 11:26,NULL,,ES,VISA,,NULL,,2024-04-06 11:26,,manual correction
900145,28,user3376@gmail.com,25,EUR,NULL,"1,50",,paid,SWISH,klarna,pi_0C2EVCTVL1PG,,,2024-04-23T20:21:00,,,,NULL,,one,,2024/04/23 20:21,square_export,
900146,1124,n/a,60,sek,n/a,,,pending,cash,stripe,ch_WTEC2B7920,,NULL,22/01/2024 17:20,NaN,NULL,NO,mastercard,,NaN,no,2024-01-22 17:20,stripe_export,duplicate
900147,996,saralind@gmail.com,40,Sek,10.0,"1,50",,paid,Klarna,stripe,pi_ZISTCPXYAQR0,INV-202404-3045,n/a,2024-04-20T07:03:00,,,,visa,1871,3,,2024/04/20 07:03,square_export,
900148,157,karinlun374@outlook.com,15,Sek,,n/a,13.06,failed,bank transfer,manual,pi_6QL4J8SUD8H6,INV-202403-6469,RCPT_2UIHVX4,23/03/2024 22:20,NaN,re_79C035ADYZ,,,,,,,,
900149,455,mariamal848@company.se,15,SEK ,3.75,,NaN,failed,bank_transfer,manual,,,,2024-01-26 15:05,,,,n/a,NULL,,,2024/01/26 15:05,manual_sheet,NaN
900150,996,oscarber524@email.com,25,€,6.25,,,payed,SWISH,klarna,,,,2024/02/17 13:24,NaN,n/a,,mastercard,n/a,,NULL,2024-02-17 13:24,,manual correction
900151,304,saralind@email.com,35,EUR,8.75,2.52,,Pending,Card,klarna,pi_0FJ4QV1NF1H6,INV-202404-2660,RCPT_FY3H615,2024-04-11T09:59:00,,NULL,n/a,mastercard,7343,1,1,NaN,square_export,partial refund
900152,601,linchen811@email.com,25 SEK,SEK,6.25,2.23,,pending,Card,manual,,,RCPT_048YJB1,2024-03-04T20:49:00,,,ES,amex,,NaN,1,,pos,duplicate
900153,63,noaherik618@outlook.com,25,sek,,,22.77,payd,invoice,square,pi_O9LNQ1X4Q67N,INV-202402-5685,,16/02/2024 11:12,,,,,,1,yes,,,
900154,1087,ellaberg691@outlook.com,25,SEK,6.25,,,PAID,cash,klarna,pi_K8410A3924HW,INV-202403-2614,,2024-03-13T19:55:00,,,,,NULL,one,1,2024/03/13 19:55,square_export,
900155,211,sofiaand@email.com,,EUR,NaN,"1,50",,paid,swish,manual,n/a,,,2024-03-22T08:03:00,,n/a,ES,,,1,no,2024-03-22 08:03,stripe_export,NULL
900156,908,luispere@email.com,25,sek,6.25,,,FAILED,SWISH,adyen,pi_53DSZA62JNQU,,NaN,2024-01-27 11:50,,NULL,,amex,,3,1,2024-01-27 11:50,manual_sheet,partial refund
900157,294,norahans841@company.se,20,€,,,,Refunded,bank_transfer,stripe,,,RCPT_YMT06LL,03/03/2024 16:24,2024-03-03 16:24,re_VBWUASTO44,GB,visa,5837,,,2024-03-03 16:24,pos,
900158,843,user1996@gmail.com,35,Sek,NULL,,,paid,Klarna,klarna,pi_LHJPB2T0UGWW,INV-202401-8692,,NaN,,,ES,,,NaN,,2024/01/23 07:39,square_export,manual correction
900159,333,,NULL,SEK,,2.66,,pending,cash,adyen,pi_QDRT21P8MZ2G,INV-202403-2189,,17/03/2024 19:01,NaN,,GB,n/a,2969,1,1,2024/03/17 19:01,pos,n/a
900160,,luispere@email.com,40,SEK,,"1,50",,payed,NULL,manual,pi_EOU0NCFA5QWR,INV-202403-1976,RCPT_UUNH7SN,2024-03-28T12:16:00,NULL,,GB,visa,,,,2024-03-28 12:16,square_export,partial refund
900161,1134,sofiaand850@gmail.com,15,SEK,,1.94,,refunded,Klarna,klarna,,INV-202404-5873,,2024-04-24 18:57,NaN,NULL,ES,visa,,3,yes,,stripe_export,manual correction
900162,553,user1634@email.com,15,SEK,,n/a,,paid,card,stripe,,INV-202404-7737,RCPT_7BGIY1O,2024-04-12T11:10:00,NaN,n/a,n/a,visa,,2,NaN,,,n/a
900163,940,user5813@gmail.com,,sek,10.0,,37.34,PAID,Card,adyen,pi_ZTY9IR4AZGER,,,,,,PT,,8379,1,yes,2024-04-23 15:16,square_export,duplicate
900164,922,NaN,60,SEK ,,,NaN,failed,Klarna,stripe,,,RCPT_9GHJK33,09/05/2024 09:17,,,,,,1,0,2024/05/09 09:17,pos,duplicate
900165,673,ellaberg691@outlook.com,NaN,EUR,6.25,,,pending,SWISH,stripe,,,,2024-01-29 21:04,,,,,,3,,2024/01/29 21:04,manual_sheet,duplicate
900166,245,user2019@email.com,15,SEK,,1.94,,Paid,bank_transfer,stripe,,INV-202401-5234,n/a,2024-01-20T21:23:00,,n/a,ES,n/a,,,,2024-01-20 21:23,,
900167,705,mariamal123@company.se,,EUR,,NaN,,FAILED,,stripe,ch_WARJ7OZS6E,,RCPT_LETW6EL,2024-02-09T11:38:00,,,,,n/a,,no,,,partial refund
900168,401,ahmedali594@email.com,15 SEK,SEK ,,,,payd,cash,stripe,ch_S4U95FWLGY,INV-202401-2426,,2024-01-31 07:22,NULL,NaN,SE,,,2,,2024-01-31 07:22,stripe_export,
900169,306,user2055@gmail.com,40,SEK ,,2.66,,refunded,cash,adyen,,INV-202401-8205,RCPT_3EM6PCZ,,,NULL,,VISA,,one,yes,2024-01-08 11:50,stripe_export,
900170,850,fatimakh971@email.com,20,,,2.08,,FAILED,Klarna,adyen,ch_124WA6QAMS,,RCPT_W0Z1GHT,Mar 15 2024 22:40,NaN,,,amex,7846,,NULL,2024/03/15 22:40,stripe_export,
900171,262,user5932@email.com,15,sek,,,13.06,Paid,SWISH,adyen,,,,2024/01/18 21:19,NULL,n/a,,n/a,,1,,2024/01/18 21:19,square_export,NULL
900172,1177,ahmedali@email.com,40,€,,"1,50",37.34,FAILED,SWISH,stripe,NULL,INV-202401-9652,RCPT_V2HFB21,Jan 10 2024 12:00,NULL,NULL,ES,VISA,,,,2024-01-10 12:00,,
900173,470,n/a,35,EUR,8.75,,32.48,refunded,SWISH,stripe,pi_4U4JRCROCNI0,,,Mar 06 2024 07:31,,NaN,NaN,amex,n/a,NaN,NULL,,manual_sheet,
900174,372,mariamal803@email.com,40,sek,10.0,2.66,37.34,Paid,swish,adyen,,INV-202403-6548,,2024/03/30 11:17,NaN,NaN,,amex,,NaN,,,manual_sheet,
900175,547,oliviali224@outlook.com,25,sek,,,,Refunded,swish,stripe,pi_HQMQCYZ9SMID,,RCPT_5MUGJO3,2024-04-03 13:51,2024-04-03 13:51,NULL,SE,mastercard,9754,one,yes,,,
900176,681,user7197@email.com,20,€,5.0,,,Paid,invoice,adyen,ch_T6G14XV2SV,,RCPT_V2FKDAL,2024-01-28 22:41,NULL,,NaN,n/a,,,,2024/01/28 22:41,manual_sheet,
900177,307,,25,SEK ,6.25,2.23,,,SWISH,stripe,ch_5AGILH3TGP,INV-202402-9476,,2024-02-13 20:08,,n/a,,amex,,2,,,NULL,duplicate
900178,388,luispere582@gmail.com,,SEK,6.25,"1,50",,payd,SWISH,klarna,,,,2024-04-29 11:56,,NULL,NO,NULL,,,0,,,manual correction
900179,404,maríalóp917@gmail.com,20,EUR,,,17.92,FAILED,cash,stripe,pi_W86RTX72FR5T,,RCPT_67MNE6H,04/02/2024 21:43,,,,VISA,1177,1,0,2024-02-04 21:43,square_export,
900180,578,karinlun@email.com,35,EUR,NULL,"1,50",,paid,swish,manual,,,,,,,GB,VISA,NULL,1,,2024-01-20 15:36,square_export,
900181,948,mariamal803@email.com,25,€,,,,payd,Card,square,pi_OLNBBKQ1ALKK,,RCPT_2R3MOY1,2024/02/10 17:00,,,SE,VISA,,,NULL,2024/02/10 17:00,,partial refund
900182,1126,elinsven604@outlook.com,35,SEK,8.75,2.52,,payed,swish,manual,ch_ZKZSE9LQA6,,n/a,Feb 02 2024 07:18,,re_4V6U4VUNGT,GB,mastercard,n/a,one,0,2024-02-02 07:18,square_export,
900183,58,jonasnil669@company.se,"40,00",SEK ,,"1,50",NULL,Refunded,Klarna,adyen,NULL,,,Mar 02 2024 13:25,,,PT,mastercard,,,yes,2024/03/02 13:25,stripe_export,duplicate
900184,551,n/a,40,SEK,10.0,,37.34,failed,SWISH,adyen,n/a,INV-202401-1222,RCPT_2H5Z9WA,NaN,NULL,,,amex,NULL,,no,2024/01/12 07:11,n/a,
900185,226,erikholm@gmail.com,15,SEK,3.75,1.94,,Pending,SWISH,klarna,pi_3NVTVQ9OPWTS,NULL,RCPT_7K3Y0UQ,,,,ES,,,1,,,stripe_export,duplicate
900186,623,sofiaand850@gmail.com,20,sek,NaN,,,pending,invoice,adyen,ch_1MG6ZAFBAS,,,,NaN,,GB,amex,6196,2,,,square_export,manual correction
900187,,oskarber957@company.se,35,sek,8.75,,NaN,payed,card,manual,pi_M6CBP3WL5CAQ,,,Apr 02 2024 09:07,n/a,NULL,,NaN,,,,2024-04-02 09:07,,
900188,313,user9015@email.com,60,€,,3.24,,FAILED,card,adyen,,INV-202403-9352,n/a,2024/03/30 22:04,,re_DBLSB6V27A,NO,,,,no,,stripe_export,duplicate
900189,820,sofiaand383@gmail.com,15,€,,,,FAILED,Card,adyen,,,n/a,2024-04-16 07:04,n/a,n/a,,amex,n/a,,yes,2024-04-16 07:04,,partial refund
900190,92,mariamal803@email.com,15,sek,,1.94,,PAID,bank transfer,square,,,,Feb 26 2024 08:56,,n/a,PT,mastercard,7604,2,0,2024/02/26 08:56,stripe_export,
900191,2583,sofiaand@gmail.com,35,SEK,,"1,50",,PAID,invoice,adyen,,,RCPT_9TM8NBX,2024-01-26T18:46:00,,NULL,GB,amex,4190,3,,,stripe_export,
900192,636,fridakar22@company.se,35,n/a,8.75,2.52,,Pending,cash,square,,NULL,,2024-03-26 15:42,n/a,re_7F3MJZ8D5L,SE,VISA,9678,NULL,NaN,,stripe_export,NaN
900193,628,fatimakh971@email.com,NaN,SEK ,,,NaN,paid,bank transfer,adyen,,INV-202402-9842,NULL,26/02/2024 20:03,,,n/a,amex,,3,,,manual_sheet,
900194,385,anagarci713@email.com,40,sek,,,,payd,invoice,square,,,,,,,,visa,n/a,2,1,,stripe_export,
900195,1026,norahans581@company.se,NaN,EUR,15.0,3.24,,Pending,SWISH,klarna,,INV-202404-5547,,2024/04/30 07:11,n/a,NULL,NO,visa,5320,,,,stripe_export,
900196,1161,user6448@gmail.com,NaN,€,,,,Paid,SWISH,stripe,,,NULL,Jan 19 2024 15:30,,NULL,NO,VISA,,one,yes,2024-01-19 15:30,stripe_export,NaN
900197,360,user3208@gmail.com,20,SEK,,2.08,NaN,PAID,bank transfer,adyen,NaN,,,17/04/2024 08:58,NULL,n/a,NaN,NaN,,2,1,2024-04-17 08:58,,duplicate
900197,503,user8548@gmail.com,60,Sek,15.0,3.24,n/a,Refunded,SWISH,stripe,,INV-202401-7724,,18/01/2024 17:37,,,ES,VISA,n/a,,NaN,2024-01-18 17:37,square_export,duplicate
900199,519,luispere308@outlook.com,35,SEK,NULL,,,FAILED,cash,stripe,,n/a,,2024-05-05 17:24,,,PT,,,NaN,no,n/a,pos,manual correction
900200,943,oscarber569@company.se,15,SEK,,"1,50",13.06,payed,Card,stripe,,,,2024/04/06 08:48,,NULL,,visa,7826,,n/a,2024/04/06 08:48,manual_sheet,
900201,916,elinsven@email.com,60,NULL,15.0,,,Pending,invoice,adyen,,,RCPT_KQZLBGR,2024-04-12T17:07:00,,re_7XU75AKTC0,,mastercard,,one,NaN,,,
900202,981,user7402@email.com,,EUR,5.0,"1,50",,paid,card,klarna,,,,2024-04-24T14:07:00,,n/a,SE,mastercard,,NaN,1,2024-04-24 14:07,square_export,duplicate
900203,1034,fridakar22@company.se,15,SEK ,,1.94,,payed,bank transfer,klarna,pi_ZKZHT5D9SZ6Z,,,,n/a,re_OEWFKF5TDM,NULL,amex,NULL,3,0,2024/02/22 20:34,stripe_export,NaN
900204,501,noaherik@email.com,"15,00",EUR,3.75,1.94,,payd,Card,manual,,,,,,,n/a,VISA,,NaN,1,,manual_sheet,partial refund
900205,681,linchen175@outlook.com,NaN,€,,"1,50",,Refunded,bank_transfer,,,,RCPT_08T3R7O,17/01/2024 17:13,2024-01-17 17:13,,n/a,,,,,2024/01/17 17:13,square_export,
900206,951,luispere745@outlook.com,60,EUR,15.0,3.24,56.76,paid,invoice,square,ch_96D8GY4TTT,,,2024-02-06T14:24:00,,re_0XM22NRYKC,NULL,NaN,,NULL,,,manual_sheet,
900207,1164,emmajoha@email.com,40,SEK ,n/a,2.66,,payed,bank transfer,square,,INV-202401-5614,,,,,n/a,amex,NULL,one,NaN,,square_export,partial refund
900208,358,linchen450@email.com,15,€,,1.94,,PAID,Card,manual,ch_FHABR5PU7A,,RCPT_T3P2S37,05/01/2024 20:33,,NULL,GB,,,,yes,,NaN,
900209,273,NaN,20,Sek,5.0,2.08,,,bank transfer,manual,pi_MJ0XFEHXQ28C,INV-202402-8829,RCPT_V2Y0S39,27/02/2024 20:38,,NaN,ES,,,,0,2024/02/27 20:38,stripe_export,duplicate
900210,,davidsto391@company.se,40,Sek,,2.66,,pending,bank transfer,adyen,ch_1OD04BSUSH,,,NULL,,,NO,,,,yes,,manual_sheet,
900211,452,oscarber830@gmail.com,40,SEK ,10.0,"1,50",NaN,NaN,bank_transfer,square,ch_037UDDH85K,,NULL,12/01/2024 22:15,,,,mastercard,,,0,2024-01-12 22:15,square_export,
900212,415,maríalóp917@gmail.com,60,Sek,,,,payed,swish,stripe,NaN,INV-202403-7521,,15/03/2024 16:02,n/a,,PT,,,NaN,yes,2024-03-15 16:02,pos,
900213,870,luispere308@outlook.com,40,sek,10.0,,,Pending,swish,klarna,,,,2024/03/05 11:37,NULL,,,VISA,7078,NaN,,2024/03/05 11:37,square_export,duplicate
900214,491,user518@email.com,20,SEK ,,,,Paid,bank_transfer,square,,NULL,NaN,Mar 17 2024 10:40,NaN,,n/a,,,,0,,pos,duplicate
900215,402,liamande114@email.com,NaN,sek,,2.08,NULL,payd,Klarna,stripe,pi_SBXKX2YU865C,,,2024-04-24T16:05:00,,,,visa,,,,,pos,
900216,595,ellaberg734@gmail.com,60 SEK,Sek,15.0,"1,50",,Refunded,SWISH,manual,ch_9LBENFNX1Z,,,17/02/2024 15:06,2024-02-17 15:06,n/a,PT,,,one,yes,,stripe_export,NULL
900217,396,mikaelås584@company.se,35,Sek,,,,PAID,SWISH,stripe,ch_ZBFVPIJAWA,NaN,,2024-04-17 12:42,NaN,NaN,PT,,,NULL,,,square_export,
900218,45,user4835@email.com,20,Sek,,2.08,,refunded,card,stripe,,,,2024-04-06 14:11,n/a,NaN,,VISA,,,0,2024-04-06 14:11,,duplicate
900219,,sofiaand221@company.se,20,SEK ,,2.08,,pending,Klarna,klarna,ch_80A5BQO7WS,,,2024-02-21T22:05:00,NaN,NaN,NO,,,2,n/a,,stripe_export,partial refund
900220,688,mariamal895@email.com,25,Sek,,"1,50",,pending,bank_transfer,square,pi_GEF3R48ODLEY,,RCPT_B0W72AS,2024-02-17 18:15,NaN,NaN,NO,,3370,3,,,,NULL
900221,563,maríalóp@gmail.com,40,SEK ,,,,refunded,NULL,klarna,,,,Apr 28 2024 11:44,,,,,,NULL,,,square_export,duplicate
900222,429,ahmedali789@outlook.com,15,EUR,,1.94,,Pending,bank_transfer,square,,INV-202401-4304,,2024-02-30 12:00,NULL,n/a,NO,visa,,NULL,,,square_export,duplicate
900223,797,fridakar22@company.se,60,SEK,,NULL,NaN,Refunded,cash,klarna,pi_4WOLEP2WLNB9,NaN,,2024-02-26T19:11:00,NULL,,,NULL,,n/a,1,n/a,stripe_export,partial refund
900224,922,saralind438@company.se,,sek,,,,PAID,bank transfer,adyen,ch_DBQSC8TLV7,,,Feb 10 2024 16:10,NULL,NaN,PT,amex,,,NaN,2024-02-10 16:10,pos,
900225,276,user1018@email.com,20,€,,NULL,,payd,Klarna,manual,,NULL,,n/a,,re_YNCF7BG91V,ES,VISA,,one,yes,,,n/a
900226,185,liamande@email.com,25,SEK,6.25,2.23,,FAILED,card,square,,,,11/04/2024 15:54,NaN,,SE,n/a,n/a,2,1,2024/04/11 15:54,,NaN
900227,388,user5724@gmail.com,20,Sek,,2.08,,Paid,Klarna,square,ch_O28956I64I,,RCPT_XKSLYF6,2024-01-19T17:29:00,NaN,NaN,GB,mastercard,,,yes,2024/01/19 17:29,manual_sheet,
900228,628,user523@gmail.com,15,Sek,3.75,1.94,13.06,failed,SWISH,klarna,ch_WSNPP9JHT8,,,,NULL,,PT,mastercard,,one,0,2024-03-20 18:21,pos,
900229,925,erikholm746@gmail.com,NULL,€,6.25,,22.77,failed,swish,klarna,,,,2024-03-13T16:28:00,,,GB,amex,n/a,3,,2024/03/13 16:28,,
900230,18,NULL,25,Sek,6.25,,22.77,PAID,card,adyen,,,,2024-04-25T11:05:00,n/a,,,visa,n/a,1,no,,manual_sheet,
900231,963,NaN,60.00,Sek,NULL,,,paid,cash,adyen,,INV-202403-5537,RCPT_U1A0793,2024/03/12 12:52,n/a,,,VISA,,,no,2024-03-12 12:52,stripe_export,n/a
900232,846,norahans647@email.com,20,SEK ,,"1,50",,,Klarna,NULL,,,,Apr 23 2024 18:50,n/a,,ES,visa,,n/a,,NaN,stripe_export,
900233,1038,user9915@gmail.com,35,SEK,8.75,NULL,,PAID,card,manual,NULL,,n/a,2024-04-01 08:17,n/a,,SE,VISA,5135,,,2024/04/01 08:17,pos,
900234,922,user942@email.com,40,€,,,,Refunded,card,adyen,n/a,,RCPT_JQ1UWXE,2024-03-26 07:58,,NaN,SE,NaN,,,,2024/03/26 07:58,pos,
900235,971,oliviali224@outlook.com,35,sek,,NULL,,payed,swish,adyen,ch_GK8T068HBV,NaN,,2024-04-13T21:07:00,,,NO,,6861,,,2024-04-13 21:07,,duplicate
900236,1082,user1445@email.com,20,n/a,,NULL,17.92,payd,bank_transfer,square,ch_YSSY56QAI4,,,2024/03/08 08:52,NULL,n/a,SE,,,NULL,,2024/03/08 08:52,square_export,
900237,408,user2002@email.com,60,SEK ,15.0,,,Paid,bank transfer,klarna,,INV-202403-4096,,2024-03-03 21:55,NaN,re_AWIQ5DCCL3,PT,visa,n/a,3,n/a,2024/03/03 21:55,,partial refund
900238,1149,user7463@email.com,35,EUR,,n/a,,Pending,,adyen,,INV-202404-7477,,2024/04/02 07:44,NaN,,,VISA,,one,1,n/a,NULL,partial refund
900239,337,mikaelås792@company.se,40,Sek,,"1,50",,FAILED,invoice,manual,,,NULL,2024-01-08T12:50:00,,NaN,,,,1,,2024-01-08 12:50,square_export,NaN
900240,1152,elinsven10@gmail.com,NaN,SEK,NULL,"1,50",,failed,invoice,square,,,RCPT_QOPP9DY,2024-02-16 10:52,,NaN,ES,visa,NULL,,yes,2024-02-16 10:52,n/a,
900241,99999,user9178@email.com,35,sek,NaN,2.52,,PAID,cash,NaN,pi_M0K6L7HW3U8F,,RCPT_CPF1ZP9,2024-04-21 19:07,NaN,,PT,amex,,3,,,,
900242,1049,user4474@email.com,25,€,6.25,,,FAILED,swish,square,ch_1BM3MMTO0D,INV-202401-9556,,2024/01/25 17:55,,re_W0SI9ZV0WF,,,,one,,NaN,stripe_export,
900243,889,NULL,25,EUR,,,n/a,refunded,SWISH,,ch_JL5C80I5D1,,RCPT_BTTYJ0P,,,re_4UOBCP751M,,visa,,NULL,n/a,2024-03-25 13:14,,partial refund
900244,278,noaherik618@outlook.com,,SEK ,3.75,1.94,,refunded,bank_transfer,adyen,,,,2024/03/09 13:40,,,,,n/a,n/a,NaN,,stripe_export,
900245,1139,user4710@gmail.com,60,Sek,,"1,50",,pending,cash,klarna,ch_RHL3462TYJ,,,2024/03/10 11:18,NaN,re_2RRK7ATNXT,GB,,,2,,2024-03-10 11:18,square_export,
900246,328,n/a,,sek,,,,Paid,swish,square,ch_19ISOJEYZ1,,,05/04/2024 15:23,n/a,n/a,GB,NULL,n/a,,0,,pos,
900247,655,,60,€,15.0,"1,50",,paid,card,stripe,,,,Feb 16 2024 09:52,,re_KGU9O12LTO,GB,visa,,,,,pos,manual correction
900248,629,user8130@email.com,60,EUR,,,,NaN,bank transfer,square,pi_IF5I5BGYTW6B,,NaN,2024-04-28 11:58,,n/a,SE,amex,,,,2024/04/28 11:58,manual_sheet,
900249,312,linchen@email.com,60,€,15.0,3.24,56.76,pending,card,stripe,n/a,,,23/03/2024 18:39,,NULL,NaN,VISA,,n/a,no,n/a,,
900250,77,fatimakh311@gmail.com,20,€,,2.08,17.92,payed,cash,adyen,,n/a,RCPT_1Q4OMGF,2024-03-15 16:08,NULL,NaN,PT,mastercard,,3,,,stripe_export,
900251,995,noaherik618@outlook.com,40,,,,,failed,SWISH,stripe,,,,2024-02-03 09:06,,,,visa,,,NULL,2024/02/03 09:06,,duplicate
900252,233,anagarci@gmail.com,25,SEK ,6.25,2.23,,Pending,swish,adyen,pi_7OOARABO5GRC,,,2024-02-23 14:40,,,,,n/a,1,,,,
900253,2260,fridakar22@company.se,15 SEK,SEK ,,1.94,NULL,FAILED,cash,stripe,pi_6COEKVYSWWS8,,,2024/03/29 13:00,,,SE,amex,2845,3,n/a,2024-03-29 13:00,NULL,duplicate
900254,488,luispere308@outlook.com,20,€,,,17.92,payed,Klarna,manual,ch_2M2WDUDI2L,,,05/05/2024 22:28,n/a,,NO,NULL,,one,1,,stripe_export,duplicate
900255,675,emmajoha@email.com,,Sek,,NaN,n/a,payd,SWISH,adyen,,,,,,,,visa,7349,2,NaN,2024/02/04 18:16,,
900256,1018,linchen@email.com,20 SEK,Sek,5.0,,,paid,bank transfer,square,NULL,,,2024/04/30 10:28,,,,amex,5634,1,,2024-04-30 10:28,pos,NaN
900257,412,davidsto885@company.se,15,sek,,"1,50",13.06,FAILED,swish,adyen,,,,2024-02-24 10:02,,re_T67BC9DLR7,PT,VISA,7862,,,2024/02/24 10:02,manual_sheet,partial refund
900258,247,mikaelås@gmail.com,NULL,SEK ,NULL,2.08,,pending,swish,stripe,pi_85NTYTR7XV9O,INV-202404-7295,,,,NaN,,VISA,NULL,1,,NaN,manual_sheet,
900259,639,liamande@gmail.com,40,€,,2.66,37.34,payed,Klarna,manual,NULL,INV-202402-3672,,,n/a,NaN,ES,,,one,yes,,pos,partial refund
900260,345,ellaberg@gmail.com,NULL,SEK ,NULL,"1,50",37.34,Paid,swish,NULL,ch_QQT9GO49UB,,RCPT_LHPCK6Z,20/01/2024 15:02,n/a,re_SYZQY2CS7A,PT,visa,,,NULL,2024-01-20 15:02,pos,
900261,860,erikholm52@gmail.com,60,SEK ,,,56.76,pending,invoice,adyen,pi_HBOULMS4YVOG,,RCPT_TSXMZRU,2024-05-05 21:32,,NaN,,,,3,,2024-05-05 21:32,pos,NaN
900262,731,sofiaand221@company.se,60,Sek,15.0,3.24,,pending,bank_transfer,stripe,,n/a,,25/02/2024 08:29,n/a,n/a,,mastercard,n/a,,no,2024/02/25 08:29,square_export,
900263,39,fridakar@email.com,40,€,10.0,,,Pending,invoice,adyen,,NULL,,01/05/2024 11:48,NULL,NaN,PT,amex,,1,0,2024-05-01 11:48,stripe_export,
900264,37,luispere745@outlook.com,35,Sek,NaN,,,Refunded,bank transfer,klarna,ch_M8MQKW34NG,INV-202402-2421,,Feb 10 2024 12:21,NaN,,SE,visa,,one,,,,
900265,32,anagarci91@email.com,35,SEK ,,2.52,n/a,Paid,bank transfer,square,ch_6JB9EJIYTG,INV-202402-8640,RCPT_3ZWZJ9W,Feb 22 2024 12:50,NULL,NULL,ES,amex,,1,NaN,2024-02-22 12:50,,partial refund
900266,137,pedrosil440@email.com,NaN,EUR,n/a,,,failed,swish,adyen,NULL,,RCPT_J1MHTE4,2024-02-19 14:22,,NULL,NO,visa,,3,1,,manual_sheet,duplicate
900267,867,saralind414@email.com,35,EUR,8.75,2.52,,Refunded,Klarna,klarna,,,,2024-02-05 07:01,,,,VISA,,1,n/a,2024/02/05 07:01,stripe_export,
900268,1017,mikaelås698@email.com,20,sek,,2.08,17.92,FAILED,bank_transfer,klarna,NaN,INV-202403-9264,,2024/03/22 21:57,,,NO,n/a,,,1,2024/03/22 21:57,stripe_export,
900269,962,luispere582@gmail.com,,SEK,,2.08,n/a,failed,Card,adyen,ch_L39COAYUJU,,,,n/a,,,,,NULL,1,,stripe_export,
900270,435,ellaberg952@outlook.com,NaN,sek,10.0,,,paid,swish,adyen,pi_WTV596YIWXI5,,,03/05/2024 13:18,,,SE,amex,,3,n/a,,pos,
900271,27,anagarci482@outlook.com,20,NaN,n/a,n/a,17.92,Pending,card,adyen,,,,2024/01/18 20:35,,,n/a,,,1,yes,,square_export,partial refund
900272,,davidsto777@company.se,25,€,n/a,2.23,,FAILED,Klarna,NULL,pi_MGUK60G02YL8,,RCPT_1Q0E1Z1,2024-04-26 10:43,n/a,NULL,ES,,,NaN,0,,,
900273,355,ahmedali789@outlook.com,25,SEK ,,,22.77,Paid,invoice,adyen,ch_9UKB6V3PWG,,,18/01/2024 17:23,n/a,NULL,GB,VISA,,one,1,2024/01/18 17:23,stripe_export,
900274,745,karinlun37@company.se,20,€,,2.08,17.92,paid,swish,manual,pi_IVW47WM6VIMQ,NaN,,02/01/2024 16:03,,NaN,,n/a,,1,,2024-01-02 16:03,manual_sheet,
900275,311,erikholm@gmail.com,60,€,15.0,,56.76,failed,swish,manual,pi_OGSK2V7Y31TZ,NULL,RCPT_5I4F6D4,n/a,,,,NULL,5575,1,n/a,,,duplicate
900276,510,saralind838@email.com,25.00,Sek,6.25,,22.77,FAILED,card,manual,NaN,,,2024/01/27 08:30,,n/a,PT,,,,0,2024/01/27 08:30,n/a,
900277,1011,user9484@gmail.com,60,SEK ,,,,Pending,card,klarna,,,RCPT_MT0MUK1,,,re_9FHHGB8WRW,NULL,,,2,,,stripe_export,
900278,186,user8249@email.com,25,Sek,,,,Pending,invoice,square,ch_KZ0JVHKDKQ,,,2024/04/27 18:50,NaN,,NO,,,one,no,2024-04-27 18:50,stripe_export,
900279,137,user2480@email.com,25,€,,,,payd,cash,manual,n/a,INV-202404-5171,,Apr 29 2024 12:32,,NaN,,,,2,,2024-04-29 12:32,pos,partial refund
900280,1118,user4447@email.com,40 SEK,sek,,,,payd,bank_transfer,square,ch_ZH371H0UP4,,,May 04 2024 20:10,NULL,,GB,,,,,NULL,,
900281,1187,ahmedali255@outlook.com,35 SEK,EUR,,2.52,32.48,pending,card,klarna,ch_L6QOFEP9Y0,,RCPT_F9WB8XY,May 08 2024 22:59,,,NO,mastercard,,2,,2024-05-08 22:59,pos,
900282,89,user4575@email.com,35,sek,,,,pending,bank_transfer,adyen,pi_LVCWVZXX6LSS,,,2024/01/18 16:51,NaN,n/a,PT,,,NULL,no,,,partial refund
900283,295,user967@gmail.com,,€,8.75,2.52,,PAID,card,manual,NULL,INV-202403-3344,RCPT_5PV5FOT,yesterday,,n/a,SE,mastercard,,,yes,2024-03-08 18:09,,
900284,91,norahans10@email.com,,Sek,5.0,,,PAID,card,klarna,ch_TDXYX450QY,INV-202404-2903,RCPT_QWFFYZG,2024-04-24T07:37:00,,n/a,,mastercard,,,0,2024/04/24 07:37,pos,partial refund
900285,898,oliviali438@outlook.com,20,EUR,,2.08,,NaN,bank_transfer,adyen,ch_D6WJM9KZ06,,RCPT_LGQVIBG,2024-04-03T19:42:00,n/a,,PT,,4849,,NaN,2024-04-03 19:42,stripe_export,
900286,628,user3355@gmail.com,60,SEK,15.0,n/a,NULL,FAILED,Card,manual,,INV-202404-9703,RCPT_9O8A89Z,,NULL,,NULL,,,n/a,no,NaN,,
900287,1105,norahans@gmail.com,35,€,n/a,,,payed,Card,stripe,NaN,,RCPT_N5EVLV1,2024-04-08 07:24,,,,,,3,no,2024-04-08 07:24,manual_sheet,partial refund
900288,755,jonasnil950@outlook.com,25,SEK ,,"1,50",22.77,Pending,Klarna,manual,pi_FW1CB968Z9K8,,n/a,2024/01/30 16:27,,NaN,ES,,,one,n/a,2024-01-30 16:27,square_export,NULL
900289,158,jonasnil950@outlook.com,NaN,,NaN,,,paid,bank transfer,klarna,,,,27/04/2024 08:39,NULL,n/a,ES,visa,,one,no,2024-04-27 08:39,manual_sheet,duplicate
900290,484,user202@email.com,60,€,15.0,3.24,,payd,SWISH,manual,,INV-202402-5603,,Feb 23 2024 07:38,NaN,,,,5497,one,,2024-02-23 07:38,,manual correction
900291,1094,oliviali965@email.com,25,Sek,,,22.77,FAILED,cash,adyen,,,,2024/05/03 17:45,,NaN,NO,VISA,7536,one,1,2024/05/03 17:45,square_export,manual correction
900292,198,noaherik@email.com,40,EUR,,,,payed,bank transfer,klarna,pi_551UXLQ25WSM,INV-202403-4498,,10/03/2024 13:36,,NULL,PT,mastercard,4355,,,2024/03/10 13:36,pos,manual correction
900293,1100,user303@email.com,25,NULL,,2.23,,PAID,swish,stripe,,,NULL,2024-02-20T11:01:00,,n/a,GB,,,1,yes,2024-02-20 11:01,square_export,manual correction
900294,810,fatimakh509@gmail.com,,sek,,2.23,,failed,invoice,manual,ch_POXIOTW2RH,,RCPT_PG53R64,,n/a,,PT,visa,,n/a,,,manual_sheet,manual correction
900295,983,fridakar136@outlook.com,20,sek,,,,pending,SWISH,adyen,pi_WLE6FSZL28MM,,,2024-02-06T08:39:00,,NaN,PT,amex,,2,0,2024/02/06 08:39,n/a,duplicate
900296,975,davidsto885@company.se,25,SEK ,6.25,,,payd,Card,manual,,,,2024-01-20 16:23,NULL,NaN,GB,n/a,,1,,,stripe_export,partial refund
900297,192,fatimakh322@outlook.com,15,sek,3.75,"1,50",,PAID,Card,stripe,,,RCPT_013V9OR,May 05 2024 10:19,,,NO,VISA,,3,yes,,,duplicate
900298,984,erikholm288@gmail.com,25,sek,6.25,,,FAILED,invoice,NULL,,,,Jan 16 2024 16:39,NULL,,ES,,1552,3,,2024/01/16 16:39,pos,partial refund
900299,635,elinsven140@company.se,60,sek,15.0,,,Pending,card,n/a,pi_QVIJ7S5TFU4C,,NaN,2024-04-13 22:44,,NULL,NO,,,,1,,square_export,duplicate
900300,185,mikaelås698@email.com,40,€,,NaN,,pending,bank transfer,klarna,ch_UY4S0I9MCA,,,Mar 05 2024 07:52,,,,visa,,NaN,no,2024-03-05 07:52,square_export,n/a
900301,592,n/a,20,SEK ,5.0,,,refunded,SWISH,klarna,,,,2024/03/30 17:28,,re_05ERRFXLNQ,,,1264,one,1,2024-03-30 17:28,stripe_export,duplicate
900302,114,oliviali224@outlook.com,40,SEK ,,,,Refunded,SWISH,stripe,,,,19/03/2024 15:10,,,SE,,,2,n/a,2024/03/19 15:10,pos,
900303,657,user5179@gmail.com,25,sek,,2.23,n/a,refunded,cash,adyen,,,n/a,Jan 03 2024 09:57,2024-01-03 09:57,re_RJ49K83WCV,,n/a,n/a,1,1,,square_export,
900304,247,n/a,,SEK ,15.0,,,payed,cash,manual,,,,2024/01/16 19:08,,,,n/a,,2,no,2024/01/16 19:08,manual_sheet,
900305,763,fatimakh@gmail.com,20,€,NULL,2.08,17.92,failed,invoice,manual,NULL,,RCPT_QE8SV9J,04/04/2024 09:59,,re_G0MXKF5PPI,SE,NaN,,NULL,0,2024/04/04 09:59,stripe_export,duplicate
900306,651,maríalóp700@gmail.com,15,Sek,,,,Pending,card,stripe,,INV-202401-8589,,,NULL,n/a,PT,,,,,2024-01-15 20:37,square_export,manual correction
900307,226,ahmedali547@outlook.com,40,Sek,10.0,,,paid,bank_transfer,klarna,pi_LCV809X0UWD0,,RCPT_U8RJ3G2,2024/03/12 20:09,,,NULL,mastercard,,3,NULL,,square_export,
900308,951,NaN,20,EUR,,,17.92,failed,bank transfer,klarna,ch_XPUUT9GYW3,,,2024-01-20 13:13,,NULL,GB,mastercard,n/a,2,,2024-01-20 13:13,pos,
900309,293,n/a,25,sek,NaN,2.23,22.77,Refunded,bank transfer,,ch_HOV01E50UE,,,Jan 25 2024 14:40,2024-01-25 14:40,NaN,n/a,amex,,one,n/a,2024-01-25 14:40,n/a,
900310,576,liamande822@email.com,20,EUR,n/a,,NaN,payd,Klarna,stripe,,INV-202403-5545,,09/03/2024 21:42,,,,visa,,NaN,,,pos,partial refund
900311,809,jonasnil345@email.com,15,sek,,,,Paid,card,adyen,ch_SGQZAB3KMK,,,,,,,VISA,,,no,n/a,,
900312,248,n/a,25,EUR,6.25,"1,50",,FAILED,n/a,stripe,pi_FDJIYFIGX33C,INV-202404-6355,,2024-04-18 14:00,NaN,,,NULL,,,yes,,square_export,
900313,514,davidsto285@company.se,20,SEK ,5.0,,NULL,FAILED,Card,klarna,,,RCPT_AU91AGA,Jan 04 2024 19:23,NULL,re_OPMYC0CE24,NULL,mastercard,,,0,2024-01-04 19:23,pos,
900314,326,luispere308@outlook.com,15,€,3.75,,13.06,PAID,card,manual,ch_R2AA47MDPM,,RCPT_TE7Q3SI,2024-03-28 12:58,NaN,n/a,PT,NaN,,1,n/a,2024/03/28 12:58,pos,n/a
900315,223,user7456@email.com,40,sek,,"1,50",NULL,PAID,card,square,,INV-202403-4246,,18/03/2024 16:23,,re_A5QNLRZFRB,,n/a,2393,3,yes,,stripe_export,duplicate
900316,1162,,25,sek,n/a,,,FAILED,Klarna,manual,,,RCPT_GNOJ9NM,29/03/2024 16:10,,NaN,GB,mastercard,5566,NaN,NULL,2024/03/29 16:10,pos,partial refund
900317,967,user5854@email.com,60,sek,n/a,,56.76,refunded,Klarna,square,,,,2024-03-17 16:59,n/a,n/a,PT,amex,,one,,2024/03/17 16:59,,
900318,994,ellaberg691@outlook.com,,n/a,8.75,2.52,,Paid,bank_transfer,stripe,ch_NA6I2EHPBN,,,2024-05-06 11:41,NaN,n/a,NO,,8909,n/a,NaN,2024-05-06 11:41,square_export,partial refund
900319,1116,n/a,15,€,3.75,,NULL,Pending,SWISH,adyen,,,RCPT_3MIEVR1,2024-04-01T07:33:00,,,NO,amex,4305,1,NULL,2024/04/01 07:33,stripe_export,manual correction
900320,797,emmajoha@email.com,15 SEK,Sek,,1.94,,payed,bank transfer,adyen,,,NULL,2024-02-27T15:25:00,NaN,NULL,,,4956,one,yes,2024/02/27 15:25,pos,
900321,67,oscarber650@outlook.com,60,EUR,,,,refunded,swish,square,n/a,INV-202401-5840,,Jan 06 2024 08:56,NaN,,n/a,,,1,,,,duplicate
900322,777,,15,EUR,3.75,1.94,NaN,payd,bank transfer,manual,,NULL,,2024/04/14 20:42,,n/a,n/a,,,,1,2024-04-14 20:42,manual_sheet,partial refund
900323,201,karinlun@gmail.com,60,SEK ,15.0,3.24,,paid,card,klarna,,,,12/03/2024 13:21,,,GB,visa,1128,n/a,,2024/03/12 13:21,,NULL
900324,999,mariamal123@company.se,35,Sek,NaN,,n/a,paid,bank transfer,square,ch_B09ES4RV1O,,RCPT_19ZA96F,2024-03-28 16:37,,NULL,NO,,8371,3,0,2024-03-28 16:37,,manual correction
900325,996,NaN,35,SEK,8.75,"1,50",32.48,paid,SWISH,klarna,,INV-202402-1841,RCPT_EVDP96I,,,,SE,,,1,,2024-02-08 12:27,,
900326,666,karinlun255@gmail.com,60,SEK,NULL,NaN,56.76,Refunded,card,klarna,pi_A7XUM9TN5FB8,,RCPT_B6A5YNP,Apr 17 2024 22:16,,NaN,,,,one,,2024/04/17 22:16,stripe_export,partial refund
900327,808,ahmedali@email.com,25,SEK ,,,22.77,payd,invoice,square,pi_X25JJ9IBQMNK,,,2024-03-17 22:54,,re_KGSZOQFDWS,ES,VISA,,one,,,stripe_export,
900328,379,NaN,"40,00",Sek,NULL,,,payed,card,manual,pi_054SKV1HG6LT,,,2024-01-14 14:12,,,GB,,3291,,no,2024-01-14 14:12,,
900329,222,maríalóp917@gmail.com,35,EUR,,2.52,,Pending,Card,square,,n/a,,07/01/2024 12:04,,NULL,SE,visa,,,0,2024/01/07 12:04,square_export,duplicate
900330,512,emmajoha970@company.se,35,EUR,,2.52,,paid,bank transfer,stripe,NULL,,RCPT_0QXERH9,2024/03/21 07:01,,,SE,visa,,3,no,,pos,
900331,396,user2929@email.com,15,Sek,,,,failed,card,stripe,pi_SXE2CZYNQKI6,INV-202401-1734,,2024-01-07T12:25:00,,NULL,NULL,,3730,,1,,manual_sheet,duplicate
900332,293,liamande@gmail.com,35,NaN,8.75,"1,50",n/a,payed,bank_transfer,klarna,,,RCPT_Z697J7D,08/04/2024 20:45,,,SE,,7101,,,,stripe_export,manual correction
900333,120,saralind@gmail.com,40,SEK ,10.0,,NULL,paid,SWISH,square,,,,2024-01-11T16:38:00,,,,NaN,5297,3,,2024/01/11 16:38,,
900334,314,NULL,60,€,15.0,"1,50",56.76,Pending,swish,stripe,,NULL,,,NULL,NaN,,NaN,,,,2024/04/01 14:28,,duplicate
900335,634,sofiaand@email.com,40,SEK ,,"1,50",,payed,SWISH,square,ch_KP6BU7KIHW,,NaN,,,,,NaN,,NULL,0,2024/03/12 17:16,square_export,
900336,575,oliviali@email.com,40,€,10.0,NaN,,paid,bank transfer,klarna,,,,,,,,VISA,3354,,yes,2024/01/21 14:00,,
900337,1151,norahans586@gmail.com,60,Sek,,"1,50",,failed,card,square,pi_LJ3AG197YTR0,,NULL,04/04/2024 17:44,,n/a,,,2748,,,2024/04/04 17:44,pos,n/a
900338,977,oliviali@email.com,60,Sek,,,56.76,Pending,swish,klarna,ch_QF6OGC4KZT,,RCPT_FZIGXLM,2024-02-11T10:29:00,NaN,,SE,,,n/a,,,manual_sheet,
900339,1024,,NaN,SEK,5.0,,,pending,swish,klarna,pi_GISWQKKILGE9,NaN,,,NULL,,ES,visa,NaN,one,no,,NULL,
900340,132,user2506@gmail.com,20,EUR,,,,FAILED,invoice,stripe,ch_U3T2M44ING,NULL,,07/04/2024 21:06,,,SE,,n/a,2,yes,2024-04-07 21:06,stripe_export,
900341,687,NaN,40,Sek,10.0,"1,50",,failed,SWISH,manual,pi_TDKHP7JC6QBD,,,,,,,amex,,,,2024-03-08 19:00,square_export,
900342,780,mikaelås495@outlook.com,25,SEK,,,22.77,pending,bank_transfer,stripe,ch_42YOC7RR7Q,,,2024-01-08T11:55:00,,,NULL,,n/a,one,yes,2024-01-08 11:55,pos,
900343,1106,user8010@gmail.com,40,SEK ,NULL,,37.34,payed,bank transfer,klarna,,INV-202401-1004,RCPT_6ADT87Q,,NaN,,,,,one,no,2024/01/15 15:27,manual_sheet,manual correction
900344,1089,user1170@gmail.com,40,sek,,,,refunded,swish,klarna,ch_UKM3SRJ49C,NaN,,2024-02-13 18:44,n/a,,,VISA,,3,no,NaN,square_export,NaN
900345,16,n/a,60,EUR,NULL,,56.76,payd,card,stripe,,,,2024/03/26 13:34,,NULL,,NaN,,2,,2024-03-26 13:34,,partial refund
900346,627,user3240@gmail.com,40,€,NULL,,37.34,refunded,swish,manual,,,,,NULL,,,NULL,,,NULL,2024/03/14 12:05,,
900347,96,fridakar224@outlook.com,25,sek,,n/a,,payed,Card,adyen,,,,Feb 26 2024 09:02,NULL,,PT,,,NaN,,,,partial refund
900348,229,mariamal136@company.se,35,n/a,,"1,50",NULL,Paid,card,stripe,NaN,,,,n/a,,SE,,,2,1,NaN,NULL,partial refund
900349,986,mikaelås991@email.com,NaN,sek,,NULL,,payd,bank_transfer,manual,,,,02/05/2024 07:13,,NULL,PT,NaN,,,,2024-05-02 07:13,pos,NaN
900350,917,user5024@gmail.com,15,SEK,,,,Pending,invoice,manual,,,,Jan 08 2024 13:17,n/a,re_AZWTDC8AZ5,n/a,VISA,4997,one,n/a,2024-01-08 13:17,stripe_export,
900351,219,,15,EUR,NULL,,,FAILED,bank transfer,adyen,ch_60NI10IBA9,,,Apr 05 2024 12:12,NaN,,,,,2,no,NULL,manual_sheet,
900352,302,noaherik618@outlook.com,15,SEK,3.75,"1,50",13.06,Pending,Klarna,manual,,NULL,,22/02/2024 17:45,,,,n/a,,NULL,,,n/a,NaN
900353,487,user8911@gmail.com,25,€,,,NULL,FAILED,bank_transfer,stripe,pi_TZ11HD38MCQG,,,n/a,,n/a,NO,,9913,,n/a,NaN,,
900354,834,saralind694@outlook.com,60,EUR,,,,failed,swish,manual,pi_OQXQD1W4RQB9,NaN,,2024-02-06T20:46:00,,,,,5924,2,no,2024-02-06 20:46,pos,NaN
900355,91,NULL,20,€,NULL,,17.92,Pending,bank_transfer,stripe,,,RCPT_T6588XM,18/02/2024 11:30,,NaN,NO,amex,,one,no,2024/02/18 11:30,NaN,
900356,798,mariamal@gmail.com,35,SEK ,NULL,"1,50",32.48,FAILED,Klarna,manual,pi_IXUY4FTP1ST3,INV-202401-5477,RCPT_6KCRL2T,Jan 23 2024 07:53,NaN,n/a,GB,amex,NaN,NULL,n/a,2024/01/23 07:53,,
900357,884,oliviali438@outlook.com,60,SEK ,15.0,,56.76,paid,invoice,stripe,,,,2024-04-24 10:26,,NaN,GB,,5927,one,NaN,2024/04/24 10:26,stripe_export,manual correction
900358,839,n/a,35,Sek,n/a,2.52,,refunded,SWISH,stripe,,,NULL,10/05/2024 08:46,,n/a,ES,n/a,,NaN,n/a,2024-05-10 08:46,square_export,duplicate
900359,1188,emmajoha@gmail.com,60,SEK ,,3.24,56.76,pending,card,adyen,,INV-202403-6937,,Mar 09 2024 17:06,,,,,9829,one,,2024/03/09 17:06,stripe_export,duplicate
900360,923,norahans@email.com,15,SEK ,,NULL,,paid,swish,manual,NaN,,RCPT_YW2PY36,,,re_PAUK18HCNW,NO,mastercard,3317,,1,2024/03/02 14:04,pos,duplicate
900361,976,user6748@email.com,25,€,6.25,n/a,n/a,paid,card,klarna,pi_E500SMGKXHG6,INV-202401-7595,NaN,02/01/2024 17:36,,,PT,visa,,2,,2024-01-02 17:36,,manual correction
900362,535,ellaberg@email.com,25,Sek,,,22.77,paid,Card,square,pi_K5WRSJW5O8MS,,n/a,2024/02/03 18:25,,re_7AKH0MTK1Z,,,,,NaN,,manual_sheet,
900363,467,jonasnil@gmail.com,15,,3.75,,13.06,pending,bank_transfer,stripe,,INV-202404-5507,,2024-04-08T16:42:00,NaN,,PT,,,NaN,NULL,2024/04/08 16:42,,
900364,283,user1576@gmail.com,40,€,,,,Pending,swish,stripe,ch_GXS2GXLV3Y,,,Jan 15 2024 19:41,n/a,,PT,,,n/a,yes,,,duplicate
900365,845,mikaelås@gmail.com,60,SEK,NULL,"1,50",NaN,paid,swish,klarna,ch_CTZBYIPWMO,INV-202402-3971,,02/02/2024 10:56,,NULL,,visa,1934,one,yes,2024-02-02 10:56,pos,partial refund
900366,341,user4260@gmail.com,60,Sek,15.0,3.24,56.76,refunded,SWISH,square,,NULL,RCPT_X0D6C8M,2024-03-06 14:58,2024-03-06 14:58,n/a,ES,NaN,,,0,,manual_sheet,manual correction
900367,900,user9652@email.com,25,Sek,NaN,NULL,22.77,FAILED,Card,manual,,INV-202401-8401,,,,NULL,ES,amex,,2,1,2024/01/07 20:57,,duplicate
900368,785,maríalóp@email.com,40,SEK ,,"1,50",,NaN,cash,adyen,ch_TIZV6N0AYP,,n/a,23/04/2024 19:24,,,GB,NaN,6978,,,,square_export,
900369,239,user8912@email.com,40,EUR,10.0,"1,50",37.34,PAID,bank transfer,manual,NaN,,,11/04/2024 10:08,,n/a,,,NULL,NaN,1,2024-04-11 10:08,stripe_export,manual correction
900370,1162,linchen450@email.com,35,sek,n/a,2.52,,failed,invoice,manual,ch_3CS3KK6ODB,INV-202401-4870,NaN,2024-01-29 13:24,NULL,,NO,amex,,3,,2024-01-29 13:24,,
900371,923,liamande293@outlook.com,15,sek,,,NULL,failed,Card,stripe,n/a,,,Feb 29 2024 18:33,NULL,NULL,PT,,,,0,,stripe_export,
900372,416,,15.00,EUR,,NaN,,PAID,SWISH,klarna,pi_A6XG6F4JMW4B,,RCPT_U6I1N7V,,,n/a,SE,mastercard,6776,3,0,NULL,pos,partial refund
900373,716,luispere308@outlook.com,NaN,EUR,,2.23,n/a,payed,swish,square,NULL,INV-202403-4058,NULL,2024/03/16 08:34,,NaN,SE,,,,,,NaN,NaN
900374,884,sofiaand729@company.se,20,SEK,5.0,,,failed,Klarna,manual,,INV-202402-8260,,2024/02/15 18:06,,NULL,NO,NULL,,one,,n/a,square_export,
900375,670,oscarber650@outlook.com,20,€,NULL,"1,50",NULL,Pending,bank transfer,,,,,2024-05-07 22:19,NaN,n/a,NO,,,,yes,,pos,
900376,680,noaherik391@email.com,40,sek,,NaN,,pending,SWISH,klarna,NaN,,,24/04/2024 18:02,NaN,NaN,NO,mastercard,5782,,yes,,,NULL
900377,824,,40,SEK ,10.0,,,Pending,invoice,stripe,ch_HZZ81XPTPX,INV-202402-7836,,Feb 08 2024 10:49,,NaN,NO,amex,7069,,0,2024-02-08 10:49,stripe_export,
900378,316,user8605@email.com,20,SEK,,"1,50",,Refunded,,manual,pi_00UL60OFAUTB,,,Feb 21 2024 12:19,NULL,NULL,GB,,n/a,2,1,,manual_sheet,duplicate
900379,1126,oscarber577@email.com,15,EUR,3.75,"1,50",,Paid,SWISH,adyen,,,,Apr 14 2024 20:36,,,,mastercard,2146,3,,2024-04-14 20:36,pos,manual correction
900380,556,user4774@email.com,40,Sek,,,37.34,Refunded,Klarna,square,,INV-202404-9910,RCPT_VYU50JR,2024-04-09 07:28,,,NO,,2723,one,NaN,2024-04-09 07:28,manual_sheet,duplicate
900381,648,n/a,20,SEK,,2.08,17.92,PAID,bank transfer,square,,NaN,,Feb 02 2024 16:57,,n/a,PT,,NaN,one,,,stripe_export,
900382,570,,,Sek,3.75,"1,50",n/a,Paid,bank transfer,adyen,,,,,n/a,re_MWCD5I9B8R,NaN,amex,,NULL,yes,NaN,stripe_export,manual correction
900383,281,n/a,60.00,sek,15.0,,,Refunded,Klarna,adyen,,,,2024/04/04 10:22,NaN,,PT,n/a,5941,NaN,,,,
900384,1069,norahans581@company.se,35,SEK ,8.75,,,refunded,swish,stripe,,INV-202401-5993,RCPT_JHEL536,,NULL,n/a,PT,amex,7534,one,,,square_export,partial refund
900385,595,noaherik618@outlook.com,20,,NULL,,17.92,payd,Klarna,adyen,pi_F7K8UN8WIGTH,NaN,RCPT_16ERTCY,06/04/2024 11:12,,,PT,amex,,,1,,square_export,partial refund
900386,700,NULL,60,sek,15.0,3.24,,payed,card,adyen,ch_VTY16JGK48,,,,,n/a,NO,,7289,,yes,,stripe_export,
900387,335,user164@email.com,15 SEK,SEK ,,n/a,,FAILED,swish,adyen,pi_HQAH8VKJ406A,,,10/04/2024 22:26,,,GB,,4322,,NULL,2024/04/10 22:26,manual_sheet,
900388,859,erikholm288@gmail.com,40,SEK ,,NaN,,PAID,cash,square,pi_IDKO286KMTXY,INV-202404-1549,NULL,,,NULL,,VISA,,,,2024/04/10 11:16,pos,
900389,709,liamande822@email.com,60,Sek,15.0,,,Paid,SWISH,square,,,,2024-02-28T09:23:00,NULL,,,visa,,,0,2024/02/28 09:23,pos,partial refund
900390,547,maríalóp333@email.com,35,sek,,n/a,32.48,payd,Card,stripe,ch_CSYEFGX3WU,,,,n/a,NULL,NO,,NULL,3,yes,2024-02-01 08:59,square_export,duplicate
900391,213,user2041@gmail.com,40,EUR,10.0,,,NULL,Card,n/a,ch_2QCOOODYFJ,,RCPT_0R4IKGR,2024/02/13 14:40,,,NO,amex,,1,1,,manual_sheet,
900392,141,user2251@gmail.com,35,EUR,,,,payd,invoice,klarna,,,,NaN,NULL,NaN,GB,visa,,3,1,2024-03-20 10:38,pos,partial refund
900393,658,fatimakh311@gmail.com,25,sek,6.25,2.23,,,bank transfer,klarna,NaN,,,,,NULL,GB,visa,,one,NaN,,,manual correction
900394,505,sofiaand221@company.se,20,SEK ,,,,payd,SWISH,klarna,pi_SO8HMOVZXJE4,,,,NULL,,,,NULL,one,,2024/02/09 10:11,stripe_export,manual correction
900395,579,ahmedali@gmail.com,35,sek,,NaN,32.48,failed,Klarna,stripe,,,,Mar 11 2024 16:00,,,SE,amex,8678,NULL,NaN,,stripe_export,partial refund
900396,572,,40,sek,10.0,NULL,,paid,invoice,,pi_9NC9A1XQZ4W1,,,NULL,,NaN,NO,,,,,,square_export,manual correction
900397,,mikaelås991@email.com,40,SEK ,10.0,,,failed,bank transfer,,n/a,NULL,,31/03/2024 11:31,,,NO,visa,,NaN,NaN,2024/03/31 11:31,stripe_export,
900398,824,elinsven140@company.se,15,EUR,,1.94,13.06,FAILED,bank_transfer,manual,pi_UF9P6LX84OFS,,RCPT_VWK3JXK,,,NULL,PT,,NaN,n/a,0,2024/01/02 17:02,,duplicate
900399,528,erikholm220@email.com,20,NaN,,,17.92,Refunded,Klarna,square,,,,12/04/2024 16:49,n/a,NaN,,,2378,,no,,square_export,
900400,338,user532@email.com,20,EUR,5.0,n/a,,failed,Klarna,adyen,,,,2024/04/21 20:14,,,,,,n/a,NaN,,stripe_export,NULL
900401,548,pedrosil754@gmail.com,35,SEK ,8.75,NaN,n/a,pending,swish,klarna,n/a,NULL,,2024/01/25 22:44,,,,visa,,,1,2024-01-25 22:44,manual_sheet,
900402,101,jonasnil@email.com,15,€,3.75,,13.06,refunded,Card,adyen,,INV-202402-8336,,2024-02-29T21:04:00,NaN,n/a,PT,NULL,,,,2024-02-29 21:04,square_export,
900403,937,user6740@gmail.com,15,SEK ,3.75,NULL,,paid,Card,stripe,pi_OMOQZWGTZO4J,,,16/03/2024 15:05,,,PT,,9934,3,,,pos,n/a
900404,679,luispere745@outlook.com,20,€,5.0,,NULL,paid,Card,square,ch_MLT5HSL03R,,,Feb 21 2024 09:25,,,,n/a,,NULL,no,2024-02-21 09:25,stripe_export,n/a
900405,498,luispere760@company.se,35,€,,,,refunded,bank transfer,NULL,NULL,,RCPT_7G3MI83,May 08 2024 09:24,,re_TBZEFVMB4Y,NO,visa,2361,,,2024-05-08 09:24,pos,duplicate
900406,1115,linchen@email.com,15,€,,,,Pending,bank_transfer,adyen,pi_16Q73YSFVLS4,,,2024-03-13 16:30,,NULL,GB,n/a,NULL,one,,,,
900407,447,linchen811@email.com,NULL,sek,,2.23,22.77,payed,NaN,adyen,,,,06/01/2024 13:21,NULL,,,NULL,NULL,1,,2024-01-06 13:21,pos,
900408,499,sofiaand@email.com,20,sek,,,,pending,swish,square,ch_Q8OH18JVSD,,RCPT_7LLCOZB,29/04/2024 15:33,NULL,,,visa,,1,,,square_export,partial refund
900409,211,NULL,20,SEK ,,"1,50",,payd,card,klarna,pi_6HK9TUND6PKL,INV-202404-8923,RCPT_PYODZ5M,,,,,mastercard,3696,one,0,,pos,NULL
900410,26,liamande101@company.se,25,SEK,,n/a,22.77,refunded,cash,manual,,,RCPT_9KA7IVK,,NaN,,SE,visa,,NULL,,,stripe_export,partial refund
900411,963,noaherik618@outlook.com,35,sek,,,,FAILED,invoice,stripe,ch_BB910L5F8G,,,19/03/2024 12:28,n/a,NULL,NaN,amex,1992,NULL,1,2024/03/19 12:28,manual_sheet,
900412,1093,user8367@gmail.com,20,EUR,5.0,NULL,,payed,swish,square,,INV-202405-6030,,2024-05-02T08:15:00,,NaN,NO,,7272,1,n/a,2024-05-02 08:15,manual_sheet,partial refund
900413,294,saralind135@email.com,15,sek,3.75,NaN,13.06,failed,bank_transfer,manual,,INV-202405-3532,NaN,May 10 2024 18:17,NULL,,PT,NaN,,3,,2024-05-10 18:17,pos,manual correction
900414,222,karinlun871@gmail.com,40,EUR,10.0,2.66,,paid,NaN,square,,NULL,,2024/02/28 22:29,NULL,n/a,GB,,7047,,,2024/02/28 22:29,,
900415,630,fridakar22@company.se,20,SEK ,5.0,,,failed,SWISH,klarna,,,,May 06 2024 08:52,,NaN,NO,visa,7649,,NULL,2024-05-06 08:52,,NaN
900416,567,pedrosil@email.com,40,SEK ,10.0,,,FAILED,Card,klarna,ch_OMTF0W5U34,INV-202405-5910,,May 06 2024 14:00,,NaN,SE,,,3,no,2024-05-06 14:00,square_export,
900417,26,maríalóp@gmail.com,15,NaN,NaN,"1,50",13.06,failed,swish,stripe,,INV-202401-2941,,Jan 27 2024 14:48,,NULL,,amex,,,1,,manual_sheet,partial refund
900418,701,liamande@email.com,25,Sek,,n/a,,payd,SWISH,manual,ch_6OCN89MXIC,,,2024-03-08T09:12:00,n/a,NaN,GB,VISA,,3,,n/a,square_export,duplicate
900419,642,user3803@gmail.com,15,,3.75,,13.06,Paid,SWISH,square,ch_SYORZ2K8P4,INV-202403-7880,RCPT_T11CQS2,Mar 11 2024 19:29,NaN,NaN,,VISA,,2,,,stripe_export,
900420,302,NULL,60,SEK,15.0,3.24,,refunded,cash,klarna,,INV-202401-2233,,26/01/2024 18:00,n/a,,PT,n/a,4801,3,yes,2024/01/26 18:00,stripe_export,duplicate
900421,1076,mikaelås@email.com,,EUR,NaN,"1,50",,paid,Klarna,square,,,,,,NaN,ES,visa,,,0,,pos,partial refund
900422,144,fridakar823@gmail.com,20,,5.0,,,,swish,square,pi_5ZOSJVES2L3O,INV-202404-3551,,2024-04-12T17:13:00,,NaN,GB,amex,,2,,2024/04/12 17:13,pos,
900423,1167,anagarci@email.com,20,€,,"1,50",,failed,Klarna,manual,pi_Q3E5D78T0Q41,,,Feb 17 2024 18:48,NULL,NULL,,VISA,n/a,3,0,2024-02-17 18:48,manual_sheet,
900424,380,maríalóp527@gmail.com,25 SEK,NULL,,NULL,,paid,swish,adyen,pi_5EJW0HSYTROI,,,31/03/2024 19:13,NaN,n/a,GB,,,,,2024-03-31 19:13,manual_sheet,NULL
900425,,mikaelås698@email.com,NULL,SEK ,,"1,50",37.34,Pending,Card,stripe,pi_D19X4PIKNQJ0,,RCPT_F44M9P9,29/04/2024 17:42,NULL,NaN,NO,,NULL,n/a,1,,square_export,NaN
900426,28,user6620@gmail.com,20,sek,5.0,,,Paid,card,adyen,pi_HBQWISNQ257I,,RCPT_BXT27V2,,NaN,,,,NaN,1,,,manual_sheet,
900427,1199,ellaberg709@gmail.com,60,SEK,,3.24,NaN,PAID,Klarna,klarna,,,,Feb 21 2024 07:27,NaN,,NULL,mastercard,,2,NaN,2024/02/21 07:27,pos,
900428,612,maríalóp917@gmail.com,40,EUR,,2.66,,payed,cash,klarna,pi_XQOFZNYKTKPK,,,2024-04-24 17:57,,n/a,NO,mastercard,NULL,n/a,,2024-04-24 17:57,manual_sheet,
900429,42,sofiaand369@gmail.com,40 SEK,€,10.0,n/a,37.34,Refunded,bank transfer,klarna,,INV-202403-5750,RCPT_H3C1OMR,Mar 20 2024 14:29,NULL,re_C8VWG5ZG4H,,,NaN,3,NaN,2024/03/20 14:29,pos,partial refund
900430,263,linchen129@outlook.com,60,€,,,56.76,refunded,Klarna,stripe,pi_6HNNFDJZK5VU,INV-202403-9445,RCPT_MIMPHDU,2024-03-31T16:29:00,,NaN,,,NULL,2,,,pos,n/a
900431,368,jonasnil@email.com,15,sek,NaN,1.94,,Paid,cash,square,NaN,INV-202404-9731,,2024-04-27 13:43,,,,VISA,2889,,1,2024-04-27 13:43,square_export,partial refund
900432,1118,norahans358@company.se,,SEK ,15.0,,,PAID,swish,adyen,ch_20Z67PB27I,INV-202402-9744,,2024/02/07 15:02,,NaN,,,,2,no,,manual_sheet,
900433,851,erikholm@email.com,20,sek,NULL,,,FAILED,Card,square,pi_EPRN2SNZDT9E,INV-202404-9834,NaN,2024-04-13T08:44:00,,n/a,,mastercard,,,,2024-04-13 08:44,pos,partial refund
900434,434,NaN,"40,00",sek,,2.66,37.34,PAID,Klarna,stripe,,INV-202403-2217,,2024-03-16T12:17:00,,n/a,,NaN,5036,1,no,2024-03-16 12:17,,
900435,1097,mikaelås734@outlook.com,40,EUR,,n/a,,pending,card,stripe,,,NULL,Apr 05 2024 11:18,n/a,NaN,,visa,,n/a,no,2024-04-05 11:18,,
900436,340,karinlun374@outlook.com,60,sek,,n/a,,payed,bank transfer,square,,,,2024-04-17 21:13,,,NO,VISA,,2,,2024/04/17 21:13,,
900437,14,erikholm288@gmail.com,"15,00",sek,,,,Paid,Klarna,klarna,,,,n/a,,NaN,PT,,6668,,NaN,2024-03-20 12:39,,manual correction
900438,642,karinlun@email.com,35,Sek,8.75,NaN,NULL,payed,card,stripe,pi_LFFLYQU3I8V3,,n/a,2024/02/14 12:26,,,SE,n/a,1341,2,no,n/a,manual_sheet,
900439,586,davidsto391@company.se,60,SEK ,15.0,"1,50",,Paid,cash,stripe,NULL,,n/a,2024-03-23T09:18:00,,NaN,SE,amex,,NULL,,NaN,stripe_export,
900440,636,erikholm735@email.com,60,sek,,,,paid,SWISH,klarna,,INV-202403-8333,,Mar 12 2024 08:32,,re_KTK40CLL1C,PT,,,3,n/a,2024/03/12 08:32,NaN,
900441,940,user3838@gmail.com,,€,,,,pending,cash,stripe,ch_6IPARYBH70,,,06/05/2024 17:20,,n/a,ES,NaN,,1,0,2024-05-06 17:20,manual_sheet,partial refund
900442,1192,jonasnil@email.com,40,€,10.0,2.66,NaN,failed,swish,square,,,,2024/01/29 21:45,NaN,n/a,ES,VISA,3078,,,2024/01/29 21:45,manual_sheet,partial refund
900443,76,n/a,15,SEK,3.75,,,pending,bank transfer,square,pi_JF28W6F7GPMH,,,2024-03-10 18:57,NULL,n/a,PT,amex,,,n/a,2024/03/10 18:57,square_export,manual correction
900444,42,user8493@email.com,60,SEK,,"1,50",56.76,PAID,Klarna,klarna,,,,,NaN,NULL,GB,amex,5671,,n/a,2024-04-25 21:38,pos,
900445,784,oscarber569@company.se,60,SEK,15.0,,NaN,pending,Card,square,pi_VH6S21FAV6HB,INV-202403-6002,,2024-03-28 22:41,,,,NULL,,NULL,,n/a,stripe_export,
900446,227,user7463@gmail.com,40,SEK,10.0,"1,50",37.34,refunded,Klarna,n/a,,,,10/05/2024 09:51,,,NO,visa,8921,,,,,manual correction
900447,763,norahans581@company.se,15,SEK ,3.75,,,FAILED,invoice,adyen,,INV-202402-2136,,2024-02-09 19:06,n/a,,ES,,,,,2024-02-09 19:06,stripe_export,n/a
900448,545,erikholm735@email.com,NaN,€,10.0,,37.34,payed,,manual,,INV-202403-1182,,,,NULL,SE,VISA,,n/a,NULL,2024/03/15 14:18,stripe_export,
900449,706,user4374@email.com,15,EUR,3.75,"1,50",,paid,,klarna,pi_ETKD8PLMOVR4,,RCPT_BUH3AOO,,,NaN,SE,mastercard,7346,1,yes,2024/03/15 11:27,square_export,n/a
900450,896,noaherik391@email.com,20,SEK,NaN,NULL,,refunded,bank transfer,klarna,,,NaN,2024-03-02 07:36,,n/a,n/a,amex,,n/a,,2024-03-02 07:36,square_export,NULL
900451,204,ahmedali255@outlook.com,20,EUR,5.0,NaN,NaN,refunded,bank_transfer,klarna,ch_GTZMAV1A1S,,,2024-05-01 17:22,NULL,,PT,amex,NULL,,NaN,,pos,manual correction
900452,268,user5932@gmail.com,25,EUR,NULL,,,refunded,cash,stripe,ch_N84MJ4YO98,,,2024-05-01 21:02,2024-05-01 21:02,n/a,SE,VISA,,3,0,,manual_sheet,
900453,1042,,20,sek,,,17.92,pending,bank_transfer,adyen,,,,2024-01-06T20:40:00,NaN,n/a,NO,VISA,NULL,,1,,NaN,duplicate
900454,500,user2371@gmail.com,20,EUR,n/a,,17.92,FAILED,bank_transfer,manual,,,,Mar 05 2024 20:36,,NaN,SE,n/a,,1,,2024-03-05 20:36,stripe_export,
900455,1168,user1553@email.com,60,EUR,NULL,,,FAILED,invoice,stripe,,,RCPT_BOWHPK5,,NULL,NaN,NO,VISA,5807,,no,2024/05/01 22:14,stripe_export,partial refund
900456,1080,n/a,35,sek,n/a,,,paid,invoice,square,ch_5DKDFFN1PO,,RCPT_WCSA6UP,Jan 08 2024 22:50,n/a,n/a,NO,,,,NULL,2024/01/08 22:50,stripe_export,manual correction
900457,484,davidsto885@company.se,15,,3.75,"1,50",13.06,failed,bank transfer,klarna,NULL,,,,,,,NULL,2714,,,2024-04-21 07:32,manual_sheet,manual correction
900458,293,user7857@gmail.com,60,€,,"1,50",NaN,pending,card,manual,,,,11/02/2024 12:27,NULL,,SE,,8601,3,yes,2024/02/11 12:27,,n/a
900459,1001,anagarci248@company.se,60,sek,,"1,50",NaN,FAILED,cash,,,,RCPT_KQ5M4W4,Jan 23 2024 14:37,,NULL,PT,,9109,,,,manual_sheet,partial refund
900460,677,liamande@email.com,60,SEK ,,NaN,,refunded,Card,klarna,,,,2024/04/17 15:09,,n/a,,visa,,NaN,,,stripe_export,NULL
900461,1158,fatimakh322@outlook.com,60,sek,,,,failed,bank_transfer,stripe,NaN,,,27/02/2024 17:08,,NaN,GB,mastercard,,,NULL,,,
900462,777,,20,sek,5.0,,17.92,Refunded,bank transfer,square,,,RCPT_4DHFCF0,Apr 07 2024 10:58,2024-04-07 10:58,,PT,visa,,,NULL,2024-04-07 10:58,,partial refund
900462,122,jonasnil@email.com,40,sek,,,n/a,refunded,swish,manual,,,,2024-03-29 13:37,,re_8ZXMIPT1AM,ES,VISA,,,0,2024-03-29 13:37,pos,
900464,183,user204@email.com,,€,6.25,"1,50",,Refunded,bank transfer,stripe,NULL,,RCPT_0134PDO,Feb 27 2024 21:39,NULL,NULL,SE,NaN,,2,1,2024/02/27 21:39,pos,
900465,244,mikaelås495@outlook.com,40,SEK ,,2.66,,pending,card,manual,,NaN,,2024/04/04 13:15,NULL,,NO,amex,NULL,,0,2024-04-04 13:15,stripe_export,duplicate
900466,708,user5320@email.com,20,EUR,,,17.92,refunded,Klarna,NULL,,,NaN,2024/05/06 08:08,2024-05-06 08:08,re_1E0WXDMTDO,NO,NaN,,2,,,manual_sheet,partial refund
900467,1150,linchen129@outlook.com,40,sek,,,37.34,paid,Card,square,,,,19/03/2024 08:50,NULL,,SE,visa,,,,2024-03-19 08:50,stripe_export,
900468,220,user1564@gmail.com,60,SEK ,15.0,,,FAILED,NULL,klarna,,,RCPT_GPMZQUT,2024-02-26T10:43:00,,NULL,PT,,,,,2024-02-26 10:43,n/a,NaN
900469,1097,oliviali224@outlook.com,35,,8.75,"1,50",,payd,bank transfer,adyen,NaN,,,2024-05-03 12:23,,,SE,VISA,8725,1,yes,,,
900470,614,user7320@gmail.com,35,Sek,,,NULL,Refunded,invoice,stripe,,,RCPT_3N5AYJC,2024-01-20T16:17:00,NULL,,NaN,VISA,NaN,,NULL,,square_export,NULL
900471,734,,15,SEK ,,"1,50",13.06,payd,cash,klarna,,,,Mar 31 2024 20:20,,,ES,visa,,3,yes,NaN,manual_sheet,
900472,578,user6659@gmail.com,25,Sek,,,NULL,PAID,bank transfer,klarna,,INV-202401-6430,,Jan 27 2024 13:15,n/a,,NaN,visa,3270,1,no,2024-01-27 13:15,,NaN
900473,995,user6084@gmail.com,"60,00",sek,,"1,50",56.76,Paid,invoice,adyen,,NULL,RCPT_DODLYFF,Jan 08 2024 18:02,NaN,n/a,,VISA,,3,0,NaN,,
900474,1100,norahans10@email.com,25,Sek,6.25,n/a,,Pending,Klarna,,,,,Feb 21 2024 07:35,,n/a,ES,visa,2947,1,,2024/02/21 07:35,square_export,manual correction
900475,489,user3446@email.com,25,SEK,,,NULL,pending,invoice,klarna,ch_P9UP7IMJ7J,INV-202404-9427,RCPT_BXDK7QI,2024-04-21 19:08,NaN,,PT,,,1,n/a,,pos,manual correction
900476,170,noaherik618@outlook.com,40,sek,10.0,2.66,,Paid,Klarna,stripe,ch_T257MHS49C,,RCPT_Y0KI44B,,NaN,n/a,,n/a,,2,no,2024/02/08 14:45,manual_sheet,NaN
900477,437,user9369@email.com,35,SEK,,"1,50",,refunded,cash,manual,NULL,,,2024-02-08T07:27:00,,,,VISA,9540,NULL,NULL,2024-02-08 07:27,manual_sheet,partial refund
900478,886,emmajoha203@gmail.com,20,SEK ,,,,FAILED,invoice,square,pi_4KCQYZ31B6QM,NaN,,Jan 07 2024 18:18,,NaN,,,,1,,2024/01/07 18:18,pos,
900479,914,luispere513@gmail.com,25,€,NULL,"1,50",,payd,SWISH,manual,,,,,NULL,,SE,,,1,n/a,2024/02/13 20:14,,partial refund
900480,1059,luispere308@outlook.com,25,NaN,,NaN,NULL,Pending,Klarna,manual,ch_VHOVXVG1RE,INV-202402-8194,,2024-02-09T17:15:00,NULL,NaN,,amex,,3,no,2024-02-09 17:15,pos,NaN
900481,847,oskarber67@company.se,15,SEK,,"1,50",,FAILED,bank transfer,square,ch_VRCJV1H2QS,INV-202404-3863,RCPT_GCNXX23,2024-04-17T16:06:00,,NULL,,NULL,,,no,2024-04-17 16:06,,n/a
900482,286,user4424@email.com,20,SEK ,5.0,2.08,17.92,refunded,SWISH,klarna,pi_CC3JGXMIXW00,INV-202402-9124,,2024-02-11 22:29,,NaN,NULL,n/a,,one,yes,2024/02/11 22:29,square_export,
900483,554,NaN,20,€,,,,FAILED,bank_transfer,klarna,,,,2024/04/25 22:31,NaN,,,VISA,,3,0,,pos,duplicate
900484,311,,25,€,NULL,,22.77,Paid,SWISH,klarna,ch_GWHHE6IJQS,,,n/a,n/a,n/a,PT,,,n/a,1,,pos,manual correction
900485,,user7836@gmail.com,35,€,,"1,50",,pending,invoice,manual,pi_HTOZ9EMMBJEH,INV-202404-9100,,09/04/2024 16:26,NULL,re_EQZ436SX73,,amex,,3,no,2024-04-09 16:26,manual_sheet,NULL
900486,167,pedrosil@email.com,35 SEK,SEK,,"1,50",n/a,PAID,cash,adyen,pi_7NAOBIDSB7S0,INV-202405-9198,,2024/05/03 17:32,,NaN,SE,amex,,NaN,,n/a,,duplicate
900487,802,NULL,60,sek,15.0,,,payed,bank transfer,square,,,,2024/01/17 17:32,n/a,,PT,,,,n/a,NULL,square_export,
900488,1077,karinlun@gmail.com,15,EUR,,,13.06,payed,card,adyen,pi_87MJHY79QOT3,,,2024-02-29T10:20:00,,,GB,,9141,NaN,1,2024-02-29 10:20,manual_sheet,duplicate
900489,564,NaN,25,EUR,,"1,50",,paid,bank transfer,manual,,,RCPT_PDKXM7Q,2024-01-29 16:57,,NaN,,,,,1,,pos,
900490,663,user9959@email.com,20,SEK,,2.08,,FAILED,cash,adyen,pi_AN6XDAY4004P,INV-202405-7805,,2024-05-04T20:24:00,,,,,,NULL,NaN,2024-05-04 20:24,pos,partial refund
900491,480,ahmedali@email.com,25,EUR,6.25,"1,50",,FAILED,swish,square,pi_862UWHTVTGAN,NULL,RCPT_G7M5KUA,NaN,,n/a,,VISA,,one,1,2024-01-09 07:39,,manual correction
900492,1099,mariamal803@email.com,35,SEK ,,,,refunded,swish,,ch_KO912BPCYE,,,26/03/2024 10:30,,re_YAYHJCGX27,,NaN,8638,NULL,NULL,2024/03/26 10:30,,partial refund
900493,560,mikaelås495@outlook.com,60,sek,,,,refunded,bank transfer,adyen,,INV-202402-5973,RCPT_OODDM9X,2024/02/27 15:48,NULL,n/a,PT,VISA,,2,NULL,2024/02/27 15:48,pos,duplicate
900494,538,sofiaand221@company.se,35,sek,,2.52,n/a,pending,cash,square,pi_IYGS90QM5PWU,,RCPT_HUGTYNZ,2024-04-19 10:14,,,ES,NULL,,,no,2024/04/19 10:14,square_export,manual correction
900495,786,user3646@email.com,25,SEK,,"1,50",22.77,payd,cash,klarna,pi_ISGZWCV2WRBT,INV-202402-1055,,Feb 25 2024 09:43,,n/a,GB,amex,NaN,1,,2024-02-25 09:43,pos,duplicate
900496,1042,luispere745@outlook.com,20,SEK,,2.08,,FAILED,card,stripe,,,,,NULL,n/a,,mastercard,,1,no,,stripe_export,
900497,301,karinlun37@company.se,60,sek,,,,paid,invoice,klarna,pi_0FYPV9ROQZWO,INV-202404-8021,RCPT_4C738L2,Apr 24 2024 15:45,,,GB,,,2,NULL,,stripe_export,duplicate
900498,551,maríalóp700@gmail.com,,€,n/a,,37.34,FAILED,cash,square,,,RCPT_BDKABZ0,,,NULL,NO,visa,,2,,2024/03/26 17:30,n/a,manual correction
900499,1121,noaherik@gmail.com,15,SEK ,,1.94,,paid,bank transfer,square,,,,2024-03-30 07:44,,NULL,GB,visa,NULL,2,1,2024/03/30 07:44,,n/a
900500,948,ellaberg261@gmail.com,15,SEK,,,13.06,payed,invoice,adyen,ch_Y1NXXGJZ8W,INV-202401-9809,,2024-01-02T08:52:00,n/a,,,,,,0,,,partial refund
900501,1138,ahmedali@email.com,20,sek,n/a,,17.92,PAID,SWISH,klarna,,INV-202405-1429,,May 09 2024 09:02,NULL,,PT,mastercard,7577,NaN,NaN,2024/05/09 09:02,manual_sheet,
900502,824,fridakar22@company.se,"35,00",SEK,,"1,50",32.48,Pending,bank transfer,manual,ch_LCV8FONOUM,,RCPT_6GIDY4Z,2024-04-15T10:09:00,n/a,,SE,,,,yes,2024-04-15 10:09,square_export,NaN
900503,820,user7597@email.com,40,EUR,10.0,2.66,37.34,pending,cash,stripe,pi_V54OVDSS85WJ,,,Jan 18 2024 12:56,,NULL,SE,,,,1,2024/01/18 12:56,stripe_export,NaN
900504,345,user2099@email.com,60,SEK,,,,payd,invoice,stripe,,,,2024-01-09T17:37:00,n/a,NULL,,,,NULL,,2024/01/09 17:37,n/a,duplicate
900505,1185,sofiaand221@company.se,20,EUR,5.0,,17.92,payd,bank_transfer,stripe,ch_DHLAZOZKL1,,,Jan 15 2024 21:41,,n/a,,mastercard,,,1,2024/01/15 21:41,manual_sheet,NaN
900506,829,user1092@gmail.com,20,€,5.0,"1,50",,pending,SWISH,manual,pi_27LRJL9QTAUM,,RCPT_BADTVYE,Mar 09 2024 10:14,,,NULL,mastercard,,,no,2024-03-09 10:14,stripe_export,
900507,890,oskarber67@company.se,20,SEK,5.0,,17.92,pending,cash,manual,,,,,,n/a,NaN,NaN,,2,no,2024-02-01 20:53,square_export,
900508,402,karinlun@email.com,,SEK ,,2.08,,NaN,invoice,stripe,pi_2N8YDVR97LSJ,NaN,n/a,,NaN,,,amex,4203,n/a,NULL,,manual_sheet,n/a
900509,630,sofiaand221@company.se,25,SEK ,6.25,"1,50",n/a,FAILED,cash,adyen,,,,Jan 21 2024 12:06,NaN,NaN,NaN,NULL,,2,1,2024-01-21 12:06,manual_sheet,NULL
900510,239,NULL,40,SEK ,,"1,50",,refunded,bank transfer,manual,,INV-202404-4795,,2024-04-15 21:49,,NULL,PT,,,2,,2024/04/15 21:49,n/a,
900511,385,ahmedali255@outlook.com,60,sek,,"1,50",,payd,NULL,klarna,,,RCPT_47FCDJ6,,n/a,,,,8167,,,,n/a,duplicate
900512,2576,fatimakh971@email.com,20,SEK ,,,,refunded,card,klarna,pi_J42VNVG7ZU0V,,,2024/03/05 11:09,n/a,NaN,SE,visa,,3,0,2024-03-05 11:09,stripe_export,partial refund
900513,657,davidsto100@outlook.com,20,Sek,NaN,,,pending,Klarna,klarna,ch_B9PI1GIC4L,,RCPT_D256PGL,2024-03-02T16:04:00,NaN,NaN,,,,,NULL,NULL,stripe_export,
900514,927,oskarber@gmail.com,40,Sek,,"1,50",37.34,Refunded,invoice,manual,ch_2K1NM1Q9US,,,26/04/2024 08:04,n/a,NULL,PT,,,,1,2024-04-26 08:04,stripe_export,partial refund
900515,50,user5460@email.com,25,Sek,6.25,,,pending,Card,stripe,pi_4G1NRJG91CB8,INV-202404-8354,,Apr 28 2024 16:31,,NaN,GB,,,1,0,,pos,
900516,549,fatimakh27@email.com,25,EUR,,,22.77,Paid,Card,,,NaN,NULL,2024-02-11T16:07:00,,NaN,,visa,6703,,n/a,2024/02/11 16:07,pos,NaN
900517,888,user1298@email.com,15,n/a,,,,pending,cash,square,pi_7YQANAEUO78U,INV-202403-6721,,06/03/2024 16:13,NaN,,,mastercard,,,NULL,,pos,partial refund
900518,356,user2356@email.com,35 SEK,SEK,,,32.48,payed,invoice,square,ch_68KJLFAVBU,,NaN,2024-04-23 22:02,NaN,,ES,amex,6538,NULL,,,,NULL
900519,99999,oscarber@gmail.com,20,sek,n/a,,,FAILED,NaN,stripe,,INV-202404-9171,,Apr 15 2024 12:17,,,SE,n/a,,1,yes,,manual_sheet,
900520,610,ahmedali@email.com,40,Sek,NaN,,,payd,SWISH,klarna,ch_4X1QSF047Z,INV-202401-6148,,19/01/2024 09:11,,,SE,visa,,1,1,2024-01-19 09:11,stripe_export,
900521,1114,linchen129@outlook.com,25,EUR,6.25,,,FAILED,invoice,manual,ch_QP3Z6R1M9Z,,,04/05/2024 19:24,NaN,,,,,NaN,1,,,
900522,9,erikholm735@email.com,25,€,,,22.77,Refunded,Klarna,klarna,NaN,,NaN,2024/01/21 11:07,n/a,,PT,,,NULL,yes,,stripe_export,duplicate
900523,580,n/a,35,SEK ,8.75,"1,50",NaN,,cash,adyen,,NaN,,15/03/2024 22:42,n/a,,,visa,NULL,2,,,manual_sheet,
900524,227,oskarber759@company.se,20,Sek,NULL,2.08,17.92,payd,Klarna,adyen,,,RCPT_YTUSKX3,26/03/2024 18:28,,,NO,mastercard,9684,,,2024-03-26 18:28,,partial refund
900525,942,n/a,15,sek,,,n/a,Paid,NaN,manual,,INV-202402-3898,RCPT_1IB56GZ,23/02/2024 07:32,,,,VISA,4874,one,n/a,2024/02/23 07:32,manual_sheet,n/a
900526,644,oskarber957@company.se,20,€,,,NaN,Refunded,Klarna,square,,INV-202402-9429,RCPT_6PW5TN5,03/02/2024 16:22,,NULL,SE,amex,,,,2024-02-03 16:22,manual_sheet,
900527,794,anagarci@email.com,20,NaN,5.0,,,payd,cash,klarna,pi_XDU15B1QK9ZE,INV-202403-8794,,12/03/2024 08:10,,,NULL,n/a,,one,yes,2024-03-12 08:10,,
900528,588,oscarber487@gmail.com,60,SEK ,,,,FAILED,,adyen,pi_RUVAX6CGFUAI,INV-202403-5290,RCPT_U34M6SB,2024-03-22T22:38:00,n/a,,ES,mastercard,5407,,0,2024-03-22 22:38,manual_sheet,partial refund
900529,615,oskarber109@gmail.com,15,SEK,3.75,,NaN,PAID,Klarna,klarna,,,,,,,ES,,,2,0,2024-04-19 14:18,,
900530,659,user4675@gmail.com,40,Sek,NULL,,37.34,NULL,cash,stripe,NULL,INV-202401-1565,RCPT_1VP25O3,13/01/2024 20:40,,,GB,,,NaN,,,manual_sheet,NaN
900531,700,ellaberg261@gmail.com,40,sek,,"1,50",,payd,Klarna,stripe,,INV-202403-2420,,2024-03-15 07:43,,NaN,ES,NaN,,3,yes,2024/03/15 07:43,pos,duplicate
900532,333,norahans@email.com,,€,,,,paid,cash,klarna,,,,23/03/2024 18:52,n/a,,SE,,5672,,1,,,
900533,151,luispere582@gmail.com,40,SEK ,,,,Pending,swish,,pi_2X6OH3VG6I3H,NULL,,Jan 02 2024 17:52,,NaN,,,7062,one,n/a,2024-01-02 17:52,stripe_export,
900534,567,noaherik618@outlook.com,40,SEK,,2.66,,Pending,card,manual,,,,2024-02-24T12:45:00,,,GB,mastercard,,1,no,,manual_sheet,
900535,99999,NULL,20,EUR,5.0,2.08,,PAID,SWISH,adyen,,INV-202403-8854,RCPT_FPXYMC1,NULL,,,PT,amex,,2,NULL,2024/03/10 13:37,pos,manual correction
900536,1116,user6953@email.com,25,€,,,,Pending,,adyen,,INV-202404-3717,,2024-04-28 07:44,NaN,NaN,PT,amex,1430,1,,,manual_sheet,n/a
900537,,saralind687@company.se,60,EUR,15.0,,56.76,payed,card,stripe,pi_0RBBE1V94Y7X,,RCPT_WW43L2H,NULL,,,,amex,,NaN,0,,square_export,
900538,789,noaherik618@outlook.com,25,SEK,,,,failed,Card,manual,n/a,n/a,,2024/02/10 14:33,,n/a,,visa,,n/a,NaN,2024/02/10 14:33,square_export,
900539,1186,elinsven661@email.com,35,Sek,8.75,,32.48,n/a,card,manual,,NULL,,2024-02-17T10:18:00,,,n/a,VISA,,,yes,,,manual correction
900540,99999,oskarber@gmail.com,40 SEK,SEK ,10.0,"1,50",NULL,payed,Card,,,INV-202401-6040,RCPT_CIJZN4M,2024-01-14T19:37:00,n/a,,ES,VISA,6967,,no,2024/01/14 19:37,pos,n/a
900541,180,oliviali224@outlook.com,20,sek,,2.08,,paid,Card,klarna,NULL,,,Mar 23 2024 10:36,,n/a,PT,,,n/a,no,n/a,manual_sheet,partial refund
900542,854,ahmedali@email.com,,Sek,,,,paid,card,manual,,,RCPT_CKEOP7M,,,,NULL,visa,,,,2024/03/16 12:26,square_export,duplicate
900543,707,NULL,NULL,SEK ,,2.66,n/a,refunded,,stripe,pi_V7IMF8ECOAF4,,,2024-03-13T11:43:00,,,SE,,,n/a,,2024/03/13 11:43,pos,
900544,282,noaherik@gmail.com,25,SEK,,2.23,,refunded,SWISH,adyen,ch_ZT3K2U1HBI,,RCPT_SZTU8HV,,n/a,re_K4AKX9G7AN,ES,visa,,,,2024/01/03 10:42,manual_sheet,manual correction
900545,154,,60,sek,,,56.76,paid,bank transfer,square,,NULL,NULL,,NaN,,,amex,,2,1,2024-02-15 14:03,square_export,manual correction
900546,1036,mikaelås@gmail.com,25,EUR,,,NaN,FAILED,card,manual,NaN,,,2024-01-04 18:39,,,SE,visa,9010,,,2024-01-04 18:39,manual_sheet,
900547,385,elinsven491@email.com,25,€,,,,payd,cash,adyen,,,,2024/05/09 07:06,NULL,NaN,ES,,,1,no,2024/05/09 07:06,square_export,partial refund
900548,1110,jonasnil@email.com,40,EUR,,,,paid,n/a,stripe,NaN,,,2024-05-02 08:59,NULL,NULL,,visa,9951,1,1,2024/05/02 08:59,square_export,partial refund
900549,233,saralind733@gmail.com,60,Sek,,"1,50",56.76,PAID,cash,stripe,,,n/a,2024/02/07 17:03,,NULL,GB,visa,,,,2024-02-07 17:03,stripe_export,duplicate
900550,222,emmajoha970@company.se,25,sek,6.25,,22.77,Pending,Card,adyen,ch_SDM5OALJVH,,,2024-05-06T08:44:00,,NULL,NO,mastercard,2219,,yes,2024-05-06 08:44,square_export,manual correction
900551,715,jonasnil951@outlook.com,35,€,8.75,,32.48,failed,bank transfer,adyen,pi_0NL0N17RVQE0,,,2024/02/22 10:34,n/a,,,amex,,,,2024-02-22 10:34,n/a,partial refund
900552,104,anagarci91@email.com,60,SEK,,"1,50",,Paid,cash,stripe,NULL,,,,n/a,,,,,,,,stripe_export,manual correction
900553,1117,saralind@gmail.com,20,€,,2.08,,payed,card,square,,NaN,RCPT_J7209JT,Mar 23 2024 12:55,,,GB,n/a,,one,NaN,2024-03-23 12:55,,partial refund
900554,855,elinsven320@gmail.com,35,EUR,8.75,,,Pending,Klarna,square,,INV-202401-7589,RCPT_7OBA89F,13/01/2024 16:37,,NaN,,amex,n/a,,,2024-01-13 16:37,square_export,
900555,333,user101@email.com,20,EUR,,,,PAID,Card,klarna,,,,23/03/2024 14:18,,,n/a,visa,,one,yes,2024-03-23 14:18,,
900556,487,user4754@gmail.com,60,EUR,15.0,,56.76,Pending,bank_transfer,square,,,,,,n/a,,,,NULL,,2024-03-31 20:42,n/a,n/a
900557,1015,jonasnil345@email.com,25,EUR,6.25,"1,50",,PAID,SWISH,manual,pi_G1T4WJL357BF,,,2024/02/29 19:43,,NaN,SE,VISA,1173,NaN,NULL,2024-02-29 19:43,square_export,
900558,301,oliviali@email.com,20,Sek,,"1,50",,Pending,cash,manual,NULL,INV-202402-8744,,06/02/2024 17:47,NaN,,,,2896,2,NaN,2024/02/06 17:47,square_export,manual correction
900559,838,user7232@gmail.com,35,sek,,2.52,,failed,swish,manual,n/a,,,Jan 07 2024 11:18,,,PT,visa,NaN,,,2024-01-07 11:18,manual_sheet,
900560,1172,luispere582@gmail.com,20.00,SEK,,,17.92,payed,bank transfer,stripe,,,,Feb 07 2024 13:46,NULL,re_IHGW4J8V48,NO,amex,,,no,2024/02/07 13:46,pos,
900561,525,mariamal661@outlook.com,60,sek,,,,PAID,bank_transfer,adyen,,INV-202404-9207,,Apr 25 2024 20:52,,,,amex,NULL,,n/a,,square_export,
900562,764,liamande@gmail.com,35,SEK,,2.52,,refunded,invoice,manual,,,,2024-04-08T17:24:00,NULL,NULL,n/a,,,,NaN,2024-04-08 17:24,stripe_export,n/a
900563,1198,,25,Sek,,,NULL,Pending,SWISH,adyen,ch_VHBQUQGIRA,INV-202403-4027,,2024-03-27T18:21:00,NaN,,n/a,NaN,,1,1,,manual_sheet,n/a
900564,217,linchen450@email.com,NaN,Sek,3.75,"1,50",,Paid,swish,n/a,,n/a,,,,,,,,,0,,manual_sheet,
900565,956,mikaelås@email.com,15,sek,,,,payed,card,,,,,2024-03-17 13:28,,,NO,,5550,,no,n/a,,
900566,745,,25,sek,,2.23,,FAILED,card,stripe,,,,Feb 17 2024 14:02,n/a,NULL,,NaN,6388,,NaN,,pos,
900567,667,user509@email.com,60,Sek,15.0,,,failed,cash,stripe,pi_ZWVYL04P79H9,INV-202402-6724,,02/02/2024 07:01,,,PT,visa,NaN,,yes,,manual_sheet,partial refund
900568,876,user7984@email.com,15,sek,3.75,,,payed,SWISH,square,,,NaN,2024/04/09 22:27,NaN,,SE,VISA,,one,yes,,pos,
900569,824,karinlun@gmail.com,20,SEK,5.0,"1,50",,Paid,NaN,square,,INV-202402-2710,,,,,GB,mastercard,NULL,1,no,2024/02/11 17:50,pos,NaN
900570,804,noaherik618@outlook.com,60,EUR,,,,FAILED,card,adyen,,,,NaN,,NaN,,visa,8737,1,,2024-03-02 11:15,pos,
900571,3,user3353@gmail.com,40,SEK ,,2.66,NaN,paid,bank_transfer,adyen,pi_BMW0LMRSW9IV,NULL,RCPT_JN5TQEC,Mar 25 2024 19:44,,NaN,,visa,,1,0,,pos,partial refund
900572,39,user8749@gmail.com,20,Sek,,2.08,,Refunded,card,stripe,,,,,n/a,n/a,PT,VISA,NaN,2,,,square_export,
900573,161,maríalóp@gmail.com,60,SEK ,15.0,3.24,,refunded,bank transfer,manual,pi_S4A9HSZVHV9D,INV-202402-5718,,,,NULL,GB,,NULL,,0,2024/02/07 18:19,manual_sheet,NaN
900574,1087,mikaelås@email.com,60,EUR,,,n/a,Paid,invoice,adyen,,,,2024/02/07 10:03,,NaN,SE,visa,,2,yes,,,
900575,525,karinlun413@email.com,40,,,,,PAID,invoice,stripe,NULL,,,,NaN,,,amex,,NaN,,,stripe_export,
900576,9,erikholm65@gmail.com,15,EUR,3.75,,,Paid,bank transfer,klarna,,INV-202404-7771,,2024-04-01 15:07,,n/a,NaN,mastercard,,2,NaN,,,n/a
900577,910,luispere513@gmail.com,15,€,,,n/a,paid,card,adyen,,,RCPT_A5CZ7DB,2024/03/04 14:15,NULL,,,,,,,2024/03/04 14:15,manual_sheet,partial refund
900578,934,user3622@email.com,25,SEK,6.25,NULL,,failed,SWISH,manual,,,,Mar 02 2024 11:19,n/a,n/a,n/a,visa,,,,2024/03/02 11:19,pos,
900579,1134,fatimakh322@outlook.com,35,EUR,8.75,,,refunded,SWISH,NaN,ch_CM6JPG1RVA,,,2024/02/10 11:52,n/a,n/a,SE,amex,,1,,2024/02/10 11:52,pos,duplicate
900580,,mariamal@gmail.com,25,EUR,6.25,,,pending,bank_transfer,adyen,,,RCPT_EZIYBP9,28/01/2024 22:53,NaN,re_NMHGCL8K3M,,,,n/a,,2024-01-28 22:53,stripe_export,NaN
900581,96,fridakar136@outlook.com,60,€,15.0,,,PAID,Card,klarna,ch_SBNALGE2BI,,,2024-04-02 10:10,,,GB,NULL,9429,,1,2024-04-02 10:10,square_export,duplicate
900582,30,luispere@email.com,25,Sek,,,,refunded,bank_transfer,square,,,,2024/03/29 19:41,,,,,4551,,,2024/03/29 19:41,NaN,
900583,965,davidsto@email.com,15,,,,,PAID,Klarna,adyen,ch_ES7GQSRNQ8,,,2024-03-02T19:58:00,,,,mastercard,6159,one,,,manual_sheet,NULL
900584,45,ahmedali255@outlook.com,35,NaN,8.75,"1,50",,pending,Card,adyen,ch_LKXU6QS4H5,NULL,RCPT_N69KP0B,Mar 04 2024 07:52,,,,VISA,1304,,n/a,2024/03/04 07:52,,NaN
900585,820,mariamal@email.com,60,SEK,,,,PAID,cash,adyen,,INV-202403-3572,RCPT_JMXRBOW,,,,NO,,NULL,n/a,0,,,
900586,723,mariamal@gmail.com,60 SEK,SEK ,,,n/a,FAILED,card,adyen,pi_OSXWDY2PSGOS,,,2024-03-22 11:23,,,ES,amex,,2,yes,2024/03/22 11:23,,
900587,501,ellaberg@email.com,40,SEK ,,"1,50",37.34,pending,swish,square,pi_YZII8SU6PDJW,,,2024/03/31 18:44,,NULL,PT,mastercard,,,,2024/03/31 18:44,manual_sheet,NaN
900588,837,NaN,60,sek,15.0,,,paid,card,manual,,INV-202403-5510,,2024-03-07T19:58:00,,,PT,VISA,,,n/a,,square_export,NaN
900589,896,NULL,40,,10.0,NaN,,failed,SWISH,klarna,pi_HJ2AF4QAENN3,,RCPT_U4W2X4T,11/04/2024 18:46,,,ES,NaN,5903,,no,,,
900590,2470,fridakar224@outlook.com,25,sek,NaN,2.23,22.77,paid,SWISH,klarna,,,RCPT_ZXNPR6K,,n/a,NaN,,visa,,,NaN,,,
900591,435,n/a,20,€,5.0,,,Paid,SWISH,klarna,,INV-202403-1446,,2024-03-15 19:49,NaN,,NULL,,7438,1,no,2024/03/15 19:49,stripe_export,
900592,805,user6237@gmail.com,25,SEK,,,,refunded,card,manual,pi_ARAPJSY61DK6,,,2024-03-13T22:35:00,,NULL,,,,one,,2024/03/13 22:35,pos,partial refund
900593,856,fatimakh311@gmail.com,60,EUR,,NaN,,Refunded,SWISH,klarna,ch_EX87RZLXK1,,,2024/02/11 13:49,,NULL,PT,mastercard,,2,,2024/02/11 13:49,n/a,
900594,99999,n/a,20,EUR,,"1,50",17.92,failed,card,stripe,,,,2024-03-29 18:03,,NULL,,n/a,,,NaN,,pos,
900595,805,pedrosil754@gmail.com,15,EUR,,1.94,,Paid,swish,adyen,pi_8UI1WWSHH8DD,,,2024/05/08 19:54,n/a,re_SPJJOV2V52,,,6925,,,2024/05/08 19:54,square_export,partial refund
900596,1120,user6522@gmail.com,15,SEK,,"1,50",,PAID,bank transfer,manual,ch_9POUPA1PK8,,,2024-02-30 12:00,,,ES,visa,,,0,2024-01-19 18:51,pos,
900597,1185,karinlun@gmail.com,15,SEK ,3.75,,n/a,Refunded,bank transfer,adyen,pi_JEJPQ12CBB79,NULL,,Jan 30 2024 09:21,,n/a,,VISA,,1,,2024-01-30 09:21,square_export,partial refund
900598,572,user2554@email.com,60,sek,NaN,3.24,56.76,payed,SWISH,square,NaN,,,,,NaN,GB,n/a,,3,0,2024-02-01 10:44,manual_sheet,
900599,49,anagarci713@email.com,20,Sek,,2.08,,payed,invoice,stripe,pi_JFP9WXXQ9PU1,NULL,NaN,2024-05-02T07:55:00,n/a,,,amex,5694,one,,,,NaN
900600,485,sofiaand@email.com,NaN,€,8.75,,,FAILED,cash,adyen,,,,2024/04/18 09:35,,n/a,GB,amex,,,,2024/04/18 09:35,stripe_export,NaN
900601,204,NULL,35,Sek,,2.52,32.48,Pending,Card,NULL,,NULL,RCPT_8YUOWZI,,,,ES,,,,,,pos,NULL
900602,674,ellaberg709@gmail.com,35,SEK,,"1,50",,failed,Card,square,,INV-202402-6700,,Feb 27 2024 16:21,n/a,n/a,,NULL,6612,one,0,NaN,square_export,manual correction
900603,102,user3801@gmail.com,35,€,8.75,,n/a,n/a,bank transfer,square,ch_3WSBC5RY3P,NaN,,2024-04-17T21:51:00,n/a,,ES,VISA,,3,no,2024-04-17 21:51,pos,partial refund
900604,,saralind737@company.se,20,sek,,"1,50",,PAID,bank_transfer,manual,pi_V24CPHKG5BAI,NaN,RCPT_OGF4H2X,03/04/2024 10:21,,n/a,SE,amex,3883,1,,2024-04-03 10:21,pos,partial refund
900605,99999,ellaberg952@outlook.com,35,€,8.75,,,Pending,bank transfer,klarna,pi_6S08XOD4EWQ5,,,02/03/2024 09:51,n/a,NULL,ES,n/a,,,,2024/03/02 09:51,manual_sheet,manual correction
900606,176,mikaelås@gmail.com,60,SEK,15.0,"1,50",,payed,bank transfer,klarna,,INV-202404-9057,,,NULL,,,NULL,7873,,,,stripe_export,NULL
900607,,ahmedali956@outlook.com,,EUR,,"1,50",,Pending,cash,,pi_8FYQATFB9C93,n/a,,,n/a,n/a,ES,mastercard,NULL,,,2024/02/23 20:27,stripe_export,
900608,336,luispere582@gmail.com,20,€,,,,payd,cash,manual,,INV-202402-9237,RCPT_6E2I2BE,2024-02-10T15:23:00,,,ES,mastercard,3202,1,yes,2024/02/10 15:23,,NULL
900609,123,oliviali@gmail.com,40,SEK ,10.0,2.66,NULL,FAILED,bank transfer,adyen,pi_7CFE6ZZXPSG0,,RCPT_YXMZX9R,Apr 30 2024 17:54,NULL,NULL,,,,,no,NaN,,partial refund
900610,1186,mikaelås698@email.com,35,EUR,8.75,,32.48,Pending,SWISH,klarna,pi_2IBRI58DV8LL,,,02/03/2024 07:49,n/a,,NULL,,,NaN,,2024/03/02 07:49,stripe_export,duplicate
900611,205,user6172@email.com,60,SEK,15.0,"1,50",,Paid,card,manual,pi_FJN5MSKHDWAQ,,RCPT_CN7F0PC,15/02/2024 20:20,NULL,n/a,,visa,,,,,square_export,n/a
900612,238,user12@gmail.com,25.00,SEK ,,,,Paid,card,stripe,,,RCPT_HJULGCJ,May 03 2024 22:03,NaN,n/a,ES,,8530,one,0,2024-05-03 22:03,manual_sheet,
900613,193,emmajoha463@gmail.com,20,SEK,n/a,,,pending,bank_transfer,square,,,,,n/a,,ES,NULL,,,NULL,2024-02-27 16:38,pos,manual correction
900614,1093,linchen175@outlook.com,40,sek,10.0,2.66,,payed,Klarna,stripe,,,,Jan 13 2024 12:45,NULL,,,visa,,1,NULL,2024/01/13 12:45,square_export,NaN
900615,1076,user655@gmail.com,20,€,,,NULL,paid,bank_transfer,stripe,pi_5XI28CUDOP1F,n/a,RCPT_5OCE0JF,22/03/2024 12:58,,NaN,,mastercard,2892,,no,2024/03/22 12:58,manual_sheet,NULL
900616,863,jonasnil@gmail.com,15,EUR,,"1,50",,pending,Card,square,,INV-202402-3670,NULL,2024-02-12T11:47:00,NULL,NaN,,VISA,,one,NULL,2024/02/12 11:47,,manual correction
900617,114,fridakar22@company.se,25,Sek,NULL,,,refunded,bank_transfer,manual,pi_UFLLK7UVRJH1,n/a,,,NaN,NULL,ES,,,one,NaN,2024/03/10 16:49,pos,
900618,1105,n/a,20,sek,5.0,,,Refunded,SWISH,manual,ch_Z6HPUH41IW,,RCPT_WKBB5TA,2024/01/13 08:48,,n/a,SE,,7948,,1,2024-01-13 08:48,,
900619,1142,norahans581@company.se,20,EUR,,,,pending,swish,stripe,,,,2024-03-30T11:07:00,NaN,re_XH61ZGM028,,amex,,,1,2024-03-30 11:07,,duplicate
900620,756,NaN,60,SEK,,,,PAID,,square,pi_P5JYSPTHOVVX,INV-202403-6946,RCPT_JN2OKHG,2024/03/23 19:48,NULL,re_EHJZPHIYWR,NO,n/a,NULL,one,no,2024-03-23 19:48,,duplicate
900621,184,pedrosil633@company.se,15,sek,,,,payed,bank transfer,klarna,pi_JJX9TRT4H95V,,,2024-01-31T16:39:00,NULL,,,n/a,n/a,2,yes,,stripe_export,
900622,1005,oliviali@gmail.com,35,sek,NULL,,,pending,swish,stripe,,,,20/04/2024 10:52,,n/a,PT,n/a,,,NULL,,manual_sheet,
900623,8,pedrosil754@gmail.com,25,SEK ,,n/a,,Paid,Card,adyen,ch_RCP0XS3GQK,INV-202404-1633,,2024/04/13 21:40,,NULL,PT,NULL,,,NULL,,stripe_export,NULL
900624,11,noaherik@email.com,60,sek,15.0,"1,50",56.76,payd,,klarna,,INV-202405-6654,,,,NULL,,,5748,1,1,2024/05/01 12:24,stripe_export,
900625,352,sofiaand221@company.se,NULL,SEK,5.0,NaN,,Pending,Card,stripe,ch_3PBZEEMUDX,,,2024-05-04 07:31,NULL,,,amex,,,no,,stripe_export,
900626,1074,emmajoha610@email.com,15,€,3.75,n/a,,PAID,swish,adyen,,,,2024-02-16T14:34:00,NULL,,GB,,,,no,2024/02/16 14:34,,duplicate
900627,982,user1313@gmail.com,60 SEK,€,15.0,"1,50",56.76,failed,Card,klarna,ch_PCU9L1669S,,,Apr 27 2024 15:05,,NaN,,,8403,NULL,0,2024/04/27 15:05,,
900628,478,NULL,20,SEK ,,"1,50",,PAID,swish,klarna,n/a,,RCPT_1Q9QSLY,2024-01-25 13:45,,n/a,NULL,amex,3957,NaN,0,2024/01/25 13:45,stripe_export,partial refund
900629,620,user9984@gmail.com,25,Sek,NULL,NULL,NaN,Pending,bank_transfer,adyen,ch_GNBPA2BCWU,,,,,re_H0HFBTRFZT,,mastercard,,,0,2024-01-20 16:10,NULL,
900630,960,maríalóp@email.com,60,sek,NaN,,,Refunded,Klarna,manual,,,,2024-04-26 18:27,NULL,n/a,NULL,visa,,NULL,,2024-04-26 18:27,square_export,
900631,1115,oscarber524@email.com,40,Sek,10.0,,,payd,Card,manual,,,RCPT_5B3D1XD,2024-02-08 10:20,,,GB,,,3,yes,2024-02-08 10:20,square_export,manual correction
900632,312,fatimakh322@outlook.com,60,SEK ,,3.24,,refunded,Card,adyen,ch_D2HEW5FKR4,INV-202404-1165,,,n/a,n/a,NO,,,,,NULL,square_export,manual correction
900633,1108,user6087@email.com,15,sek,,1.94,,paid,SWISH,adyen,ch_42JI2BF8R0,,,2024-02-29 17:23,,,,,,,NULL,2024-02-29 17:23,stripe_export,
900634,899,fatimakh509@gmail.com,25,NaN,,,22.77,Pending,Klarna,stripe,pi_OK2Y0VQTXN97,INV-202402-5994,RCPT_MXRYCNE,2024-02-06 19:20,,NULL,NO,n/a,4128,NaN,NULL,2024-02-06 19:20,,duplicate
900635,993,luispere@email.com,15,SEK ,3.75,NULL,n/a,FAILED,Klarna,klarna,ch_AX0WL0DVSB,NaN,RCPT_WI4ND5G,,n/a,NULL,,visa,,,yes,2024-03-15 09:50,square_export,partial refund
900635,939,user4091@gmail.com,20,€,n/a,,,PAID,swish,adyen,,,,2024/03/29 14:39,NULL,NaN,ES,,,NULL,,2024/03/29 14:39,manual_sheet,manual correction
900637,253,NULL,60,sek,15.0,,56.76,pending,bank_transfer,manual,,,RCPT_YEUVXJN,Jan 29 2024 15:00,,n/a,SE,NULL,,1,yes,,manual_sheet,
900638,15,user1652@email.com,35,SEK ,,,,Paid,Klarna,klarna,ch_A38U9144DJ,,RCPT_4GEGTKG,12/03/2024 09:16,NULL,,PT,mastercard,,NULL,0,NULL,,
900639,597,fatimakh509@gmail.com,60,,,3.24,56.76,PAID,bank transfer,square,pi_33MTHJLQVXIV,INV-202403-7653,RCPT_YBGTWXS,2024-03-29T09:59:00,,,,,NaN,,yes,,stripe_export,n/a
900640,863,oskarber957@company.se,20,SEK ,5.0,,17.92,Pending,Card,klarna,pi_E9HR113G5IBB,,RCPT_SO3Q90B,23/04/2024 20:04,,,n/a,visa,,one,yes,,,duplicate
900641,653,emmajoha203@gmail.com,15,SEK,,n/a,,failed,card,,,,NULL,Apr 23 2024 17:37,NaN,n/a,GB,mastercard,NULL,1,,,pos,NaN
900642,602,davidsto391@company.se,35,sek,8.75,,,FAILED,bank transfer,stripe,ch_N49LCOF753,n/a,,Feb 23 2024 17:04,,n/a,NO,amex,,,yes,,,
900643,838,saralind838@email.com,20,NaN,,NULL,,payd,NULL,klarna,,n/a,,Jan 09 2024 10:34,,NULL,NO,visa,2906,,no,2024-01-09 10:34,manual_sheet,manual correction
900644,1136,ahmedali255@outlook.com,20,SEK,,2.08,,pending,swish,adyen,ch_30QF71N4PG,INV-202405-4212,,2024-05-01T08:22:00,n/a,NaN,PT,mastercard,,one,,2024-05-01 08:22,,
900645,,oscarber569@company.se,25,SEK,,,,paid,Klarna,stripe,n/a,INV-202402-3794,,2024/02/27 14:18,,n/a,,,,1,yes,2024/02/27 14:18,manual_sheet,duplicate
900646,433,karinlun@gmail.com,25,SEK ,,"1,50",,FAILED,cash,square,ch_VGFDW4QUNP,,RCPT_T12WJIC,09/01/2024 09:36,,NULL,PT,,,,1,2024-01-09 09:36,NULL,NULL
900647,729,luispere@email.com,,SEK,n/a,,NaN,NaN,Klarna,klarna,ch_YBTAU503UR,INV-202402-8164,,17/02/2024 08:01,NULL,NaN,,VISA,,,,2024-02-17 08:01,stripe_export,
900648,931,saralind641@company.se,35,€,,,32.48,FAILED,card,klarna,,,,2024-02-29T08:58:00,NaN,re_HBNJFZLDDC,NaN,mastercard,,one,1,,stripe_export,NULL
900649,138,user5246@gmail.com,20,SEK ,,NaN,,pending,cash,stripe,pi_62UOXOJGQ04L,,RCPT_3HRBALD,2024/04/20 07:40,n/a,,PT,mastercard,4943,one,0,2024/04/20 07:40,,
900650,182,mikaelås@gmail.com,40,sek,,"1,50",,failed,Klarna,stripe,,INV-202401-3781,RCPT_KQ89M7Y,27/01/2024 20:50,,NULL,PT,mastercard,2197,2,,,square_export,
900651,588,pedrosil@email.com,15,Sek,,"1,50",,paid,invoice,adyen,ch_A33GBMZ25A,,,2024-03-26T15:16:00,NULL,,ES,,3620,,yes,2024-03-26 15:16,pos,
900652,731,,40,SEK,10.0,,,failed,Klarna,manual,,,RCPT_07YE5MZ,,,,GB,VISA,8543,one,n/a,2024-01-18 14:17,,
900653,815,user5855@gmail.com,40,EUR,,,37.34,Refunded,NaN,stripe,pi_9JXFTVYKUEK3,,RCPT_EO5Q8B2,,,NULL,ES,NaN,,2,0,,pos,duplicate
900654,162,NaN,35,EUR,,2.52,,pending,invoice,adyen,pi_L5ELZQTMTA4W,,,20/04/2024 18:42,n/a,NaN,,NULL,1677,n/a,yes,2024/04/20 18:42,,NaN
900655,1005,mikaelås@gmail.com,40,€,,NaN,37.34,Paid,Card,manual,pi_NFPBTTGCAVBI,INV-202401-9397,,Jan 23 2024 20:59,,,,VISA,,,,2024/01/23 20:59,pos,
900656,280,,60,EUR,15.0,NaN,,payed,Card,klarna,NULL,,,Mar 09 2024 22:26,,re_DVTR4JS7JH,PT,amex,,n/a,1,2024-03-09 22:26,stripe_export,partial refund
900657,1019,saralind687@company.se,60,SEK,15.0,,,payed,cash,klarna,,,,2024-01-02 09:17,NaN,,,,,3,,,square_export,manual correction
900658,116,jonasnil@gmail.com,15,EUR,3.75,,,Pending,SWISH,stripe,n/a,,,Apr 23 2024 13:40,NULL,,,,5135,one,,2024-04-23 13:40,,
900659,1018,user2974@email.com,35,Sek,8.75,,32.48,PAID,bank_transfer,stripe,ch_KY8BYTN25W,,RCPT_CPCDIP8,24/01/2024 20:35,,,NULL,,,2,no,2024/01/24 20:35,stripe_export,n/a
900660,407,,35,Sek,8.75,NaN,,PAID,Klarna,manual,NaN,,,,,,,n/a,7456,3,,2024/02/04 15:58,manual_sheet,NULL
900661,241,linchen450@email.com,40,sek,,2.66,,Paid,Klarna,NULL,,,RCPT_G6Q9GS7,2024-05-06 18:23,,,,VISA,,one,,,,partial refund
900662,970,user7781@gmail.com,15,EUR,3.75,,,Paid,Klarna,square,,INV-202404-8043,,14/04/2024 19:18,NULL,,,amex,8819,2,,2024/04/14 19:18,square_export,manual correction
900663,496,user5471@gmail.com,35,€,NaN,,,Pending,cash,manual,ch_KYOYSPHHU7,,,2024-04-09T11:59:00,,NaN,,,9995,3,n/a,2024-04-09 11:59,square_export,
900664,149,linchen129@outlook.com,15,SEK,,,NaN,payed,cash,stripe,,INV-202401-2116,RCPT_0861KWT,30/01/2024 18:51,,NULL,ES,NULL,7599,2,0,2024-01-30 18:51,pos,n/a
900665,828,user1235@email.com,40,€,10.0,NULL,,pending,,adyen,pi_NZ05Z7NJU5WH,,,03/05/2024 18:47,n/a,,PT,VISA,,,yes,2024/05/03 18:47,n/a,duplicate
900666,884,user7439@gmail.com,25,Sek,,,NaN,failed,Klarna,square,,,,2024-03-14T10:38:00,,,SE,,4373,,1,,square_export,manual correction
900667,1163,emmajoha610@email.com,40,€,10.0,2.66,,payed,SWISH,adyen,ch_DPDY8VR8MV,,RCPT_W6VCTOQ,2024/03/01 09:24,NaN,n/a,NO,,,,0,2024-03-01 09:24,,duplicate
900668,883,saralind687@company.se,60,NULL,,NULL,n/a,Pending,bank transfer,klarna,ch_G33PT38JYN,,,2024-04-15T15:30:00,NaN,NaN,PT,,,NULL,NaN,,,
900669,818,elinsven@gmail.com,60,sek,,,,paid,bank transfer,adyen,ch_BMAI7YBT3R,,,2024-02-03 15:19,,,ES,mastercard,,one,no,2024-02-03 15:19,,duplicate
900670,999,user4036@email.com,20,Sek,5.0,n/a,,payd,invoice,klarna,,INV-202402-2783,,,,n/a,NaN,VISA,,,,,,NULL
900671,926,erikholm707@gmail.com,NaN,SEK,,,,pending,SWISH,adyen,,,,2024-02-09 22:59,,NULL,,n/a,NULL,3,0,2024/02/09 22:59,manual_sheet,NULL
900672,895,,40,SEK,,"1,50",37.34,paid,cash,manual,NULL,n/a,RCPT_MXXGXOR,2024-05-01 17:49,n/a,NULL,,,,2,n/a,2024/05/01 17:49,n/a,partial refund
900673,535,NaN,15,NaN,,1.94,13.06,payed,bank_transfer,klarna,,INV-202402-1164,,2024-02-11T16:16:00,,,n/a,,7375,2,NULL,,manual_sheet,
900674,77,,60,EUR,15.0,,,,Klarna,adyen,pi_PVFDID8V4GYD,,RCPT_0FPQDPB,,,,,NaN,,,NULL,,pos,partial refund
900675,604,noaherik618@outlook.com,15,SEK,,,,pending,Klarna,manual,,NaN,RCPT_VQCX8MF,,,,n/a,NaN,,1,NaN,2024/02/12 19:03,pos,
900676,924,user9827@gmail.com,20,sek,,NULL,17.92,payd,SWISH,manual,pi_S87CNB5KRJO8,,RCPT_GX0XMQ4,26/02/2024 21:32,NaN,,,,,,,,pos,NULL
900677,306,emmajoha610@email.com,40,SEK,,NULL,,refunded,Klarna,stripe,,,RCPT_M41QL7J,,,re_E6TTJ3N56J,,,,,no,2024/03/13 19:25,manual_sheet,duplicate
900678,629,,15,Sek,3.75,"1,50",,PAID,SWISH,klarna,NaN,INV-202405-2473,,2024-05-06 22:24,n/a,NULL,SE,amex,,,NULL,,pos,
900679,,sofiaand369@gmail.com,20,EUR,5.0,,17.92,FAILED,cash,,NaN,INV-202405-7902,,10/05/2024 14:26,NaN,,SE,,4064,3,,2024-05-10 14:26,,partial refund
900680,950,erikholm735@email.com,25,,NaN,"1,50",22.77,FAILED,swish,square,,,,25/03/2024 11:10,NULL,,SE,amex,4054,NaN,,2024/03/25 11:10,square_export,duplicate
900681,46,emmajoha463@gmail.com,60,Sek,15.0,3.24,56.76,Paid,bank_transfer,square,,,,27/01/2024 14:41,NULL,n/a,,NULL,5772,one,,2024-01-27 14:41,manual_sheet,
900682,40,jonasnil671@email.com,25,Sek,,2.23,22.77,,SWISH,n/a,pi_QHUOTPKEHQ2S,,RCPT_7QHCGGU,2024-05-09T10:56:00,n/a,,NULL,amex,,,1,2024-05-09 10:56,,
900683,1200,saralind@email.com,35,€,,,,,cash,klarna,,INV-202402-4182,,2024-02-06T16:09:00,,n/a,SE,visa,,1,,2024/02/06 16:09,stripe_export,partial refund
900684,275,user7223@email.com,15,SEK,n/a,1.94,,Pending,,adyen,ch_OLBC2J3TK2,,,2024/04/04 16:39,,,SE,visa,6390,NaN,,2024/04/04 16:39,stripe_export,partial refund
900685,709,maríalóp917@gmail.com,20,sek,NaN,2.08,,FAILED,invoice,stripe,,,,23/01/2024 15:42,NULL,NULL,PT,visa,5121,,1,,pos,duplicate
900686,997,user9783@gmail.com,40,sek,10.0,,,Refunded,Card,square,,INV-202405-7509,RCPT_JG5JRUY,,NaN,NaN,NULL,,,1,,2024-05-07 20:25,stripe_export,
900687,565,luispere@email.com,,€,,,,pending,swish,square,pi_MOTHJTXZT8IB,,RCPT_PW07XC2,Mar 07 2024 22:48,,,NO,mastercard,,,1,2024-03-07 22:48,pos,
900688,887,sofiaand369@gmail.com,25,sek,,n/a,,payd,Card,adyen,pi_ID7ZOX4IOSJS,INV-202403-2876,,17/03/2024 18:50,NULL,NaN,NaN,amex,,1,NULL,,manual_sheet,
900689,1085,NULL,25,sek,n/a,2.23,,paid,NULL,manual,NULL,,NaN,28/01/2024 14:56,n/a,,GB,amex,,,0,2024/01/28 14:56,pos,partial refund
900690,979,mariamal123@company.se,20,EUR,,,,refunded,invoice,NULL,pi_9TDO6K1KPA0D,,NULL,,NaN,NULL,n/a,amex,,3,,NULL,,
900691,348,emmajoha@gmail.com,60,SEK,,,n/a,Pending,card,klarna,,INV-202405-7510,,2024-05-09 12:07,,NULL,n/a,mastercard,,3,,2024-05-09 12:07,square_export,
900692,125,mikaelås@gmail.com,35,SEK,,,,FAILED,cash,manual,ch_6MTHRA6J7W,,,2024-02-03 12:07,NaN,,,n/a,,n/a,no,2024/02/03 12:07,manual_sheet,
900693,260,user1512@gmail.com,35,Sek,,"1,50",,FAILED,swish,klarna,ch_99ZS8T4C5O,INV-202404-2779,RCPT_PQ5I2LZ,Apr 26 2024 07:41,n/a,,PT,visa,,n/a,NULL,2024/04/26 07:41,square_export,manual correction
900694,628,user3137@email.com,,SEK,,2.66,NaN,refunded,swish,stripe,ch_0FCRA4IU91,INV-202404-9453,,,,re_FJ7D4KMZ9F,ES,mastercard,,NaN,,2024-04-10 17:19,square_export,NULL
900695,490,jonasnil31@outlook.com,35,SEK ,NULL,,,refunded,cash,klarna,NULL,INV-202401-2382,RCPT_TEGGWH7,Jan 09 2024 18:05,,NULL,,,,NaN,NULL,,pos,partial refund
900696,462,emmajoha@gmail.com,,EUR,6.25,,,Paid,,square,,,,2024/04/14 12:26,NULL,NaN,ES,mastercard,7863,2,0,2024/04/14 12:26,manual_sheet,partial refund
900697,113,user9537@gmail.com,20,EUR,,,,failed,SWISH,manual,,NaN,,Apr 09 2024 13:48,NaN,NaN,NO,,,3,1,2024/04/09 13:48,NULL,duplicate
900698,340,davidsto949@outlook.com,40,SEK ,,"1,50",37.34,PAID,cash,adyen,pi_NN9PHTCTPXNB,INV-202403-4248,,NaN,NaN,,,,,3,no,2024-03-12 12:17,pos,partial refund
900699,1198,user1813@gmail.com,60,Sek,15.0,3.24,,Pending,Klarna,klarna,,,RCPT_7IJLPK8,16/02/2024 08:18,NULL,NULL,,,,,0,2024/02/16 08:18,stripe_export,manual correction
900700,885,liamande822@email.com,20,Sek,5.0,,,failed,Klarna,square,NULL,,,n/a,,n/a,GB,mastercard,,,0,,square_export,
900701,324,user4616@gmail.com,25,NaN,6.25,"1,50",,payd,bank transfer,n/a,,,n/a,2024-02-01T07:09:00,,NULL,SE,amex,1433,,no,,,
900702,443,user4893@email.com,20,sek,,"1,50",,FAILED,Card,manual,,INV-202401-8219,RCPT_3L63SHP,19/01/2024 09:10,,NULL,NaN,,NULL,n/a,yes,2024/01/19 09:10,manual_sheet,duplicate
900703,1166,NaN,15,Sek,,,NaN,refunded,cash,stripe,ch_Y8TN3BUPNV,,,06/03/2024 10:03,2024-03-06 10:03,,GB,VISA,7865,3,yes,,,duplicate
900704,818,elinsven@gmail.com,15,SEK ,,,,Refunded,Klarna,stripe,,INV-202401-5596,RCPT_OHULVOY,2024-01-04 12:40,n/a,,NO,mastercard,8656,one,,2024-01-04 12:40,manual_sheet,
900705,922,ellaberg691@outlook.com,25,EUR,,NaN,,Paid,bank transfer,adyen,NaN,INV-202401-3821,,2024/01/12 11:36,NaN,n/a,GB,,,NULL,,,,partial refund
900706,493,luispere582@gmail.com,40,Sek,10.0,,,Refunded,invoice,square,pi_VRGOZHSHUL07,,RCPT_5ESO838,2024-04-26 14:21,NaN,,ES,amex,6830,NaN,0,2024/04/26 14:21,stripe_export,NULL
900707,874,user2455@email.com,20,,,"1,50",NULL,FAILED,swish,adyen,pi_1LAS5WHSYDV5,NULL,,Feb 01 2024 12:46,n/a,n/a,,,,one,,,stripe_export,duplicate
900708,844,davidsto949@outlook.com,20,Sek,5.0,,,Refunded,invoice,klarna,,INV-202402-2348,,18/02/2024 18:51,,,,mastercard,3098,1,,2024/02/18 18:51,manual_sheet,
900709,527,erikholm288@gmail.com,60,Sek,n/a,3.24,56.76,payed,cash,adyen,ch_197GYGB0LP,INV-202401-1448,,12/01/2024 14:45,n/a,re_LCUXJVPFC7,NO,,5333,one,n/a,2024/01/12 14:45,stripe_export,
900710,18,mikaelås792@company.se,20,sek,NaN,,,payd,card,adyen,,,,2024/02/25 16:24,,,,mastercard,,one,no,n/a,stripe_export,
900711,2233,fridakar823@gmail.com,NaN,SEK,,,,pending,Card,adyen,pi_UDSA931PYMSN,INV-202401-9655,RCPT_762THAS,n/a,NULL,,ES,VISA,3643,1,NaN,,,NaN
900712,514,fridakar@gmail.com,NaN,sek,,,17.92,Paid,cash,square,,,,2024/03/16 22:23,NULL,,,amex,,one,1,2024-03-16 22:23,stripe_export,
900713,812,oskarber667@gmail.com,35,SEK,8.75,n/a,,paid,card,square,pi_ENOYRWIA70JR,,,,,NULL,,amex,3817,,no,2024/02/10 21:55,square_export,NULL
900714,757,user4741@email.com,40,sek,,,37.34,payd,swish,adyen,ch_MWUIFRHXEQ,INV-202405-4889,,2024-05-10T10:51:00,,n/a,SE,amex,n/a,1,,,stripe_export,partial refund
900715,643,oscarber650@outlook.com,25,€,,,NULL,FAILED,Card,adyen,pi_9ETKC159CKMS,,,2024/02/26 17:36,NULL,,GB,,3699,,,2024-02-26 17:36,square_export,manual correction
900716,690,user6984@gmail.com,25,EUR,,"1,50",,refunded,cash,square,,,,,,,,visa,NaN,,NULL,,stripe_export,
900717,1130,norahans358@company.se,20,SEK ,NaN,"1,50",,Paid,cash,square,,INV-202404-5635,n/a,2024-02-30 12:00,NaN,,GB,NULL,NULL,,n/a,2024/04/06 10:47,manual_sheet,partial refund
900718,1087,jonasnil@gmail.com,40,sek,,,37.34,pending,bank_transfer,square,pi_ZJC30XAXKK4W,,,2024-04-21T10:13:00,,,SE,,,,,2024-04-21 10:13,,partial refund
900719,70,mikaelås584@company.se,25,SEK ,,,,paid,Klarna,square,,,,2024/01/30 14:11,,NULL,GB,NaN,5308,3,n/a,,,
900720,574,saralind414@email.com,25,SEK ,,"1,50",NULL,PAID,bank_transfer,adyen,ch_BFG1DRATT5,NULL,RCPT_0REKML2,,,,,,9952,,,,stripe_export,manual correction
900721,99999,oliviali438@outlook.com,40 SEK,EUR,,,,Refunded,bank_transfer,stripe,,NaN,RCPT_S9DW884,NULL,2024-01-27 12:44,NaN,,NULL,4484,NULL,,2024-01-27 12:44,,NaN
900722,892,user3362@email.com,25,Sek,,,22.77,pending,card,,,n/a,RCPT_9S24A6G,2024/02/05 18:28,,re_C52MOMFFDQ,,amex,,one,n/a,,square_export,duplicate
900723,1186,user1946@email.com,15,Sek,3.75,"1,50",,pending,SWISH,stripe,ch_X7NZMU2GDI,,,2024/03/18 20:15,,,NO,,,2,no,NULL,stripe_export,partial refund
900724,275,user5746@gmail.com,60,€,15.0,,,pending,card,square,,,,2024-04-30T07:32:00,n/a,NaN,GB,,3097,n/a,yes,,square_export,manual correction
900725,672,user2333@gmail.com,35,EUR,8.75,,,FAILED,bank_transfer,stripe,ch_XIVNU3XMQ3,,,29/01/2024 19:39,n/a,NaN,,visa,,2,,2024/01/29 19:39,,duplicate
900726,714,user3282@email.com,20,sek,,"1,50",17.92,Refunded,SWISH,adyen,NULL,,,2024-01-05 16:20,NaN,NaN,GB,visa,n/a,,,2024-01-05 16:20,stripe_export,
900727,608,user9845@gmail.com,60,Sek,,3.24,,payd,card,klarna,ch_WRITJS32GN,INV-202402-7667,,2024/02/16 21:26,NaN,,SE,amex,2156,3,,2024-02-16 21:26,pos,
900728,580,user525@email.com,25,SEK ,,,22.77,Refunded,swish,manual,ch_KKB3D8P0SC,INV-202403-2139,,2024/03/14 10:02,,,SE,amex,,NULL,0,NULL,square_export,manual correction
900729,1014,user5746@email.com,35,€,8.75,n/a,32.48,payd,bank_transfer,n/a,ch_ZN2U61M0T1,,,,n/a,,NULL,,,,,NaN,pos,
900730,983,elinsven@gmail.com,25,EUR,,2.23,,Paid,cash,manual,NULL,,,2024-03-23T21:52:00,,,,mastercard,,3,,2024/03/23 21:52,,NULL
900731,115,davidsto949@outlook.com,20 SEK,€,,"1,50",,payed,Card,klarna,NULL,INV-202403-3307,,2024/03/01 16:18,,,,visa,,NaN,NaN,,NULL,n/a
900732,140,linchen175@outlook.com,25,SEK,NULL,2.23,,pending,NaN,klarna,ch_C69KMTX2NT,,,2024-02-03 20:13,,NULL,NO,,,,0,,stripe_export,
900733,733,noaherik391@email.com,15,€,n/a,,n/a,paid,invoice,klarna,n/a,,RCPT_8IYJ9OZ,,,,ES,visa,,n/a,yes,2024-04-15 18:59,square_export,partial refund
900734,1154,pedrosil440@email.com,35,SEK ,8.75,,,Pending,SWISH,klarna,pi_68UVO8CPACOR,,NaN,2024/01/06 20:23,,NULL,NULL,,,2,no,2024/01/06 20:23,,duplicate
900735,129,saralind737@company.se,35,EUR,,,,pending,bank_transfer,manual,,NULL,,2024-01-12T20:04:00,,n/a,,amex,,3,,2024/01/12 20:04,,duplicate
900736,9,ahmedali81@company.se,n/a,€,n/a,,,refunded,Klarna,stripe,,,,2024-03-14 21:48,2024-03-14 21:48,NULL,GB,visa,4886,NULL,1,2024-03-14 21:48,,manual correction
900737,963,user660@email.com,60,SEK,,3.24,,,Card,adyen,,,RCPT_HFGPW3V,2024/04/18 11:42,,,ES,amex,,,1,2024-04-18 11:42,square_export,duplicate
900738,892,norahans586@gmail.com,15,sek,3.75,"1,50",,refunded,bank_transfer,manual,pi_I9AD3EZUOIQ2,n/a,,Mar 02 2024 11:08,NaN,n/a,NaN,,NaN,NaN,NULL,2024/03/02 11:08,stripe_export,
900739,430,n/a,40,Sek,,,,FAILED,bank transfer,klarna,,,RCPT_NR4QDBL,05/01/2024 11:08,,,ES,visa,,2,no,2024/01/05 11:08,n/a,manual correction
900740,1119,user835@email.com,40,sek,,"1,50",,payed,card,square,pi_5H1KB7QEVCPW,,,2024/04/25 07:24,,NaN,,,,1,,2024-04-25 07:24,,duplicate
900741,593,saralind438@company.se,60,NaN,15.0,,56.76,refunded,invoice,klarna,ch_QA0QQO34H3,,,2024/02/02 15:01,,,GB,,,1,n/a,,stripe_export,manual correction
900742,343,sofiaand221@company.se,35,EUR,8.75,2.52,,payed,cash,manual,,,,2024-02-09T22:19:00,NULL,,,NaN,,,,,,manual correction
900743,126,fridakar@email.com,35,sek,8.75,"1,50",,Refunded,Klarna,stripe,,INV-202403-2654,,2024-03-13T22:27:00,,,,visa,,NaN,yes,2024/03/13 22:27,stripe_export,
900744,355,user5038@email.com,40,SEK ,,2.66,,payed,cash,stripe,NULL,INV-202404-2527,,Apr 16 2024 19:09,NULL,NULL,GB,amex,,NULL,no,2024-04-16 19:09,pos,n/a
900745,,NULL,60,sek,,3.24,NaN,Pending,Card,n/a,pi_LLM13WRDN05X,,RCPT_DSTW1CS,2024-01-28T21:02:00,NULL,,SE,,,one,,2024-01-28 21:02,manual_sheet,partial refund
900746,72,pedrosil754@gmail.com,60,sek,,"1,50",NULL,n/a,swish,stripe,pi_VZEH5P1BIF8S,,,Mar 29 2024 12:58,,NULL,,,,1,no,2024/03/29 12:58,pos,NaN
900747,830,noaherik391@email.com,15,SEK,3.75,,,failed,swish,square,,INV-202403-2625,,,,NULL,,VISA,,1,n/a,2024-03-27 14:19,stripe_export,
900748,1131,erikholm@email.com,35,,8.75,,,Paid,Klarna,manual,,,,09/05/2024 07:19,NaN,NaN,,amex,,n/a,no,2024/05/09 07:19,manual_sheet,
900749,292,mikaelås584@company.se,60,Sek,15.0,n/a,,payd,Klarna,stripe,,n/a,,,,n/a,NaN,visa,,,n/a,,stripe_export,n/a
900750,1133,oscarber@gmail.com,60,Sek,15.0,3.24,,Paid,,adyen,NULL,,,,,NaN,GB,mastercard,,,NULL,,,
900751,99999,user7299@email.com,40,EUR,,,,FAILED,Card,square,,INV-202401-7680,,2024/01/20 12:35,NaN,,n/a,mastercard,NaN,n/a,,,n/a,duplicate
900752,1009,NaN,60,SEK,,,,FAILED,,square,pi_IPBBV4ACNIJX,,,2024-01-02 18:09,,NULL,NO,visa,,,,2024/01/02 18:09,pos,
900753,476,mariamal@gmail.com,40,€,,,,pending,Klarna,stripe,pi_GK7MVNGZYPQ4,,,2024-04-03 21:42,n/a,NULL,NO,mastercard,,3,n/a,2024/04/03 21:42,manual_sheet,partial refund
900754,647,pedrosil686@company.se,35,Sek,,,,pending,SWISH,klarna,pi_KLTMGDLFG5XC,,RCPT_8NPPK6Y,2024/04/03 18:48,,NaN,,NaN,,NaN,0,2024/04/03 18:48,pos,
900755,368,user3292@gmail.com,15,SEK,,NaN,13.06,pending,bank transfer,adyen,ch_0KUO1XLSQM,,RCPT_X3THYQL,2024-02-01 13:17,n/a,NaN,SE,,,3,0,2024/02/01 13:17,pos,duplicate
900756,981,fatimakh311@gmail.com,25,€,,"1,50",,Refunded,NULL,manual,,,,2024/04/16 07:58,,,,,,,yes,2024/04/16 07:58,,manual correction
900757,751,user8906@gmail.com,15,SEK,n/a,1.94,13.06,failed,SWISH,klarna,,INV-202403-1435,,12/03/2024 13:48,,NaN,,,,n/a,1,n/a,stripe_export,manual correction
900758,749,ellaberg@gmail.com,25,€,,"1,50",22.77,failed,Card,manual,,,,2024-04-02 15:20,,re_1B1N8WA99L,NO,mastercard,,3,,,pos,manual correction
900759,598,,20,Sek,,"1,50",,Pending,card,stripe,ch_3C5V4EOJL0,,,2024-02-09T19:04:00,NaN,NULL,,NaN,,3,,2024-02-09 19:04,square_export,
900760,794,,35,EUR,,,,Pending,SWISH,adyen,,,n/a,Mar 18 2024 08:23,,,GB,,,one,NULL,2024/03/18 08:23,stripe_export,manual correction
900761,,maríalóp@gmail.com,25,SEK ,,,,payed,SWISH,klarna,pi_N1VGO1GYF84M,,RCPT_JM6JEW0,,NULL,,ES,amex,,,NaN,,,partial refund
900762,516,user1049@email.com,35,SEK,,,,Refunded,invoice,stripe,,,RCPT_Z5I00UU,2024-01-12 21:45,n/a,n/a,NaN,,,,,2024-01-12 21:45,stripe_export,n/a
900763,,norahans@gmail.com,60,EUR,15.0,3.24,,paid,invoice,klarna,,NaN,RCPT_9HGTCW2,May 10 2024 16:15,,,,,7722,,,,,manual correction
900764,680,user6988@email.com,60,SEK,,,,Refunded,cash,adyen,,,,2024-04-16 20:59,,,GB,visa,,,1,NULL,NaN,
900765,766,oscarber@gmail.com,60,Sek,,3.24,,payd,,square,,INV-202403-9015,,2024/03/23 09:38,NULL,NULL,NaN,VISA,,n/a,1,,,
900766,153,erikholm220@email.com,15,SEK,,,,payed,bank_transfer,square,NULL,,RCPT_LATIJ80,2024-04-19 09:58,,,ES,mastercard,5765,2,no,,pos,manual correction
900767,1087,luispere513@gmail.com,20,SEK ,5.0,,17.92,paid,bank transfer,klarna,ch_35U7970BVB,,,10/01/2024 12:49,,n/a,,,7454,,NaN,,,
900768,511,user6149@email.com,25,EUR,6.25,n/a,22.77,Refunded,cash,adyen,pi_KLSCI4C9MQEK,,RCPT_ILJJVVQ,,,,NaN,visa,,2,NaN,2024/03/09 21:58,pos,manual correction
900769,462,luispere582@gmail.com,25,EUR,,,,pending,bank_transfer,square,,,,2024/01/30 07:18,NULL,NaN,,,,2,yes,2024-01-30 07:18,stripe_export,
900770,,davidsto391@company.se,60,sek,,,,Pending,,adyen,,,RCPT_K6S4IFD,19/03/2024 15:29,,re_W8ZBYZPX2E,,,,NULL,,2024/03/19 15:29,stripe_export,
900771,1101,karinlun413@email.com,,SEK,,"1,50",,payed,SWISH,klarna,NULL,INV-202402-3647,,Feb 13 2024 09:03,,,PT,,6315,,1,,manual_sheet,manual correction
900772,133,NULL,25,EUR,,"1,50",22.77,payed,,adyen,ch_N6J6Z2HFVA,INV-202401-4072,,Jan 17 2024 10:46,n/a,,SE,mastercard,2064,3,0,NaN,manual_sheet,manual correction
900773,545,erikholm288@gmail.com,40,,,,,PAID,swish,manual,ch_4KV1BN9V3X,NULL,,,NaN,,SE,n/a,4866,,no,2024/03/21 08:15,pos,
900774,720,,25,SEK ,6.25,2.23,,Pending,invoice,klarna,NULL,,NULL,2024-04-12T07:39:00,n/a,NaN,GB,,,2,,NaN,,manual correction
900775,899,NULL,25,SEK ,,,,FAILED,invoice,square,ch_46IPWOTPS9,,,2024-05-02T15:41:00,NULL,n/a,,amex,3076,NULL,yes,2024/05/02 15:41,NULL,
900776,297,user1825@gmail.com,25,SEK,,,22.77,failed,,manual,pi_1YH9SXNV400Y,INV-202401-7791,,,NaN,,ES,,,n/a,0,2024-01-12 19:20,,duplicate
900777,220,user9087@gmail.com,35,EUR,8.75,2.52,n/a,Refunded,Klarna,klarna,ch_Q53LCEY1KQ,n/a,NULL,2024-04-11 18:37,NULL,n/a,SE,VISA,,,n/a,,manual_sheet,manual correction
900778,581,,20,Sek,,,,Pending,swish,manual,pi_YW4WM0GIXDRO,INV-202402-2348,RCPT_DEEIX6U,2024/02/12 22:28,n/a,,ES,NaN,,,n/a,,manual_sheet,manual correction
900779,744,n/a,20,SEK ,,,,Paid,Klarna,adyen,pi_D73WOSLGGJOX,,RCPT_510WBBD,2024-01-08T07:13:00,n/a,,,,,n/a,0,2024/01/08 07:13,manual_sheet,
900780,844,emmajoha446@gmail.com,15,SEK ,NULL,1.94,n/a,failed,invoice,stripe,ch_DNR15SBQSX,,RCPT_GYUHE79,2024/03/15 12:30,NaN,NULL,n/a,visa,n/a,n/a,NULL,,pos,n/a
900781,1013,anagarci844@company.se,60,EUR,15.0,"1,50",,payd,SWISH,manual,,,RCPT_DWKQQEX,n/a,,,SE,VISA,,2,,2024/02/06 18:54,,partial refund
900782,749,user3612@email.com,20,€,5.0,2.08,,paid,cash,adyen,NULL,INV-202401-9576,,Jan 16 2024 13:40,NULL,n/a,,,,,,2024/01/16 13:40,,NULL
900782,804,,35,SEK ,8.75,2.52,,failed,cash,adyen,,,,2024/03/06 16:53,,,GB,,NULL,1,no,2024-03-06 16:53,NaN,
900784,1177,jonasnil671@email.com,15,EUR,,1.94,13.06,Paid,bank transfer,stripe,NaN,,,08/02/2024 11:31,NaN,,,,,1,1,,stripe_export,
900785,1176,user2039@email.com,35,Sek,,"1,50",,pending,bank_transfer,NaN,pi_XXO1B8Y7O2IM,INV-202403-2460,,2024-03-28 12:59,,,ES,VISA,,1,0,2024-03-28 12:59,pos,duplicate
900786,526,user2110@gmail.com,60.00,SEK ,15.0,,56.76,paid,cash,NULL,ch_TW4NOK7SBM,,,,,n/a,NO,,8260,3,,2024-02-20 22:41,manual_sheet,
900787,788,,35,sek,,"1,50",,failed,bank_transfer,adyen,NaN,,,2024-01-04T12:44:00,NaN,,ES,,NaN,NaN,n/a,,pos,partial refund
900788,223,,35,SEK ,,,,PAID,card,klarna,ch_FGH3JRFVT0,INV-202402-1153,RCPT_GXEXJPR,23/02/2024 18:00,,,,mastercard,,,,,square_export,partial refund
900789,845,jonasnil950@outlook.com,60,Sek,n/a,3.24,56.76,paid,SWISH,square,pi_5RQBT4GY80BY,NULL,,2024/05/06 07:06,,re_Z9V6UTIXNW,SE,,NaN,,yes,,manual_sheet,NaN
900790,277,saralind@gmail.com,40,EUR,,,37.34,pending,card,stripe,,NaN,RCPT_CR45OSB,2024-05-08 16:26,,n/a,,visa,,2,no,,manual_sheet,
900791,494,erikholm735@email.com,20,SEK ,5.0,"1,50",17.92,FAILED,card,stripe,,,NaN,2024-01-23T09:50:00,NULL,NaN,NO,NaN,,,,NULL,,duplicate
900792,1111,mariamal123@company.se,25,Sek,6.25,n/a,,Refunded,bank transfer,klarna,,INV-202402-4256,,,NaN,,NULL,mastercard,,,0,2024-02-22 22:33,manual_sheet,manual correction
900793,516,anagarci517@outlook.com,20,Sek,,2.08,17.92,FAILED,invoice,stripe,,,,2024/03/31 19:19,,re_6RB4ANAV0V,PT,,8415,1,,,pos,n/a
900794,489,erikholm@email.com,60,SEK,,,,Refunded,swish,square,,n/a,,Apr 20 2024 14:53,,,PT,,,2,n/a,2024-04-20 14:53,pos,
900795,761,user9890@email.com,20.00,€,5.0,,,refunded,card,manual,pi_DMANCRIOY6BK,INV-202403-2897,RCPT_ER6ROTW,,2024-03-30 19:03,,PT,NULL,,one,1,2024/03/30 19:03,pos,NULL
900796,8,oliviali438@outlook.com,60,sek,,NaN,56.76,payd,cash,manual,,,,,,NULL,GB,visa,,,,n/a,pos,
900797,277,n/a,40,sek,,,,Pending,,klarna,pi_OCTNS88LRYU7,,,2024-02-08T17:03:00,,,SE,visa,,,,n/a,stripe_export,NULL
900798,19,ellaberg691@outlook.com,25 SEK,,6.25,,,Refunded,SWISH,manual,,,,2024-04-10 19:43,2024-04-10 19:43,,,amex,,,,2024-04-10 19:43,manual_sheet,NaN
900799,113,user9619@gmail.com,35,SEK ,,2.52,,Pending,swish,klarna,,,,Mar 13 2024 09:36,,,ES,visa,,one,0,2024/03/13 09:36,pos,partial refund
900800,1013,NULL,20,sek,,,,refunded,card,klarna,ch_5R5D7V6KLP,NULL,,2024/02/01 18:29,,re_CGLIVLCF8V,ES,amex,5174,2,,2024-02-01 18:29,square_export,partial refund
900801,259,user2966@gmail.com,"35,00",sek,NaN,,32.48,Paid,invoice,adyen,pi_3BS7KCTVR2EI,INV-202401-2820,,30/01/2024 22:56,,NaN,SE,VISA,,,,2024/01/30 22:56,square_export,duplicate
900802,852,ahmedali@gmail.com,35,EUR,,,,paid,Klarna,square,NULL,,RCPT_15D9ANZ,2024/03/11 21:47,n/a,n/a,NO,,,,NULL,2024-03-11 21:47,stripe_export,NaN
900803,316,user3135@email.com,35,sek,8.75,,32.48,payed,invoice,manual,ch_74KA8O3BIK,,RCPT_HO5JSCY,2024-01-20 18:11,,n/a,SE,VISA,4905,1,,NaN,manual_sheet,
900804,177,user8416@gmail.com,15,SEK,,,,pending,SWISH,n/a,pi_R7HM476SBRBJ,INV-202403-1025,,2024-03-24T14:20:00,,n/a,GB,mastercard,n/a,1,1,2024/03/24 14:20,square_export,
900805,155,erikholm@gmail.com,40,€,10.0,NULL,37.34,Paid,invoice,klarna,pi_N1IYCE38KNCC,INV-202403-9698,,2024-03-28 20:44,,,PT,,8691,1,yes,2024-03-28 20:44,n/a,
900806,795,saralind733@gmail.com,35,sek,,NaN,,pending,bank_transfer,manual,,,RCPT_PFG72C8,Jan 24 2024 22:39,,n/a,,NULL,,1,,2024/01/24 22:39,,partial refund
900807,131,user5401@email.com,35,NULL,,2.52,,pending,Klarna,stripe,pi_OEXJNSGNPX6V,INV-202403-5043,n/a,2024-03-19 13:49,,,,,,,yes,2024-03-19 13:49,,duplicate
900808,1003,user4228@gmail.com,40,Sek,,"1,50",,payd,invoice,square,,,,2024-01-21T11:21:00,NaN,n/a,,mastercard,,2,no,,pos,NULL
900809,623,NaN,20,sek,,2.08,,payd,invoice,klarna,pi_2Z4RP6HI5LFZ,,,2024-03-09 20:08,n/a,re_7R9VJEPHV4,SE,,,2,no,2024/03/09 20:08,stripe_export,n/a
900810,502,saralind838@email.com,20,sek,5.0,,,Pending,NULL,square,,,,,,re_UJJ3GFSK82,PT,NaN,,,,2024/02/07 15:08,pos,NULL
900811,15,norahans10@email.com,NaN,sek,15.0,,,payed,invoice,adyen,n/a,,NaN,2024-03-11T13:05:00,n/a,,PT,,8653,n/a,,2024/03/11 13:05,,partial refund
900812,572,liamande@gmail.com,20,NULL,5.0,,,Refunded,bank_transfer,stripe,,,,NULL,,NaN,NULL,NULL,n/a,3,1,,square_export,duplicate
900813,835,luispere@email.com,25,Sek,,,NULL,Paid,swish,stripe,,,,2024-03-05T19:40:00,NULL,,ES,,7998,,no,2024/03/05 19:40,manual_sheet,
900814,988,ahmedali393@gmail.com,35,€,8.75,2.52,32.48,refunded,bank transfer,manual,NaN,,,2024-02-29T11:41:00,,NULL,PT,NaN,,,,2024-02-29 11:41,stripe_export,
900815,226,,20,NaN,5.0,,,PAID,Card,manual,,INV-202401-5342,,Jan 07 2024 22:19,NaN,,SE,,,1,NULL,2024-01-07 22:19,square_export,manual correction
900816,512,oskarber759@company.se,60,€,,,56.76,Paid,swish,square,ch_XS9BFJ2X9G,INV-202403-6592,,NaN,,NULL,,,,,n/a,2024/03/12 17:25,,partial refund
900817,220,user1054@email.com,25,sek,6.25,2.23,,pending,SWISH,square,,,NaN,2024/03/06 15:56,NULL,NULL,,mastercard,,,,,pos,
900818,99999,oscarber791@outlook.com,40,€,NULL,,,failed,SWISH,square,,NaN,NULL,,,n/a,NULL,,,,0,2024-03-07 14:14,pos,manual correction
900819,945,user670@gmail.com,NaN,SEK ,5.0,2.08,,Pending,cash,stripe,ch_KAUIXJOGRB,,RCPT_N92UAW2,2024-04-29T17:45:00,n/a,NULL,,mastercard,,2,NaN,2024/04/29 17:45,stripe_export,manual correction
900820,418,linchen450@email.com,15,SEK,,1.94,13.06,Refunded,invoice,stripe,pi_6QF3D3XOOQL7,INV-202401-9263,RCPT_XJLTDDW,,,,,visa,8313,1,yes,NaN,manual_sheet,
900821,1123,user7227@email.com,25,SEK ,,"1,50",NULL,refunded,swish,adyen,ch_1RBPKZD85B,INV-202404-1023,,NULL,NaN,,,visa,,2,,2024/04/13 19:40,,partial refund
900822,1157,user2789@email.com,,EUR,,,,payed,card,manual,,,,,,,NULL,,4649,2,,,manual_sheet,partial refund
900823,151,user4458@email.com,20,EUR,,,,payed,bank_transfer,adyen,pi_0L1KBU6ODZU4,,RCPT_TX41E53,2024/02/04 10:12,NaN,n/a,NaN,amex,,1,0,2024/02/04 10:12,square_export,manual correction
900824,52,anagarci844@company.se,25,SEK,,NULL,,refunded,Card,n/a,,,,2024/01/08 19:29,,,,NULL,,2,yes,2024/01/08 19:29,square_export,
900825,370,NULL,35,SEK,8.75,,32.48,Paid,swish,square,,INV-202402-2295,RCPT_TEMWH0Z,,,,,,NaN,,no,,stripe_export,
900826,313,user2341@gmail.com,,Sek,NULL,2.66,NULL,failed,SWISH,manual,,,RCPT_I15WZ50,2024-04-03 11:31,n/a,re_1GUYWVO83W,,visa,,1,0,2024/04/03 11:31,stripe_export,duplicate
900827,721,mariamal803@email.com,35,Sek,,,,refunded,bank_transfer,adyen,,,,NaN,,n/a,GB,,NaN,3,n/a,2024-05-03 09:11,,NULL
900828,324,user5666@email.com,20,SEK ,,,,Paid,cash,square,pi_XXQA1LWK6VG1,,,2024/03/22 18:36,,re_IUHUXTZH63,,VISA,6514,,n/a,NULL,pos,
900829,1180,user7147@gmail.com,NaN,SEK ,NaN,1.94,,paid,bank transfer,stripe,,,,yesterday,n/a,,ES,,,,,2024-04-05 08:59,manual_sheet,manual correction
900830,55,mariamal123@company.se,25,€,,,,Pending,cash,adyen,,INV-202405-8854,,,NULL,re_KA8S6XKN6U,NaN,,,,,2024/05/09 21:19,manual_sheet,
900831,871,NaN,25,sek,6.25,2.23,,PAID,SWISH,klarna,pi_TI4U2FPFVDTP,,RCPT_D6SZ4XE,01/01/2024 13:20,NaN,re_KG6UAZKIL0,GB,VISA,,,no,2024/01/01 13:20,square_export,duplicate
900832,640,n/a,40,Sek,NULL,,,failed,card,klarna,,,,Mar 29 2024 22:56,,NULL,SE,,,NaN,1,,,duplicate
900833,1002,jonasnil@email.com,35,,,NULL,,refunded,bank_transfer,adyen,pi_3UQZFCOQ2YHJ,INV-202404-9754,,,,NaN,PT,,,3,no,2024-04-06 18:39,pos,duplicate
900834,475,anagarci16@gmail.com,35,SEK ,,"1,50",,Refunded,,klarna,,,,2024-04-19 16:46,,NaN,SE,,9387,1,no,,stripe_export,partial refund
900835,109,user4038@gmail.com,,Sek,3.75,1.94,,failed,n/a,manual,,,,,,,,,,NaN,,2024-02-23 09:31,manual_sheet,
900836,55,oscarber524@email.com,35,SEK,,"1,50",n/a,Paid,cash,adyen,pi_T0BXG9ZRX7U7,,,Apr 22 2024 17:30,NaN,n/a,NO,amex,,one,NULL,2024/04/22 17:30,manual_sheet,manual correction
900837,573,jonasnil@email.com,20,Sek,,,,Pending,cash,square,,,RCPT_PMPGTZK,04/05/2024 10:16,NULL,NULL,NaN,,NULL,one,1,,manual_sheet,
900838,520,davidsto@gmail.com,15,sek,,,,refunded,invoice,square,,,NULL,,2024-03-15 18:18,NaN,GB,NULL,,,,2024-03-15 18:18,,
900839,832,jonasnil@email.com,60.00,SEK ,,,,Refunded,card,adyen,n/a,,,2024-04-26T09:40:00,NULL,,NaN,visa,n/a,2,yes,2024-04-26 09:40,manual_sheet,duplicate
900840,432,oscarber650@outlook.com,60,Sek,NULL,NULL,56.76,Refunded,Klarna,stripe,ch_UDYDU7JASS,,RCPT_OJCTIDK,2024/04/16 19:43,n/a,n/a,,NULL,n/a,one,yes,2024/04/16 19:43,stripe_export,manual correction
900841,879,user5878@gmail.com,25,SEK ,,,,paid,invoice,square,,,,05/02/2024 18:17,NaN,,,,2779,,no,2024-02-05 18:17,,
900842,94,NaN,35,Sek,,,,Refunded,cash,n/a,,,,Mar 14 2024 18:59,NaN,n/a,SE,n/a,,,,2024/03/14 18:59,NULL,partial refund
900843,172,noaherik618@outlook.com,35,€,,,32.48,Pending,card,klarna,ch_73BIA6RRS7,INV-202403-2416,,2024-03-07T10:27:00,,,ES,mastercard,6470,one,,,pos,manual correction
900844,645,user9290@email.com,35,EUR,8.75,2.52,,FAILED,Card,manual,pi_6FFBMQ04EWUU,INV-202404-4138,,,,n/a,PT,VISA,2651,one,no,,stripe_export,
900845,1186,NULL,,SEK,6.25,,,FAILED,Klarna,square,,INV-202401-3077,,,,NaN,ES,visa,,NULL,no,,pos,NULL
900846,372,NULL,40,SEK,10.0,,,pending,card,stripe,pi_DAX4CYFO30DC,,,10/05/2024 22:17,NULL,,GB,visa,7884,3,NULL,2024-05-10 22:17,pos,NaN
900847,1105,user5834@gmail.com,NULL,SEK,,,,Paid,,stripe,pi_PFRPF6TN0TOB,INV-202402-9134,,Feb 17 2024 10:07,NaN,re_DD945G8QB9,NULL,visa,,one,,2024/02/17 10:07,,NaN
900848,602,user7860@gmail.com,20,€,5.0,,,FAILED,Klarna,square,ch_YSHR92RD6J,INV-202401-8660,,17/01/2024 18:58,,NaN,NaN,visa,,,,2024-01-17 18:58,stripe_export,duplicate
900849,753,user4389@gmail.com,20,SEK,NULL,,,failed,card,adyen,,INV-202402-2139,RCPT_WDQETGI,Feb 21 2024 11:43,,NULL,ES,NaN,,NULL,,,stripe_export,
900850,536,erikholm746@gmail.com,60,Sek,,n/a,,payed,swish,klarna,ch_N6H846HZW6,,NaN,n/a,NULL,NULL,NULL,visa,3040,3,1,NaN,stripe_export,duplicate
900851,342,user6871@email.com,25.00,EUR,6.25,"1,50",22.77,FAILED,SWISH,square,,NaN,,,,,PT,,,one,,NULL,,
900852,6,maríalóp21@company.se,25,SEK,,,,payd,swish,klarna,pi_U6P77GZ4JLO3,INV-202402-2647,RCPT_UH5PNKI,2024-02-30 12:00,,n/a,SE,,,,,2024/02/28 07:01,,duplicate
900853,10,anagarci@gmail.com,35,sek,,2.52,NaN,paid,Klarna,manual,,,,28/01/2024 10:59,NULL,n/a,NULL,NaN,8164,n/a,1,,,manual correction
900854,557,karinlun@gmail.com,40,€,10.0,2.66,,payed,SWISH,manual,n/a,,RCPT_4EYSLNG,2024-03-14 13:32,,,n/a,,,NaN,,2024/03/14 13:32,manual_sheet,
900855,402,ellaberg952@outlook.com,35,EUR,,2.52,32.48,NULL,invoice,klarna,ch_SQCZDK6OCC,,,2024/03/07 12:54,NULL,NaN,ES,,,2,,,manual_sheet,duplicate
900856,1077,jonasnil31@outlook.com,20,EUR,,,,FAILED,invoice,klarna,pi_EWE18YYCZN4V,INV-202404-3020,,2024/04/26 20:29,,,GB,VISA,,,,2024/04/26 20:29,stripe_export,duplicate
900857,830,karinlun@gmail.com,60,EUR,,NaN,56.76,PAID,bank transfer,adyen,,NULL,,2024/04/08 14:51,,NaN,,visa,7936,,,2024/04/08 14:51,NaN,partial refund
900858,385,liamande293@outlook.com,20,Sek,,,,Pending,cash,klarna,,INV-202404-5729,RCPT_IHWPRS0,05/04/2024 13:33,,,PT,,,NULL,yes,,,
900859,284,n/a,25,Sek,,2.23,n/a,FAILED,n/a,square,,NaN,RCPT_IG29DD9,Feb 07 2024 08:36,n/a,re_V77BHO2UZH,n/a,,,NULL,,2024/02/07 08:36,,
900860,216,luispere582@gmail.com,15,SEK ,,n/a,,pending,SWISH,square,,INV-202403-7589,RCPT_YJ459M8,2024/03/02 09:54,NaN,NULL,GB,,,1,,2024-03-02 09:54,,
900861,466,user1389@gmail.com,40,SEK ,10.0,,37.34,failed,bank transfer,,pi_DFE4IM6QK00H,INV-202403-3190,NULL,Mar 17 2024 15:38,,n/a,GB,amex,,,,2024-03-17 15:38,,duplicate
900862,123,user6060@email.com,15,SEK ,,,NULL,FAILED,card,NaN,ch_EKR5OR8FVQ,,,2024-04-22 13:10,,n/a,SE,NaN,4706,one,,2024-04-22 13:10,pos,manual correction
900863,360,pedrosil@gmail.com,60,sek,,,,Refunded,Card,stripe,,INV-202403-2033,RCPT_S90EUSC,2024/03/22 17:48,,n/a,,,1016,,NULL,2024/03/22 17:48,pos,
900864,591,NaN,15,SEK ,3.75,,NULL,paid,card,NaN,,NaN,RCPT_6SQ7IP3,,,,,VISA,,one,1,,,manual correction
900865,218,user8940@email.com,60,Sek,,"1,50",,payd,cash,stripe,pi_BZ7MX7LUNEYE,,,2024-03-20T16:43:00,,re_NSKXFVH86E,,,,2,,2024/03/20 16:43,stripe_export,
900866,99999,NULL,15,sek,3.75,"1,50",13.06,Refunded,invoice,stripe,,,,2024-05-09 13:27,,,SE,VISA,NULL,,yes,,pos,manual correction
900867,491,saralind733@gmail.com,20,EUR,,,,refunded,bank_transfer,adyen,,,,26/04/2024 14:36,NaN,n/a,NO,VISA,,,,2024/04/26 14:36,pos,NULL
900868,510,NULL,15,Sek,,"1,50",13.06,Paid,swish,square,ch_VUV9B7ROXO,NaN,,2024-01-12T08:05:00,,,SE,,1050,one,0,2024/01/12 08:05,n/a,n/a
900869,3,elinsven653@email.com,40,EUR,NULL,,37.34,Pending,SWISH,stripe,NULL,INV-202404-8641,RCPT_96B1KJ1,Apr 19 2024 19:38,,,NULL,n/a,n/a,one,,2024-04-19 19:38,,manual correction
900870,878,NaN,20,SEK,5.0,,17.92,payd,bank_transfer,stripe,,,NULL,09/01/2024 09:01,,,,VISA,,1,n/a,2024-01-09 09:01,,duplicate
900871,134,norahans581@company.se,60,SEK,,,,Refunded,invoice,stripe,,,RCPT_0QJKG2Y,2024-02-18T17:59:00,n/a,n/a,,mastercard,6882,one,,,stripe_export,
900872,676,user5368@gmail.com,20,€,,"1,50",,refunded,Card,stripe,ch_MKZBWA9NPT,,RCPT_4N1H6SR,2024/02/02 08:59,,,PT,visa,,,,2024/02/02 08:59,stripe_export,NULL
900873,954,oscarber830@gmail.com,,€,5.0,,,failed,invoice,klarna,pi_5WERS9IN6PDQ,INV-202401-4292,,24/01/2024 14:54,,,SE,NaN,1688,,1,,,
900874,1069,anagarci@email.com,60,SEK,15.0,3.24,56.76,Refunded,,adyen,ch_CB370T4L0S,INV-202402-3068,,11/02/2024 20:32,,NULL,PT,n/a,,2,n/a,,pos,manual correction
900875,21,user9112@email.com,15,,3.75,,,Pending,SWISH,manual,,INV-202404-7275,,2024-04-25T10:17:00,NULL,n/a,SE,visa,,2,yes,2024-04-25 10:17,,duplicate
900876,392,saralind@gmail.com,40,sek,10.0,,NULL,payd,swish,stripe,pi_YSE9EMSH74QE,NaN,RCPT_V11NZ2S,08/02/2024 08:48,NULL,re_BVIC96WW57,NO,,9518,NULL,n/a,,pos,manual correction
900877,1055,oliviali965@email.com,35,SEK,8.75,2.52,n/a,payd,swish,adyen,,INV-202404-8777,,Apr 28 2024 22:07,NaN,re_H0E0KBIXGB,PT,,NaN,,,,NULL,NULL
900878,539,user2236@email.com,25,€,,"1,50",22.77,FAILED,Klarna,n/a,n/a,,n/a,2024-04-23 20:15,n/a,,GB,mastercard,,one,,2024/04/23 20:15,square_export,
900879,1146,mariamal848@company.se,35,€,8.75,,NaN,paid,cash,klarna,,INV-202402-4640,,2024-02-20 13:13,,NaN,,visa,,n/a,yes,,stripe_export,n/a
900880,879,user6807@email.com,60,Sek,15.0,,56.76,payed,Card,stripe,,,RCPT_Z4I1MG6,,,,,visa,,n/a,yes,,stripe_export,
900881,410,user5781@email.com,25,€,6.25,"1,50",,pending,invoice,square,ch_K7LOT1K4FR,INV-202405-3295,RCPT_38FZG4I,,,,,NaN,,1,NULL,,square_export,
900882,1183,emmajoha970@company.se,20,SEK,n/a,,NaN,payed,card,square,NaN,,,Feb 05 2024 16:43,NULL,NULL,GB,,,,0,2024-02-05 16:43,stripe_export,duplicate
900883,578,ahmedali789@outlook.com,35,SEK,8.75,,,PAID,cash,klarna,,,,2024/01/06 17:01,,n/a,NO,NULL,7854,,,,,
900884,794,NaN,15,SEK ,,,,refunded,bank_transfer,manual,ch_ZOWYW0Z1QJ,,RCPT_2RUQ3US,11/02/2024 08:31,2024-02-11 08:31,n/a,n/a,,,2,0,,,
900885,2677,oskarber759@company.se,NaN,€,15.0,3.24,,paid,NaN,adyen,ch_XT64OM26NJ,,NaN,Feb 08 2024 15:49,,NULL,SE,amex,,2,1,,stripe_export,duplicate
900886,653,emmajoha970@company.se,40,SEK ,,2.66,,refunded,Klarna,stripe,,,,NULL,,n/a,ES,,,1,no,,square_export,duplicate
900887,1005,oliviali965@email.com,NULL,,,n/a,NULL,paid,cash,stripe,ch_AZUHW3WFP0,,,Apr 30 2024 19:29,,NaN,PT,n/a,,1,NaN,,stripe_export,
900888,325,karinlun@gmail.com,20,SEK ,,,17.92,PAID,swish,stripe,NaN,,RCPT_UT7WQEA,2024/02/05 18:25,,n/a,,,,NaN,1,,,
900889,102,user4613@email.com,60,EUR,15.0,,,paid,invoice,klarna,,,RCPT_C4CT16X,2024-05-02 11:50,,re_FKV5G9XW3T,SE,VISA,,one,,,pos,manual correction
900890,1044,user1953@gmail.com,,€,8.75,,32.48,Paid,Card,manual,ch_PUQ5XTPW74,,RCPT_EUXPSGN,2024-04-19 09:33,,re_GKONA7T7FM,ES,,6445,one,NaN,2024-04-19 09:33,manual_sheet,duplicate
900891,776,NaN,NULL,EUR,5.0,,,paid,Klarna,square,ch_L6HJD4BUEK,INV-202404-2582,,Apr 26 2024 14:15,,,ES,,,1,NaN,2024/04/26 14:15,manual_sheet,manual correction
900892,955,linchen450@email.com,15,Sek,,,,NULL,bank transfer,adyen,,,RCPT_3ZC0Z3L,May 01 2024 16:34,NULL,,SE,,NULL,NULL,NaN,,square_export,duplicate
900893,439,user5871@email.com,15,SEK,NULL,,,pending,n/a,adyen,n/a,,,,NaN,NaN,NULL,,6800,,NULL,,square_export,duplicate
900894,609,noaherik@email.com,25,€,,,22.77,FAILED,bank transfer,klarna,pi_E7TNEW4KPSK8,,RCPT_ETQ939M,2024-03-22T14:35:00,,,,amex,,n/a,,,manual_sheet,
900895,7,saralind733@gmail.com,35,EUR,8.75,,n/a,Paid,card,stripe,,NULL,,2024-01-20 19:52,NaN,,PT,,,,,,square_export,NaN
900896,237,sofiaand747@gmail.com,35,Sek,8.75,"1,50",,pending,bank_transfer,manual,,,RCPT_UMGNOLG,2024-03-07T13:48:00,NaN,re_I57OPBRWYZ,NO,,n/a,,,2024/03/07 13:48,manual_sheet,duplicate
900897,230,oskarber@gmail.com,n/a,EUR,,2.52,,payd,,,,,RCPT_GKMQV7A,2024-01-24T09:04:00,NaN,,GB,,n/a,,,,,
900898,989,user8814@gmail.com,,Sek,6.25,2.23,22.77,FAILED,bank transfer,manual,ch_K3RGNBDB7M,INV-202402-8803,,2024/02/16 07:49,NaN,,GB,NULL,,1,,2024/02/16 07:49,n/a,partial refund
900899,1035,,40,sek,10.0,NULL,,FAILED,cash,square,pi_0PC4YU1WEQ8O,,,28/03/2024 07:28,NULL,NULL,,,,NaN,yes,2024-03-28 07:28,manual_sheet,
900900,1186,user5577@email.com,15,EUR,3.75,1.94,,Refunded,invoice,n/a,pi_4NC5E9R96AP5,INV-202402-4285,RCPT_N6VJVQR,,2024-02-21 09:45,,ES,NULL,,2,no,2024-02-21 09:45,pos,
900901,1120,liamande101@company.se,35,EUR,,,32.48,,bank_transfer,adyen,,,,Feb 24 2024 16:17,NULL,NaN,GB,mastercard,9846,1,NaN,2024-02-24 16:17,manual_sheet,partial refund
900902,1078,oskarber@gmail.com,40,Sek,10.0,"1,50",,FAILED,NaN,adyen,,,NaN,,n/a,NaN,GB,visa,7729,one,,2024/04/17 20:31,square_export,
900903,1146,user1920@email.com,15,SEK ,3.75,,13.06,paid,card,klarna,,,RCPT_CN19GI0,,,NULL,,visa,,,NaN,2024/01/03 08:08,pos,
900904,917,NaN,60,sek,15.0,3.24,,PAID,invoice,square,ch_KWBLV6Q8N2,INV-202401-7131,,2024/01/06 20:10,NaN,re_55VGUX1ADT,,,,one,yes,2024/01/06 20:10,square_export,NULL
900905,679,karinlun871@gmail.com,15,SEK ,,n/a,,Refunded,invoice,stripe,pi_WL3I9C9ZLE60,NaN,RCPT_LXX9TR8,,n/a,NULL,GB,,n/a,NaN,0,,manual_sheet,
900906,421,linchen175@outlook.com,20,SEK,,2.08,,PAID,Card,stripe,pi_ROZPAI5FXQZ6,INV-202405-2352,NULL,NaN,,re_3BTGPXSJZY,,NULL,NaN,,NaN,,,
900907,954,user3773@gmail.com,60,SEK ,15.0,3.24,,Refunded,SWISH,adyen,pi_H5AIOYPLVFIE,INV-202404-8535,,Apr 24 2024 19:13,n/a,,NULL,amex,2495,,,,pos,partial refund
900908,49,maríalóp229@email.com,20,sek,5.0,,,failed,Klarna,stripe,,n/a,,,,n/a,PT,amex,,one,1,2024/04/21 15:28,square_export,partial refund
900909,852,anagarci713@email.com,n/a,€,8.75,,,pending,swish,stripe,,INV-202403-2864,,,NaN,,,NaN,,one,1,2024/03/02 15:32,pos,duplicate
900910,153,user6215@gmail.com,15,sek,NaN,NaN,,FAILED,bank_transfer,stripe,,,,,,n/a,PT,,,,no,2024-03-18 17:25,,
900911,426,user2810@email.com,n/a,SEK ,6.25,,22.77,payd,SWISH,adyen,NaN,INV-202403-9737,,10/03/2024 10:38,NULL,NaN,ES,NaN,7412,,no,2024-03-10 10:38,,partial refund
900912,304,sofiaand316@company.se,15,SEK,,,,pending,invoice,klarna,,NULL,,2024-03-02T18:15:00,NaN,,NaN,,1390,,1,,,partial refund
900913,358,NaN,35,sek,,,,failed,bank transfer,stripe,,,,2024-04-04T21:01:00,,,,visa,,3,0,n/a,manual_sheet,duplicate
900914,1176,user6795@email.com,35,EUR,,2.52,,Refunded,SWISH,adyen,,INV-202405-3875,NULL,,,NULL,,amex,,2,,2024/05/07 16:23,stripe_export,manual correction
900915,626,oskarber@gmail.com,25,SEK ,,"1,50",,PAID,Card,manual,,,,Feb 12 2024 18:00,,NULL,PT,,,NULL,,,pos,
900916,550,,,NULL,,2.23,,payed,,klarna,,INV-202404-9984,RCPT_D8UI896,,NULL,re_6I6QOTGGZE,,amex,n/a,3,,2024/04/29 22:27,manual_sheet,partial refund
900917,732,jonasnil950@outlook.com,25,Sek,6.25,"1,50",,payed,bank transfer,manual,NULL,,RCPT_DK1PWXX,07/03/2024 08:50,,re_H6AV5UJWHM,,NULL,,NULL,,2024/03/07 08:50,square_export,manual correction
900918,176,n/a,60,€,,NULL,56.76,failed,cash,manual,,,,2024-02-30 12:00,,NULL,PT,,,,0,2024-04-09 13:58,,
900919,56,noaherik618@outlook.com,35,EUR,,2.52,,,card,manual,,,,03/02/2024 21:51,NaN,,NO,mastercard,,n/a,1,2024/02/03 21:51,manual_sheet,
900920,1189,liamande293@outlook.com,,Sek,3.75,"1,50",n/a,Pending,Card,manual,,NULL,,2024-05-05 14:42,,NULL,PT,mastercard,,,,,square_export,manual correction
900921,622,pedrosil201@outlook.com,60,,,n/a,56.76,payd,card,klarna,,INV-202404-3718,NaN,2024-04-20 13:41,,NULL,,,2671,NaN,1,,,partial refund
900922,99,user4421@gmail.com,35,€,8.75,"1,50",,failed,Card,adyen,pi_C88D2CQQLFN5,,RCPT_G9Z36JY,2024-03-23T21:58:00,,re_MD5QXWHHAI,,,8560,,,2024-03-23 21:58,stripe_export,duplicate
900923,1106,user9075@gmail.com,15,Sek,,,,Pending,bank_transfer,adyen,NaN,NaN,RCPT_MMG98C7,Jan 10 2024 15:42,,,NaN,mastercard,1017,NaN,,2024/01/10 15:42,manual_sheet,partial refund
900924,959,user9571@email.com,15,EUR,NaN,1.94,13.06,payd,bank_transfer,,,,,2024-04-29T21:41:00,,,,n/a,,,1,,square_export,partial refund
900925,317,NaN,25,sek,6.25,2.23,,Refunded,invoice,stripe,NaN,INV-202401-4773,,2024/01/13 14:35,,NaN,NO,,,,1,,square_export,
900926,316,ahmedali547@outlook.com,20,SEK ,5.0,,,Pending,Klarna,square,,INV-202402-1087,RCPT_4LKJB6W,,NaN,NaN,ES,NaN,NaN,3,yes,2024-02-10 15:26,manual_sheet,partial refund
900927,120,karinlun175@email.com,60,SEK ,15.0,,56.76,payed,SWISH,square,ch_KDXZMW4OKB,,,Apr 21 2024 14:15,NaN,re_7U0D5ZELM0,SE,visa,8320,1,,2024-04-21 14:15,manual_sheet,
900928,1022,user6002@gmail.com,40,Sek,,,,n/a,bank_transfer,stripe,,,,04/02/2024 19:45,,NULL,NO,,,,0,,pos,partial refund
900929,978,elinsven10@gmail.com,25,SEK ,,,,failed,SWISH,klarna,pi_DGCN9H27HAJ1,,,Jan 13 2024 15:56,NULL,re_XH2SGJRXZ8,,mastercard,,,no,n/a,manual_sheet,
900930,519,sofiaand221@company.se,60,SEK ,15.0,"1,50",56.76,payed,card,klarna,,NULL,RCPT_BZKLW10,Apr 30 2024 22:39,,NaN,NO,,9649,1,,n/a,,NaN
900931,219,user2550@email.com,15,Sek,3.75,"1,50",,payed,NULL,adyen,ch_88LAB8TOM6,,RCPT_CBN7RBE,2024/04/27 12:31,NaN,NULL,SE,amex,7311,2,0,,square_export,duplicate
900932,560,ahmedali594@email.com,40,€,,,,payed,swish,adyen,pi_2IUNPKSNQKWK,INV-202404-4306,,,NaN,NaN,NaN,NULL,NaN,2,1,2024/04/21 10:09,,
900933,99999,n/a,40,EUR,10.0,,37.34,FAILED,Klarna,square,pi_3ZOJZOP7P77Y,,,2024-05-06T17:05:00,n/a,,SE,VISA,7102,one,NULL,,pos,
900934,817,erikholm65@gmail.com,60,SEK ,15.0,,,paid,invoice,klarna,ch_VQFTFPY4N5,NaN,RCPT_EYABPUF,NULL,,NaN,ES,,,1,,2024-03-28 18:44,manual_sheet,manual correction
900935,466,oscarber791@outlook.com,NaN,SEK ,,,n/a,payed,SWISH,stripe,,,RCPT_U8C2DB5,Mar 23 2024 09:16,,n/a,n/a,NULL,,1,0,,pos,
900936,226,jonasnil31@outlook.com,15,SEK,3.75,1.94,13.06,payd,SWISH,adyen,ch_ZDK2X9FAS8,INV-202401-9366,RCPT_XEM0T7E,2024-01-08 07:43,,,NO,,,2,NULL,2024-01-08 07:43,manual_sheet,partial refund
900937,259,user7985@email.com,25,SEK ,,,,Paid,Klarna,manual,pi_6CF7HYVVN6P8,INV-202405-4295,,2024-05-04T20:09:00,NULL,,SE,mastercard,7720,3,,,stripe_export,partial refund
900938,705,user3368@gmail.com,15,SEK,3.75,,13.06,Refunded,Klarna,,,,RCPT_G0M3N3A,2024-04-18 12:36,n/a,NULL,ES,VISA,,,no,,pos,
900939,257,user6436@gmail.com,25,€,,,,payed,swish,adyen,pi_O9K8O9RTW4D4,,,yesterday,NULL,NULL,ES,visa,,one,,,manual_sheet,manual correction
900940,502,user5986@gmail.com,35,sek,NULL,,,pending,cash,square,ch_JTSNHVT93H,INV-202402-2597,RCPT_EWCI4BI,NaN,NULL,n/a,,mastercard,,one,yes,2024-02-05 13:23,,duplicate
900941,235,,25,SEK,6.25,2.23,,pending,swish,manual,pi_VRB9QER8XXPE,INV-202402-6816,NaN,Feb 24 2024 17:31,,,,VISA,,1,,2024-02-24 17:31,stripe_export,manual correction
900942,437,oliviali@email.com,25,€,6.25,2.23,,failed,,klarna,pi_US4NIV8T2YIM,INV-202404-6916,NaN,2024-04-22 12:12,,,PT,amex,9867,,1,2024/04/22 12:12,square_export,
900943,548,anagarci248@company.se,20,EUR,,2.08,,Refunded,cash,manual,,,RCPT_X947UI6,2024-02-14T13:32:00,NaN,n/a,SE,,2044,,,n/a,,duplicate
900944,155,maríalóp527@gmail.com,35,SEK ,8.75,"1,50",,Pending,card,manual,ch_WZDUZJ5IH9,,,NaN,NaN,,,visa,,NULL,1,2024-01-17 11:29,pos,manual correction
900945,154,liamande@email.com,25,SEK,,2.23,,payd,n/a,manual,,,,2024/02/10 08:42,,NaN,,visa,,1,yes,2024-02-10 08:42,,
900946,,fridakar136@outlook.com,15,SEK,3.75,,,refunded,Klarna,manual,,NULL,RCPT_7BX8XXW,2024-02-04 20:10,,,NULL,,NULL,,,2024-02-04 20:10,pos,
900947,991,norahans@email.com,15,SEK ,3.75,,,paid,card,stripe,,n/a,,2024-02-30 12:00,,NULL,,visa,,one,,2024-01-01 16:08,,partial refund
900948,532,fridakar22@company.se,60,SEK ,NULL,"1,50",56.76,PAID,bank_transfer,,pi_CLD7PFA4Z2B7,n/a,n/a,2024-03-03T12:36:00,NULL,NULL,SE,,5170,,NaN,,square_export,duplicate
900949,627,norahans581@company.se,60,EUR,,,56.76,failed,invoice,klarna,ch_ELF8HEXD0O,,,2024-05-03T20:46:00,NaN,,PT,,NaN,1,NULL,,square_export,
900950,459,,35,EUR,8.75,,32.48,failed,bank transfer,square,,INV-202401-7020,,2024-01-05 13:40,,,ES,amex,,,n/a,,stripe_export,n/a
900951,95,user4868@gmail.com,20,€,,,,Paid,Klarna,square,n/a,NULL,,2024-01-23 09:09,NULL,,NaN,NaN,n/a,NULL,n/a,2024/01/23 09:09,manual_sheet,
900952,742,user9922@email.com,20,Sek,5.0,2.08,,Pending,Card,stripe,,,,2024-03-13 09:22,NULL,,,visa,7183,1,NULL,2024/03/13 09:22,manual_sheet,
900953,632,fatimakh@gmail.com,15,Sek,,1.94,,PAID,Card,adyen,ch_5Z5LRG5GFU,INV-202402-8340,RCPT_PI0S7DS,Feb 23 2024 15:38,,n/a,,visa,NULL,NaN,1,2024-02-23 15:38,pos,NULL
900954,252,user9654@gmail.com,60,sek,15.0,,,pending,cash,stripe,ch_XNJTS3RP66,INV-202404-4427,,Apr 21 2024 13:44,n/a,,NULL,mastercard,5328,one,n/a,2024/04/21 13:44,,partial refund
900955,847,jonasnil671@email.com,25,SEK ,,,,FAILED,Klarna,klarna,pi_C6PFM9U9HLKW,NaN,RCPT_QYOTPGO,19/04/2024 10:51,,NaN,GB,VISA,1607,NaN,,2024/04/19 10:51,pos,NULL
900956,1068,NaN,n/a,EUR,,,,paid,bank transfer,klarna,,,n/a,2024/04/06 18:26,,,n/a,,,2,,,,
900957,1133,user6342@email.com,60,Sek,15.0,,,failed,bank transfer,square,ch_ECAWBM70E0,INV-202403-9451,RCPT_7GRYMNU,Mar 10 2024 08:37,,,n/a,visa,,,,,stripe_export,partial refund
900958,982,user8116@gmail.com,35,€,,,,Pending,swish,stripe,,,RCPT_T0IPAB2,2024/02/16 19:34,,NaN,,visa,NaN,,yes,2024/02/16 19:34,manual_sheet,manual correction
900959,943,maríalóp@gmail.com,20,sek,,,,NULL,cash,stripe,,INV-202401-3804,RCPT_LGA3YAJ,2024-01-18 18:04,NaN,n/a,ES,mastercard,2789,NULL,,2024/01/18 18:04,stripe_export,n/a
900960,1093,user2632@gmail.com,20,SEK,,,,failed,SWISH,manual,pi_1TN75FSRMW2Q,,RCPT_JQRY3T5,,,,,mastercard,5181,3,,2024/04/01 08:51,square_export,
900961,44,user2161@gmail.com,,SEK,NaN,,,pending,SWISH,manual,,,,,NULL,,NULL,,,NULL,n/a,2024-01-20 10:43,stripe_export,duplicate
900962,301,norahans10@email.com,15,SEK,NaN,"1,50",,pending,Card,adyen,pi_9QSTW5UHU49Y,,,Mar 29 2024 09:53,,,,amex,,,,2024-03-29 09:53,pos,NULL
900963,607,mikaelås@email.com,40,EUR,10.0,,,FAILED,bank_transfer,klarna,pi_8GF24S2PQNFD,n/a,RCPT_022A1V1,05/04/2024 15:37,NaN,n/a,GB,mastercard,,one,,,stripe_export,NaN
900964,794,emmajoha882@outlook.com,15,SEK,3.75,,NULL,paid,SWISH,square,pi_L0Z1IRG0JV1Y,INV-202404-4609,RCPT_BZ5YNDV,14/04/2024 18:23,NaN,,,amex,,1,0,,square_export,manual correction
900965,452,user6255@email.com,40,€,10.0,"1,50",,pending,bank transfer,adyen,NULL,,NULL,,,NULL,ES,mastercard,,,,,manual_sheet,
900966,720,anagarci16@gmail.com,15,sek,3.75,1.94,,Pending,bank transfer,NULL,,,,2024-04-21 15:19,,NaN,NO,NULL,4393,,,,stripe_export,n/a
900967,627,linchen129@outlook.com,60,Sek,15.0,,56.76,PAID,swish,stripe,,NaN,,2024-03-14T20:01:00,NULL,,,,,1,,2024-03-14 20:01,,
900968,435,mariamal895@email.com,25,NULL,,2.23,,pending,Klarna,stripe,NaN,,,14/04/2024 18:30,n/a,n/a,n/a,,,1,n/a,,,manual correction
900969,474,user4799@gmail.com,35,Sek,8.75,,32.48,PAID,swish,manual,,INV-202404-8159,,Apr 12 2024 18:46,NaN,,,amex,4498,,NaN,,n/a,duplicate
900970,147,n/a,15,€,3.75,,NULL,pending,Klarna,square,pi_IYD2VH1CQ59O,,,,,n/a,SE,VISA,,3,no,2024/03/13 07:45,manual_sheet,NULL
900971,745,fridakar136@outlook.com,15,sek,,"1,50",,Refunded,card,adyen,ch_PL7UUSLBMX,n/a,,May 03 2024 19:38,NaN,,GB,VISA,9791,,,2024-05-03 19:38,square_export,manual correction
900972,556,saralind737@company.se,15,Sek,3.75,1.94,,Refunded,invoice,stripe,ch_F1WQ1MBNC5,,,28/01/2024 08:10,,NaN,SE,visa,1499,,yes,2024/01/28 08:10,square_export,duplicate
900973,278,sofiaand729@company.se,15,,,NULL,13.06,payed,Card,stripe,ch_BSKKJ4L496,,NULL,08/03/2024 21:36,n/a,,,mastercard,5123,,,2024-03-08 21:36,stripe_export,manual correction
900974,1180,linchen811@email.com,25,SEK,,"1,50",,Pending,bank transfer,stripe,,INV-202401-8230,,2024-01-22 13:23,NULL,NULL,NO,VISA,n/a,1,1,2024-01-22 13:23,manual_sheet,manual correction
900975,583,ellaberg691@outlook.com,25,€,6.25,,,paid,Klarna,stripe,,,RCPT_ZZ5CHWA,yesterday,,,n/a,,,2,1,2024-01-20 13:15,stripe_export,partial refund
900976,913,norahans@email.com,60,SEK ,15.0,,,Paid,swish,stripe,NaN,,RCPT_UIMCT9K,Apr 18 2024 18:12,n/a,,,VISA,,,NaN,2024-04-18 18:12,square_export,manual correction
900977,433,user7003@email.com,20,Sek,,,,paid,card,stripe,,,,2024/02/18 16:49,n/a,NaN,SE,mastercard,,,,,stripe_export,
900978,1145,NaN,25,Sek,6.25,,,paid,card,adyen,pi_5FNTDIMTWKQM,NaN,,2024-01-15T07:06:00,,n/a,,visa,,,yes,NaN,pos,manual correction
900979,108,sofiaand@email.com,20,EUR,,NaN,,,bank_transfer,square,pi_0CZQDG4FVFG2,,,2024/04/24 20:12,,NULL,n/a,amex,NaN,1,,2024/04/24 20:12,stripe_export,NaN
900980,149,user1562@gmail.com,35,Sek,,2.52,,Paid,NULL,square,,,,,n/a,re_9YKPV5T4OU,NULL,mastercard,7339,one,,2024-01-24 09:53,square_export,partial refund
900981,478,luispere@email.com,35,EUR,,2.52,,PAID,invoice,n/a,,,,2024-02-17T09:29:00,n/a,n/a,ES,,,n/a,,2024-02-17 09:29,,
900982,585,saralind@gmail.com,35,n/a,,2.52,32.48,paid,swish,klarna,,,,,,NULL,SE,,3614,,,2024/02/25 18:52,pos,partial refund
900983,861,n/a,25,SEK,,,,PAID,Card,square,,n/a,,2024-03-24T14:50:00,NaN,re_XNMNPIHSLQ,SE,n/a,9976,2,yes,NaN,stripe_export,
900984,592,mariamal803@email.com,15,SEK ,NaN,"1,50",13.06,Refunded,SWISH,square,,INV-202402-5414,,2024/02/01 21:47,NaN,,PT,mastercard,,3,no,2024/02/01 21:47,pos,duplicate
900985,271,NaN,15,SEK ,NULL,,13.06,failed,swish,klarna,pi_0LZ8LRRWH5EJ,NULL,,2024-03-25T08:42:00,,NaN,SE,visa,,,1,,manual_sheet,NaN
900986,367,luispere582@gmail.com,60,SEK ,15.0,,,FAILED,bank transfer,klarna,,INV-202402-4942,,Feb 10 2024 09:10,,,SE,NaN,,1,n/a,,pos,manual correction
900987,1172,n/a,40,SEK,10.0,"1,50",,PAID,Card,manual,,,,18/03/2024 18:58,,NaN,SE,,,NULL,,,n/a,
900988,351,NULL,15,Sek,,"1,50",13.06,failed,bank transfer,adyen,ch_COSSOPCUK6,,,2024-05-08T21:58:00,,,GB,VISA,8521,NULL,NULL,,,manual correction
900989,937,,60,SEK ,15.0,"1,50",56.76,FAILED,Card,stripe,,,,2024/04/06 12:30,,NULL,n/a,,3257,1,,2024-04-06 12:30,square_export,
900990,97,emmajoha610@email.com,40,EUR,,"1,50",,failed,bank transfer,klarna,,INV-202402-1547,,2024/02/01 17:04,,n/a,GB,mastercard,,NaN,,2024-02-01 17:04,manual_sheet,
900991,978,liamande@gmail.com,35,EUR,,,32.48,payd,invoice,square,,INV-202404-1133,NULL,2024-04-08T16:05:00,,,,mastercard,6650,NaN,,2024/04/08 16:05,stripe_export,
900992,1090,oskarber957@company.se,35,sek,8.75,,32.48,payed,card,manual,,,,2024/03/26 20:32,,re_X061W2M6Q8,,VISA,9892,2,,,pos,partial refund
900993,793,oscarber577@email.com,40,sek,10.0,"1,50",,PAID,bank_transfer,n/a,,,,2024/03/16 14:05,NaN,n/a,SE,NaN,,,,2024-03-16 14:05,,duplicate
900994,1003,mikaelås@gmail.com,15 SEK,sek,NaN,NULL,,FAILED,,,,n/a,,2024-02-20T22:25:00,NULL,,,visa,,,NULL,,manual_sheet,
900995,1193,user549@email.com,60,sek,15.0,n/a,,failed,invoice,stripe,pi_R2PJ7VCYLROR,,,2024-02-14T22:06:00,,,NULL,,8038,2,NaN,,pos,
900996,166,user973@email.com,NULL,sek,3.75,NaN,,payed,cash,square,ch_L46USGHEEB,INV-202404-3281,n/a,Apr 09 2024 15:57,,,SE,,,,0,NaN,square_export,
900997,771,NULL,15,€,,,,payd,SWISH,square,NULL,INV-202403-7740,RCPT_N9YYOK7,16/03/2024 10:26,NaN,,NO,NULL,,,,2024/03/16 10:26,stripe_export,partial refund
900998,1059,luispere513@gmail.com,15,SEK,3.75,"1,50",,paid,,manual,pi_SDQ9AL3UCT78,,,15/04/2024 14:29,,n/a,PT,mastercard,,NULL,,,square_export,partial refund
900999,,NULL,40,SEK ,10.0,2.66,37.34,Refunded,Klarna,klarna,pi_XPFRZATK7PRN,,,Mar 25 2024 14:47,2024-03-25 14:47,,SE,,1719,one,NaN,2024/03/25 14:47,pos,manual correction
901000,2207,luispere745@outlook.com,35,EUR,,"1,50",32.48,PAID,swish,square,pi_6II23DY8ZQ0R,,RCPT_QLCKR9H,n/a,,,GB,mastercard,,one,,2024/04/06 11:59,pos,
901001,259,emmajoha610@email.com,40,EUR,NaN,,37.34,paid,n/a,NaN,pi_PLTJSDVW2HAI,,RCPT_L4PLICH,2024-04-05T18:35:00,NaN,,PT,visa,,one,,2024-04-05 18:35,stripe_export,manual correction
901002,541,pedrosil633@company.se,,€,,,,Refunded,card,adyen,,,,2024-03-25 19:17,NaN,,ES,VISA,,3,0,,stripe_export,NULL
901003,626,davidsto885@company.se,40,Sek,10.0,,,refunded,card,NULL,pi_251RXQ4X7Y92,INV-202405-7475,RCPT_6F6LZS7,05/05/2024 12:56,n/a,NaN,,mastercard,4186,1,1,,stripe_export,duplicate
901004,389,saralind687@company.se,20,EUR,,,NaN,refunded,bank_transfer,adyen,,,RCPT_XI9JFCY,10/04/2024 17:25,n/a,,,visa,,,n/a,NaN,,duplicate
901005,10,user9181@gmail.com,35,Sek,8.75,"1,50",,NaN,Klarna,manual,,,,2024-01-22T16:49:00,,NaN,GB,visa,,,,,stripe_export,
901006,598,erikholm52@gmail.com,25,SEK ,6.25,2.23,22.77,Refunded,swish,square,ch_XMOPQWWMLL,,,Apr 25 2024 17:24,,,,,,NULL,1,2024-04-25 17:24,NULL,manual correction
901007,115,noaherik618@outlook.com,60,Sek,15.0,3.24,,refunded,bank_transfer,square,,,,2024/03/07 20:19,,re_G3847AGY51,GB,n/a,,one,yes,,pos,manual correction
901008,162,maríalóp700@gmail.com,35,SEK ,,2.52,,failed,SWISH,manual,pi_D4UQ4DN3SJBH,,,2024-01-17T10:23:00,NaN,n/a,,visa,,one,0,2024-01-17 10:23,stripe_export,
901009,753,user828@gmail.com,60,EUR,,3.24,,payd,Klarna,stripe,,,,2024/03/24 20:16,,,n/a,,3880,,yes,2024/03/24 20:16,square_export,duplicate
901010,771,mariamal803@email.com,25,€,,"1,50",,PAID,invoice,klarna,,,RCPT_MVZU6FU,,,re_ZTZU1PSTWH,,mastercard,NaN,2,no,2024-02-04 07:52,stripe_export,
901011,709,mikaelås460@gmail.com,25,SEK,,"1,50",,Paid,bank_transfer,square,n/a,,RCPT_YFTMK0F,,,NaN,NO,amex,,,0,2024/05/04 18:23,pos,
901012,444,noaherik618@outlook.com,60,EUR,15.0,3.24,56.76,Refunded,NULL,square,ch_K52N2KF8XR,,,,NULL,NULL,,VISA,9218,,,2024/04/30 12:17,square_export,manual correction
901013,1169,user733@gmail.com,35,€,,,,Paid,bank transfer,manual,ch_HD4D4279YH,,,2024-05-02T08:11:00,,,GB,VISA,,1,no,2024/05/02 08:11,stripe_export,partial refund
901014,35,mikaelås@email.com,,sek,8.75,,,PAID,card,adyen,,INV-202402-1677,,,n/a,NULL,,,,3,yes,2024-02-04 11:15,,
901015,121,maríalóp@gmail.com,15,Sek,n/a,,13.06,Pending,bank transfer,stripe,,NULL,,,,re_VCBJ2TBDK2,PT,,,one,,2024-03-25 17:56,stripe_export,manual correction
901016,454,user8454@email.com,15,sek,,,13.06,payd,cash,manual,pi_NTGKJ38RW65N,,,Apr 25 2024 09:39,,NaN,,NaN,6804,,no,2024-04-25 09:39,n/a,duplicate
901017,867,NULL,35,EUR,,2.52,,failed,SWISH,klarna,pi_SXKC3HYTDOUY,INV-202401-3203,,Jan 25 2024 10:18,,n/a,NO,visa,,NULL,NULL,,manual_sheet,duplicate
901018,616,fridakar@gmail.com,,sek,15.0,,56.76,Pending,Klarna,square,pi_77YEQPJQQ7XY,INV-202404-2957,RCPT_TK1QYBQ,12/04/2024 17:27,,,GB,NULL,,3,no,2024-04-12 17:27,manual_sheet,
901019,84,user213@gmail.com,15,SEK ,,NaN,,Refunded,card,square,,,,2024-01-02T15:38:00,NULL,NULL,NO,visa,,NULL,,2024-01-02 15:38,manual_sheet,
901020,,NULL,60,€,15.0,,56.76,paid,invoice,adyen,ch_MASGDV2KFZ,,RCPT_UQNZE22,,n/a,,,NaN,,one,,2024/03/29 13:17,stripe_export,
901021,1153,jonasnil950@outlook.com,25,EUR,,"1,50",NaN,Pending,SWISH,adyen,pi_NDK8LG6ULWJH,NaN,RCPT_GVEXBW6,,,NaN,SE,,,NaN,1,2024/01/18 07:34,stripe_export,NaN
901022,1130,,35,Sek,8.75,2.52,32.48,Paid,invoice,manual,,NaN,RCPT_JZA7ERM,2024-03-07T07:42:00,,,GB,mastercard,,NaN,,,,manual correction
901023,,NaN,15,Sek,3.75,,,Paid,bank transfer,NULL,,,,29/01/2024 17:04,,n/a,PT,VISA,NULL,,n/a,2024-01-29 17:04,,n/a
901024,467,anagarci@email.com,25,SEK ,NULL,2.23,22.77,FAILED,Card,klarna,,,,Jan 05 2024 09:18,,n/a,ES,visa,,,yes,2024/01/05 09:18,,duplicate
901025,403,,15,sek,3.75,,,FAILED,Klarna,stripe,NaN,,RCPT_C5T078J,2024-01-14T18:20:00,,,GB,visa,NaN,,,2024-01-14 18:20,square_export,
901026,1046,sofiaand747@gmail.com,35,Sek,8.75,2.52,NULL,paid,bank transfer,manual,pi_CL0CT322GEKH,,NULL,2024/04/28 14:33,,NULL,,,,,yes,,square_export,duplicate
901027,552,karinlun422@outlook.com,20,SEK,5.0,,,payed,swish,square,pi_M89PV89JZW0H,,,May 02 2024 10:32,,,NO,visa,1359,2,NaN,2024/05/02 10:32,stripe_export,
901028,70,n/a,15,Sek,3.75,1.94,,refunded,bank_transfer,adyen,ch_HPEBK3X9S2,INV-202401-1158,,2024/01/26 13:00,,,PT,,,1,,2024-01-26 13:00,,manual correction
901029,783,user4936@email.com,35,EUR,,2.52,,Pending,card,klarna,pi_JHOZSYBJF5Y2,,,Feb 19 2024 13:01,NULL,NaN,PT,,3352,,,2024/02/19 13:01,pos,manual correction
901030,1164,fatimakh971@email.com,60,sek,15.0,"1,50",56.76,Refunded,Klarna,adyen,,,NULL,03/04/2024 22:39,,NaN,NO,,,n/a,,,stripe_export,
901031,1168,mariamal@email.com,25,Sek,,NaN,,payed,card,adyen,ch_ZGOFQG2Y4U,INV-202402-8569,,2024-02-12 16:30,,,GB,mastercard,,3,yes,,,duplicate
901032,778,fatimakh509@gmail.com,35,,8.75,,,Refunded,Klarna,adyen,pi_ZOZ3TU0OP2MI,,,,2024-01-15 16:57,re_R1YUX1IVW2,NO,,,NULL,no,NULL,manual_sheet,
901033,693,mikaelås@email.com,15,sek,3.75,1.94,,FAILED,Card,klarna,,,,May 02 2024 21:49,n/a,,,VISA,,one,,,,manual correction
901034,919,user9088@email.com,n/a,€,,,,Refunded,card,manual,pi_RPBS66X0M9FR,INV-202401-5559,,2024/01/10 20:38,n/a,NaN,,VISA,,,0,2024-01-10 20:38,pos,n/a
901035,1158,,20,Sek,5.0,,17.92,PAID,card,adyen,,,,2024/04/23 10:32,,,PT,VISA,,1,,,square_export,partial refund
901036,526,n/a,35,€,8.75,,,PAID,cash,klarna,ch_8VPADX2FO9,,RCPT_B6JL7SZ,24/03/2024 08:40,,re_UEF555X1TY,NaN,n/a,,,NULL,2024-03-24 08:40,stripe_export,
901037,343,mikaelås734@outlook.com,35,€,8.75,"1,50",32.48,Paid,SWISH,square,pi_UL4T35DO9IP1,,,NaN,NULL,NaN,,NULL,n/a,2,,,stripe_export,
901038,885,anagarci@email.com,25,EUR,6.25,,,pending,bank transfer,manual,ch_3Z27LBZA6R,,,,n/a,,NaN,,n/a,,,,,manual correction
901039,802,user187@email.com,35,Sek,,2.52,,Refunded,,klarna,ch_HBBDSN9KD3,n/a,,2024-05-07T13:52:00,,NaN,SE,VISA,3533,3,no,,,
901040,231,user3951@gmail.com,60,sek,15.0,"1,50",,failed,bank_transfer,manual,,,NULL,,NULL,n/a,NO,visa,,,NaN,,square_export,
901041,1191,mikaelås@gmail.com,20,Sek,5.0,n/a,17.92,Pending,swish,stripe,,,,2024-04-20 14:16,,NaN,ES,visa,,2,,,pos,
901042,955,user3079@email.com,40,Sek,,,37.34,payd,cash,stripe,,,RCPT_29IBZJW,27/04/2024 15:25,,,GB,mastercard,9652,,NaN,,stripe_export,duplicate
901043,958,user4783@email.com,60,SEK,15.0,,,payd,bank transfer,NaN,NaN,,,NaN,NULL,n/a,GB,NaN,,NULL,,2024-02-02 11:06,manual_sheet,
901044,42,emmajoha610@email.com,,EUR,3.75,"1,50",,NULL,swish,stripe,,,,Feb 18 2024 15:03,NULL,,GB,amex,,,,2024/02/18 15:03,square_export,
901045,758,elinsven604@outlook.com,60,€,15.0,,,FAILED,bank transfer,square,pi_7CU80ZWRJDTQ,INV-202404-3824,,Apr 10 2024 07:18,n/a,NULL,,amex,,,,,,partial refund
901046,580,ellaberg691@outlook.com,25,SEK,6.25,2.23,22.77,FAILED,swish,klarna,NaN,INV-202405-8872,RCPT_FLMDDQ4,2024/05/02 08:01,,NaN,SE,,7013,,0,,manual_sheet,
901047,315,ahmedali@email.com,60,EUR,,,,payed,Klarna,,NaN,,,2024/04/12 14:03,NaN,,PT,VISA,,,no,2024/04/12 14:03,,duplicate
901048,150,,15,EUR,,1.94,,Pending,Card,square,ch_8GZ0LYY5X3,,n/a,,n/a,,NO,mastercard,NaN,,,,square_export,manual correction
901049,190,NULL,25,SEK,,,22.77,Refunded,Card,adyen,pi_9MJJEJ1WA0Z9,,,Jan 25 2024 15:32,NULL,n/a,SE,NaN,,,0,,square_export,partial refund
901050,549,n/a,35,sek,,,n/a,Paid,bank_transfer,square,pi_B7ZTSPJH6VQG,INV-202405-7883,NaN,2024/05/07 13:28,,,,mastercard,,3,NULL,2024/05/07 13:28,pos,partial refund
901051,160,user971@gmail.com,25,SEK ,,NaN,,Paid,Card,stripe,,,n/a,Apr 07 2024 13:54,NaN,,PT,amex,,,no,,NaN,duplicate
901052,226,user435@email.com,25,Sek,6.25,,,payd,SWISH,stripe,,,,2024-02-22 11:18,,,NO,,7195,3,n/a,2024-02-22 11:18,,duplicate
901053,556,oskarber759@company.se,15,SEK ,,,,PAID,,NULL,,INV-202402-1312,n/a,2024-02-30 12:00,n/a,re_ZWMHZJIOQC,SE,VISA,,,1,,,duplicate
901054,697,user35@gmail.com,25,€,,,,payed,swish,stripe,,,,28/02/2024 11:48,NULL,,,,NULL,NULL,NULL,,manual_sheet,manual correction
901055,775,oskarber957@company.se,,Sek,10.0,,,,bank_transfer,adyen,NULL,,,Mar 26 2024 16:54,,re_EUHK63AR3K,,,n/a,1,0,2024/03/26 16:54,,
901056,796,,15,SEK,,"1,50",,Paid,Klarna,square,,,,2024-02-21T11:55:00,NaN,n/a,,NULL,1187,one,no,2024-02-21 11:55,square_export,
901057,96,user8767@gmail.com,60,SEK ,,NaN,,FAILED,invoice,klarna,NaN,INV-202404-5960,RCPT_56UPPUV,13/04/2024 16:19,NULL,,,,,,,2024/04/13 16:19,manual_sheet,
901058,212,,NaN,EUR,,3.24,,FAILED,invoice,manual,NaN,,,2024/01/13 19:31,NaN,,,NULL,,3,,2024-01-13 19:31,square_export,
901059,78,oliviali965@email.com,60.00,,,3.24,56.76,payd,bank_transfer,square,,,,,,,n/a,NULL,,,,2024-02-27 09:23,,duplicate
901060,882,saralind@gmail.com,35,Sek,8.75,,32.48,failed,cash,stripe,,INV-202401-8764,RCPT_ZQB9QDC,2024-01-16T13:03:00,NaN,NaN,SE,,3854,,,,n/a,
901061,915,user4502@email.com,60,EUR,,,,NULL,cash,adyen,NULL,,,Apr 13 2024 09:21,,,GB,,,,1,2024-04-13 09:21,manual_sheet,duplicate
901062,638,mikaelås@gmail.com,35,€,8.75,"1,50",,Refunded,Card,klarna,,,,2024-04-27T17:59:00,,NaN,,,3999,1,NaN,,manual_sheet,manual correction
901063,103,n/a,40,SEK ,10.0,,37.34,FAILED,bank_transfer,klarna,NaN,INV-202402-1255,RCPT_R7GC2EF,2024/02/01 09:54,NaN,NaN,,NULL,,1,n/a,,manual_sheet,
901064,281,noaherik@email.com,20,€,,2.08,,PAID,Card,manual,NULL,n/a,,2024-03-11 09:56,,,PT,mastercard,,,n/a,,stripe_export,NULL
901065,96,liamande@gmail.com,40,EUR,10.0,"1,50",37.34,Pending,,klarna,,,NULL,,n/a,,,,5262,n/a,,,pos,NULL
901066,872,user8461@email.com,60,EUR,NULL,,,Paid,swish,adyen,,,,2024-03-03T07:41:00,n/a,,NO,mastercard,,NULL,NaN,2024/03/03 07:41,pos,
901067,1199,user1900@email.com,35,€,8.75,2.52,,payed,SWISH,adyen,,,RCPT_JE29RQB,Jan 23 2024 21:26,NaN,NULL,,VISA,,,0,2024/01/23 21:26,,partial refund
901068,89,user5583@gmail.com,60,Sek,,3.24,56.76,failed,card,klarna,,INV-202404-2470,RCPT_QM69XJP,2024-04-12 15:25,,n/a,,mastercard,,NULL,NaN,2024/04/12 15:25,square_export,
901069,1117,oscarber@gmail.com,25,EUR,6.25,n/a,22.77,payd,swish,adyen,,,RCPT_A7X7AAR,,NULL,,ES,amex,4035,,,,square_export,duplicate
901070,242,maríalóp527@gmail.com,15,sek,,,13.06,FAILED,invoice,klarna,ch_3BYN2RBB6C,,RCPT_3X0LFPL,2024-02-30 12:00,,NULL,NO,mastercard,,,,2024/03/31 15:54,,manual correction
901071,837,ellaberg146@outlook.com,60,EUR,15.0,,56.76,Pending,invoice,square,,INV-202403-6129,,2024-03-28T13:05:00,,n/a,SE,VISA,7314,,0,2024-03-28 13:05,manual_sheet,partial refund
901072,371,ahmedali@gmail.com,40,SEK ,,n/a,,Paid,SWISH,manual,,NULL,n/a,2024/02/23 09:09,,n/a,NO,,,,,2024/02/23 09:09,manual_sheet,
901073,905,davidsto@email.com,15.00,NaN,,1.94,13.06,paid,bank_transfer,adyen,,,,2024-03-31T07:31:00,NaN,NULL,NaN,mastercard,,NaN,,,,
901074,48,noaherik618@outlook.com,15,,,,,payd,invoice,stripe,,INV-202403-8411,,,NULL,re_LX7TNVIF0X,SE,amex,8214,1,no,2024/03/29 07:44,stripe_export,partial refund
901075,838,anagarci16@gmail.com,25,EUR,6.25,,,failed,invoice,stripe,ch_CQABGWS3PL,,,2024/03/12 19:01,,,GB,,,3,no,2024-03-12 19:01,n/a,partial refund
901076,672,oskarber67@company.se,NaN,EUR,,"1,50",,Pending,bank transfer,klarna,,,,2024-05-05 17:32,NaN,NULL,GB,amex,,,no,2024-05-05 17:32,,
901077,1179,,35,SEK ,,,,Paid,bank_transfer,square,,INV-202403-7919,NaN,2024-03-06 17:02,n/a,NaN,,mastercard,,1,NaN,,manual_sheet,n/a
901078,25,saralind438@company.se,15,SEK ,,n/a,,payed,card,manual,,,RCPT_DIXCCQ0,2024-04-10 19:45,,,,mastercard,,,NULL,2024/04/10 19:45,manual_sheet,
901079,287,fridakar22@company.se,25,SEK,,,,NaN,invoice,,,,,2024/04/25 10:37,,,ES,visa,n/a,n/a,no,,,
901080,687,fatimakh311@gmail.com,40,Sek,,n/a,37.34,paid,bank transfer,klarna,,,,2024-04-15 07:35,,,NO,visa,,,,2024/04/15 07:35,manual_sheet,partial refund
901081,923,,20.00,SEK,5.0,n/a,17.92,payed,card,stripe,pi_3AA1V4W0SBNB,,RCPT_AKENWUP,2024-02-03T16:23:00,NULL,,GB,mastercard,9304,,NaN,2024/02/03 16:23,,duplicate
901082,339,NULL,15,€,,"1,50",,payd,card,klarna,ch_0F768H4LIO,n/a,,Mar 18 2024 07:00,n/a,n/a,PT,,,3,,NULL,,duplicate
901083,101,saralind641@company.se,25,€,,,,NULL,Card,klarna,,INV-202403-6301,,14/03/2024 21:57,,n/a,SE,NULL,4655,NaN,,2024/03/14 21:57,,
901084,876,user7527@gmail.com,15,SEK ,,,,refunded,SWISH,adyen,ch_Z88KCNSOFJ,,,Apr 19 2024 07:41,,,NO,,,1,1,2024/04/19 07:41,manual_sheet,partial refund
901085,862,user4018@email.com,NaN,SEK ,,,,pending,swish,,,INV-202402-5021,,Feb 23 2024 09:06,,,,NaN,,,,,,partial refund
901086,716,user446@email.com,35 SEK,SEK ,,2.52,,pending,SWISH,stripe,,,,,,,NULL,amex,,,no,2024-02-03 10:22,stripe_export,partial refund
901087,816,erikholm@gmail.com,35,€,8.75,,32.48,Paid,bank transfer,stripe,ch_KVG48CE8D2,,,2024/03/21 10:37,NULL,NULL,SE,,,,0,2024-03-21 10:37,pos,manual correction
901088,1195,fridakar@gmail.com,,sek,3.75,,13.06,pending,card,klarna,pi_YRIIA3AR0MZI,,NaN,2024-04-24 19:44,NULL,,,mastercard,,n/a,1,2024/04/24 19:44,,
901089,744,linchen129@outlook.com,,SEK,,,13.06,FAILED,,square,pi_REVQDI3ZAK3C,,RCPT_A90GAM5,2024-04-09 13:28,,n/a,,VISA,,one,,2024-04-09 13:28,manual_sheet,
901090,74,user6748@email.com,35,EUR,,,,refunded,cash,square,pi_HE72X0W8DCE3,INV-202404-6341,RCPT_700UUGS,2024-04-01T14:04:00,NULL,,NO,visa,,n/a,,2024-04-01 14:04,square_export,n/a
901091,1085,liamande293@outlook.com,20,sek,5.0,,n/a,refunded,Card,klarna,ch_43U0AY7NLK,NULL,,Jan 24 2024 17:50,NULL,NaN,SE,,,,0,,manual_sheet,duplicate
901092,545,maríalóp@email.com,25,,6.25,NULL,22.77,,card,klarna,,,RCPT_8TCK90B,2024-01-28T14:24:00,,,NO,amex,,one,no,2024/01/28 14:24,,manual correction
901093,439,user6900@email.com,35,SEK,,NaN,32.48,Pending,card,adyen,,,,,,re_YJT6JHYGP1,,NULL,,,no,,stripe_export,manual correction
901094,613,davidsto949@outlook.com,25,sek,NULL,"1,50",22.77,payd,swish,stripe,ch_F8ARCFZ7KQ,,RCPT_DXB60G4,2024-04-14T08:20:00,,,,,,,no,,,NaN
901095,929,jonasnil31@outlook.com,35,SEK,8.75,,32.48,paid,cash,klarna,ch_TTSIDR04TX,,,,,n/a,,visa,,,,,pos,partial refund
901096,444,user8790@gmail.com,40,€,,,,paid,invoice,square,ch_WQQ8K9F3P1,,RCPT_K3K8OIC,2024-01-25 16:18,,,ES,VISA,,n/a,NaN,2024/01/25 16:18,square_export,partial refund
901097,198,oskarber@email.com,35,sek,8.75,,,paid,,manual,,INV-202404-5222,RCPT_O1GPBVY,11/04/2024 13:12,,,NO,amex,9889,,0,,,duplicate
901098,754,ahmedali594@email.com,25,€,,2.23,,pending,swish,n/a,,,,2024/04/19 16:08,NaN,NULL,NO,visa,NaN,1,yes,2024/04/19 16:08,square_export,NULL
901099,16,davidsto391@company.se,20,EUR,,"1,50",,FAILED,Klarna,square,ch_65Y2TCJNOL,,,2024/05/09 09:38,,NaN,NULL,NaN,,,1,2024/05/09 09:38,square_export,NaN
901100,195,user8563@email.com,25,EUR,,,,paid,,square,,INV-202403-5084,,2024-03-13T10:49:00,NaN,n/a,,VISA,NULL,1,NULL,2024/03/13 10:49,manual_sheet,manual correction
901101,1071,oskarber957@company.se,20,SEK,,,17.92,Pending,card,square,pi_XDR5VBZLQTTG,INV-202401-4973,,,,,SE,mastercard,,3,yes,2024-01-06 17:19,,duplicate
901102,1026,mariamal803@email.com,15,€,,,,pending,card,adyen,n/a,NaN,,2024/02/27 08:00,,,GB,,,,yes,2024/02/27 08:00,pos,
901103,1003,liamande@email.com,60,SEK ,15.0,,,PAID,Card,klarna,,n/a,RCPT_0A4299J,2024-03-13T21:12:00,,,n/a,mastercard,5946,one,no,2024-03-13 21:12,manual_sheet,manual correction
901104,118,user1570@gmail.com,40,€,,"1,50",,Pending,invoice,manual,,,RCPT_OQ9SOKI,,,,,NULL,3474,1,,2024-03-06 07:04,,NaN
901105,303,emmajoha610@email.com,60,Sek,NaN,3.24,,Paid,cash,manual,pi_WCJJ27YQTHPA,n/a,,2024/05/06 10:25,,NaN,,,NaN,2,1,2024/05/06 10:25,square_export,
901106,328,user951@email.com,20,€,,NULL,,Paid,cash,stripe,pi_C7K0MIBCLC8L,,RCPT_VZZKK2I,2024-05-06T17:54:00,,,GB,VISA,NULL,,1,2024/05/06 17:54,,manual correction
901107,932,ellaberg@email.com,15,Sek,3.75,"1,50",,Refunded,bank transfer,square,,,,20/04/2024 22:19,NaN,,PT,NULL,,n/a,,2024/04/20 22:19,,duplicate
901108,515,davidsto391@company.se,25,Sek,NULL,,,n/a,Klarna,manual,NULL,,,Feb 25 2024 09:17,,,NO,,5812,,0,2024/02/25 09:17,,duplicate
901109,889,anagarci248@company.se,35,SEK ,8.75,"1,50",n/a,paid,swish,square,,,,09/02/2024 16:36,,NaN,,n/a,6981,NULL,no,2024/02/09 16:36,manual_sheet,
901110,383,user8236@gmail.com,,SEK,,,,pending,bank transfer,klarna,,,RCPT_QE21U8B,NULL,,NULL,NO,NULL,,,no,2024/03/26 16:07,square_export,
901111,675,user6483@gmail.com,25,Sek,,"1,50",22.77,Pending,Card,square,,,,21/04/2024 17:34,NaN,,GB,VISA,,,,,square_export,manual correction
901112,650,oliviali@email.com,NaN,EUR,8.75,,,pending,SWISH,manual,,INV-202401-7655,RCPT_BANQYE9,Jan 25 2024 14:27,,,SE,amex,,,no,,square_export,manual correction
901113,303,oliviali965@email.com,25,EUR,,NaN,22.77,failed,invoice,klarna,,,,,,,,,,3,no,,square_export,
901114,480,liamande101@company.se,35,€,,2.52,,PAID,swish,,n/a,,RCPT_83EXDQ0,2024-04-30T16:13:00,,NaN,SE,visa,,3,,,,duplicate
901115,57,maríalóp@email.com,15 SEK,SEK,,"1,50",n/a,failed,swish,klarna,,,n/a,,n/a,n/a,GB,VISA,,one,1,2024-04-08 15:59,square_export,
901116,350,user2116@gmail.com,40,sek,,,,paid,invoice,klarna,,,NULL,08/02/2024 19:26,NULL,,SE,NaN,,,NULL,2024-02-08 19:26,square_export,duplicate
901117,913,user6226@gmail.com,20,Sek,,NaN,17.92,PAID,invoice,square,pi_VU6RWE2CS166,INV-202404-4307,,2024/04/16 20:18,,re_J1DJHOFXZX,,n/a,9699,n/a,yes,,NaN,partial refund
901118,241,,35,Sek,,2.52,,failed,swish,stripe,,,,,,NULL,PT,amex,,NaN,NaN,2024-02-14 09:53,manual_sheet,duplicate
901119,338,sofiaand@email.com,40,EUR,,2.66,,payd,cash,square,ch_LYF6P82SEU,,n/a,2024/01/29 20:51,NaN,,,VISA,,3,yes,2024-01-29 20:51,pos,partial refund
901120,877,,35,Sek,,"1,50",32.48,payed,cash,square,ch_5AG8ROSU4T,,RCPT_7L9WOJ0,2024-03-14T14:47:00,,NaN,SE,visa,2500,3,,,stripe_export,partial refund
901121,841,user8732@gmail.com,25,EUR,6.25,2.23,,paid,bank transfer,klarna,ch_SDZM1FNR56,,,2024-04-13T16:20:00,n/a,,PT,,,3,0,2024-04-13 16:20,,duplicate
901122,896,user9531@gmail.com,20,EUR,5.0,"1,50",,failed,invoice,manual,pi_3RF5YG54WGR1,,,14/03/2024 12:50,n/a,re_W9DIY5NZWK,ES,,,,n/a,,,
901123,949,pedrosil@email.com,35,€,8.75,,,pending,Card,square,,INV-202404-3327,RCPT_QBBKYC2,2024-04-20T21:14:00,,NULL,,,,,0,,pos,manual correction
901124,1106,elinsven@gmail.com,40,SEK ,10.0,"1,50",,paid,bank transfer,manual,,,NaN,19/03/2024 12:00,NULL,re_26SD3SW9K3,NULL,VISA,5224,2,1,2024-03-19 12:00,manual_sheet,
901125,980,emmajoha463@gmail.com,40,,10.0,2.66,,Refunded,Card,stripe,pi_VYEYG1VHV7Y4,NULL,,2024-04-18T12:51:00,,NULL,PT,visa,,NULL,n/a,2024/04/18 12:51,stripe_export,
901126,312,ellaberg261@gmail.com,60,EUR,n/a,3.24,,payed,NULL,adyen,,,RCPT_E40SH0O,15/03/2024 11:37,,,NULL,amex,n/a,one,yes,,pos,
901127,806,user4617@gmail.com,20,SEK ,,,NaN,Paid,Card,manual,ch_K0D332DRSE,,,2024-04-14 10:24,,NaN,,amex,9786,,,NULL,pos,partial refund
901128,1006,maríalóp@email.com,20,sek,5.0,2.08,17.92,pending,bank_transfer,square,,,RCPT_TSXGDK7,2024/03/28 12:08,NaN,,PT,VISA,,one,no,2024-03-28 12:08,stripe_export,
901129,693,maríalóp@email.com,40,,10.0,"1,50",,pending,bank_transfer,klarna,,,,2024-04-06 08:10,NULL,,,amex,4048,,no,2024-04-06 08:10,,duplicate
901130,787,luispere@gmail.com,40,SEK ,10.0,,,Refunded,invoice,stripe,ch_ZO4V9ZXC3D,,,01/03/2024 19:10,,NULL,NO,n/a,,NULL,NULL,2024/03/01 19:10,stripe_export,partial refund
901131,692,user7614@email.com,n/a,EUR,10.0,,37.34,Refunded,swish,adyen,,,,2024-05-01T08:45:00,NULL,NULL,ES,amex,n/a,,NULL,,manual_sheet,duplicate
901132,272,jonasnil950@outlook.com,35,sek,8.75,,32.48,Paid,invoice,manual,ch_XBZ5FUWKUD,,,Apr 07 2024 08:08,NULL,NULL,SE,VISA,,n/a,0,2024/04/07 08:08,square_export,NaN
901133,312,sofiaand383@gmail.com,20,EUR,5.0,,,Pending,bank transfer,klarna,,NaN,,,NaN,NULL,NO,,4350,one,no,2024/01/09 21:02,,partial refund
901134,144,davidsto966@company.se,60,€,15.0,,,refunded,bank_transfer,square,,,,,,NaN,,visa,,3,,2024/04/04 17:47,square_export,partial refund
901134,99999,anagarci91@email.com,,Sek,NaN,"1,50",22.77,Refunded,invoice,stripe,,n/a,,2024/01/17 20:17,NULL,,SE,,,,NaN,2024-01-17 20:17,stripe_export,manual correction
901136,581,jonasnil345@email.com,,Sek,,"1,50",,paid,SWISH,square,pi_ZPTWND0GZUYB,NULL,,,,,,amex,,NaN,n/a,,pos,duplicate
901137,1063,user6626@email.com,20,EUR,,2.08,,refunded,bank transfer,manual,,n/a,,Apr 15 2024 10:52,2024-04-15 10:52,NaN,SE,,,one,yes,2024/04/15 10:52,pos,
901138,1138,oskarber667@gmail.com,15,sek,3.75,,NULL,Paid,n/a,NaN,,NaN,RCPT_VFYRS8C,2024-03-09T13:33:00,n/a,,SE,mastercard,,1,NULL,,,
901139,1045,emmajoha@email.com,15,€,,NULL,13.06,payd,cash,square,,n/a,RCPT_3VPVPQZ,Apr 23 2024 16:30,n/a,,,amex,NaN,,,2024/04/23 16:30,square_export,manual correction
901140,289,erikholm@gmail.com,40,€,10.0,,,,invoice,manual,pi_9GCYEFPQWWFW,,,NaN,,,PT,,,3,1,,manual_sheet,
901141,166,NaN,15,Sek,3.75,,13.06,FAILED,invoice,stripe,pi_G4MCVRA71MN4,,,25/01/2024 15:52,,,ES,,,1,,2024/01/25 15:52,pos,
901142,750,NaN,25,SEK,6.25,"1,50",,pending,invoice,square,ch_11FFDRTR1H,INV-202404-6439,n/a,Apr 02 2024 19:43,,NULL,,amex,,,0,2024-04-02 19:43,square_export,
901143,1187,elinsven@gmail.com,n/a,€,,,,Paid,SWISH,square,,INV-202402-6222,,,NaN,,,amex,,,,,,
901144,828,pedrosil201@outlook.com,NaN,sek,,NULL,17.92,payd,cash,adyen,,INV-202401-2553,,24/01/2024 09:55,n/a,n/a,NO,,,,,2024/01/24 09:55,stripe_export,
901145,961,norahans@gmail.com,25,SEK ,,2.23,22.77,refunded,Card,klarna,pi_EQ1RAGZATWYN,,,Mar 03 2024 16:57,,n/a,n/a,visa,,,,NULL,manual_sheet,
901146,762,maríalóp505@company.se,40,SEK ,NaN,,,pending,bank_transfer,adyen,,,,,,,PT,,2407,,,2024/03/14 11:40,NaN,partial refund
901147,475,erikholm@gmail.com,60,€,15.0,n/a,,Paid,Klarna,adyen,NaN,,,28/04/2024 18:44,n/a,,PT,mastercard,NULL,,,,square_export,partial refund
901148,121,davidsto100@outlook.com,40,€,,NaN,37.34,Paid,card,stripe,pi_BVAGMEFXU815,,,Jan 26 2024 10:32,,re_IDXJEFILCD,NaN,n/a,5420,,NaN,,,manual correction
901149,482,sofiaand369@gmail.com,35,€,8.75,2.52,32.48,failed,bank transfer,manual,,,NULL,2024-02-14 10:37,,re_TM07HO5FCS,SE,,,2,1,2024/02/14 10:37,manual_sheet,
901150,367,,20,Sek,,NaN,17.92,refunded,swish,manual,,INV-202403-6771,,2024/03/28 10:12,NULL,re_PXZNFP35R3,,,,n/a,1,2024/03/28 10:12,square_export,partial refund
901151,589,ahmedali@email.com,20,Sek,5.0,"1,50",,payd,swish,adyen,pi_9XECD2PMKESN,NULL,,,,,,VISA,8258,one,,NaN,manual_sheet,NaN
901152,903,anagarci@gmail.com,,EUR,5.0,,,Pending,swish,klarna,ch_JRG318F6E8,,,06/04/2024 16:36,n/a,,PT,mastercard,1281,NULL,no,,square_export,
901153,579,user1517@email.com,20,€,,,17.92,paid,Card,,ch_CHE3P2O9LA,,,07/03/2024 13:28,,,ES,,,n/a,0,2024/03/07 13:28,square_export,
901154,195,user9780@email.com,20,Sek,5.0,"1,50",17.92,Paid,bank transfer,adyen,,INV-202401-9033,,,,NULL,NULL,,9400,2,1,2024/01/29 11:51,,
901155,1101,user5263@email.com,60,sek,,"1,50",,PAID,swish,klarna,,INV-202405-4363,,,n/a,,,visa,,,0,,,NULL
901156,1130,user3246@gmail.com,15,SEK,,,,Refunded,Klarna,square,NaN,,RCPT_TA5Z9WF,,,,SE,visa,,one,1,2024/04/07 11:31,manual_sheet,manual correction
901157,634,mariamal136@company.se,15,EUR,,"1,50",,Paid,SWISH,adyen,,,,2024/03/15 21:09,,n/a,SE,mastercard,,,n/a,2024-03-15 21:09,pos,manual correction
901158,2180,user8456@gmail.com,25,EUR,6.25,,,FAILED,invoice,stripe,pi_BC46Z0TUK3UI,,,2024-01-27T21:39:00,,,NO,visa,,3,NaN,2024/01/27 21:39,manual_sheet,partial refund
901159,800,user6961@email.com,20,sek,NaN,NULL,,Refunded,bank transfer,square,ch_PDW5KIYPIJ,INV-202401-8239,,2024-01-01T14:59:00,,n/a,PT,,,one,,2024-01-01 14:59,pos,duplicate
901160,905,,25,NaN,,2.23,,pending,Klarna,square,,INV-202401-5550,RCPT_X3PP2OC,Jan 10 2024 22:02,,,GB,mastercard,1577,one,,2024-01-10 22:02,,partial refund
901161,13,user3341@email.com,40,Sek,10.0,2.66,,Paid,swish,manual,pi_R9OAMFJ0RGFN,INV-202404-6177,RCPT_XPGWAF5,23/04/2024 12:50,n/a,,NO,VISA,,2,,2024-04-23 12:50,,partial refund
901162,137,n/a,60,SEK ,,"1,50",56.76,Pending,Klarna,square,,,,NaN,,n/a,NO,NULL,9140,1,no,,,partial refund
901163,250,user297@email.com,15,Sek,n/a,"1,50",,Refunded,NULL,square,pi_WMT73PO4K6SX,INV-202403-1903,,2024-03-17 10:51,NaN,n/a,ES,,,,NaN,2024-03-17 10:51,,manual correction
901164,223,norahans@email.com,35,SEK,,2.52,32.48,refunded,swish,stripe,ch_N24UQZAR33,,,NULL,,,NaN,NaN,,,yes,2024/04/03 10:57,manual_sheet,
901165,1185,sofiaand383@gmail.com,35,sek,,,NaN,PAID,,manual,,,RCPT_M3TIXLS,2024-02-13 22:54,,,,,,one,,2024/02/13 22:54,,duplicate
901166,604,sofiaand@gmail.com,15,sek,3.75,,,Paid,Card,square,,,,2024-02-01T16:31:00,n/a,NaN,,visa,,NULL,NaN,2024-02-01 16:31,,duplicate
901167,681,user8163@gmail.com,20,€,,"1,50",,Refunded,cash,manual,,INV-202402-5171,,04/02/2024 13:44,NaN,,n/a,NaN,,1,yes,2024/02/04 13:44,square_export,
901168,1076,fatimakh322@outlook.com,20,€,5.0,"1,50",,PAID,invoice,square,pi_TMHGD6JOZ4NM,NULL,,,,,n/a,amex,NULL,NaN,1,n/a,square_export,
901169,500,jonasnil669@company.se,40,Sek,10.0,,37.34,payed,swish,adyen,,INV-202401-9410,,,,,GB,VISA,3755,one,yes,,square_export,n/a
901170,918,oliviali782@email.com,60,EUR,15.0,3.24,56.76,Pending,Klarna,adyen,pi_MGMEKHBCZWFA,,,Jan 23 2024 16:54,n/a,NaN,,n/a,NaN,NaN,n/a,2024-01-23 16:54,,manual correction
901171,90,,25,€,6.25,"1,50",NULL,payd,Klarna,stripe,,INV-202403-2225,RCPT_NWZBOZH,2024-03-18 16:43,,n/a,NULL,visa,6159,NaN,NULL,,manual_sheet,partial refund
901172,65,user9126@email.com,35,Sek,n/a,NaN,,Pending,cash,stripe,,,,2024-01-28T16:13:00,,n/a,NO,NaN,,NaN,,2024-01-28 16:13,square_export,duplicate
901173,262,user6863@email.com,35,SEK ,8.75,NaN,,refunded,swish,square,,,,Jan 21 2024 20:31,,,GB,,,n/a,NaN,,stripe_export,n/a
901174,374,maríalóp700@gmail.com,20,EUR,,,17.92,pending,invoice,adyen,ch_1UJBEOSAPL,INV-202403-5652,RCPT_JM2ZQZQ,2024-03-18 20:49,n/a,n/a,,,,,1,,NaN,
901175,976,mariamal@email.com,25,sek,,,,FAILED,Klarna,klarna,pi_K86YK6B00RUG,INV-202403-2301,RCPT_7K90C9N,2024-03-03T09:44:00,NULL,NaN,PT,mastercard,3861,one,,2024/03/03 09:44,pos,manual correction
901176,749,luispere745@outlook.com,20,sek,5.0,"1,50",NULL,failed,cash,klarna,,INV-202405-5660,RCPT_VAZ0J8F,08/05/2024 16:50,,n/a,PT,,NULL,,no,,,duplicate
901177,,jonasnil950@outlook.com,15,SEK ,NULL,n/a,,payed,SWISH,square,NaN,,,2024/01/28 17:11,,,,mastercard,,one,n/a,2024-01-28 17:11,stripe_export,
901178,628,user1017@gmail.com,20,SEK ,5.0,"1,50",,Paid,card,adyen,,,,2024/03/21 18:04,NULL,re_IRIML0IUA3,,,,one,NaN,2024/03/21 18:04,stripe_export,duplicate
901179,343,emmajoha970@company.se,,SEK ,NaN,,,Pending,invoice,square,ch_3L4LKTAQNG,,RCPT_682BFTV,10/02/2024 12:51,NULL,,NULL,VISA,9267,NULL,,,n/a,
901180,,luispere513@gmail.com,25,SEK,,,,Paid,bank transfer,stripe,,,RCPT_377FDG6,2024/03/24 08:22,NaN,n/a,GB,amex,9431,,NaN,,manual_sheet,partial refund
901181,1044,maríalóp@email.com,60 SEK,€,,"1,50",n/a,Refunded,Klarna,manual,pi_EEUCFWL8446B,INV-202404-5682,RCPT_Y0SHEB9,2024-04-25 19:01,NULL,NaN,,,,n/a,0,2024/04/25 19:01,stripe_export,
901182,301,saralind438@company.se,15,Sek,3.75,,13.06,Pending,SWISH,stripe,,,RCPT_ZS0A58F,NaN,n/a,,SE,,,3,0,2024/01/19 18:34,manual_sheet,manual correction
901183,87,noaherik581@email.com,40,Sek,NaN,2.66,,payd,card,klarna,,,RCPT_M358T9K,Mar 13 2024 14:24,NULL,n/a,ES,amex,3821,,,,,duplicate
901184,1119,jonasnil31@outlook.com,35,SEK,,,32.48,refunded,invoice,manual,,,,2024-03-07T07:12:00,NULL,re_GKQQ1VF80A,NO,amex,,NULL,n/a,NULL,,manual correction
901185,430,user2077@email.com,40.00,SEK ,,,,paid,SWISH,square,ch_PG1RN4CQ5F,,,2024-01-29 10:24,NULL,NULL,NO,,n/a,NaN,yes,2024-01-29 10:24,stripe_export,NaN
901186,299,sofiaand369@gmail.com,35,sek,,,,payd,bank transfer,stripe,pi_UNAWK4MV9BN6,,RCPT_BK9L9AW,Apr 17 2024 18:08,NaN,NaN,GB,,9879,2,,2024/04/17 18:08,manual_sheet,manual correction
901187,824,user7055@email.com,35,Sek,,,,Pending,swish,klarna,,,RCPT_9GE38UA,09/03/2024 08:40,n/a,,ES,VISA,,,no,2024-03-09 08:40,n/a,duplicate
901188,530,NaN,35,Sek,,"1,50",,PAID,SWISH,square,,NaN,,10/04/2024 21:18,,NULL,SE,VISA,,3,,2024-04-10 21:18,,duplicate
901189,609,maríalóp229@email.com,20,SEK ,,"1,50",NULL,Pending,Card,stripe,,n/a,,2024-02-30 12:00,,NaN,ES,visa,,,0,n/a,stripe_export,partial refund
901190,278,mariamal@email.com,15 SEK,Sek,3.75,,,FAILED,cash,square,,,RCPT_XAYA0OI,Jan 20 2024 07:42,NULL,re_NL1MY6B86I,NO,mastercard,,one,no,2024/01/20 07:42,,n/a
901191,463,oliviali800@outlook.com,NaN,sek,,3.24,NULL,payed,bank_transfer,stripe,ch_D0ZUDYKQCZ,,RCPT_XTW12SK,2024/02/15 08:00,,,,NaN,,3,n/a,,square_export,
901192,663,oskarber957@company.se,35,SEK,8.75,2.52,32.48,paid,Klarna,stripe,,INV-202401-5506,RCPT_DW40TJA,31/01/2024 18:16,,n/a,GB,mastercard,,,0,,manual_sheet,duplicate
901193,523,NULL,15,SEK ,3.75,,13.06,Paid,Card,stripe,pi_R9U5SWP4HNGB,,,Apr 17 2024 08:18,,NULL,NULL,mastercard,,1,0,2024-04-17 08:18,square_export,duplicate
901194,843,mariamal123@company.se,20,€,,"1,50",17.92,payd,bank transfer,adyen,pi_BGE8SBUWRP10,INV-202404-6159,,,,NULL,,,9802,,0,2024/04/18 08:48,,duplicate
901195,1028,user2912@email.com,35,,,2.52,,pending,,stripe,pi_M7ROQ20YT6VF,NULL,,Mar 09 2024 21:00,n/a,,NO,amex,,one,,,square_export,duplicate
901196,91,norahans358@company.se,25,Sek,,,,FAILED,swish,adyen,,,,,n/a,,NO,NULL,,2,,,pos,partial refund
901197,1098,liamande@email.com,35,EUR,,,n/a,PAID,NaN,adyen,pi_QZOIYH1JOJ97,,,17/04/2024 15:42,n/a,re_W6QPHJBF46,,visa,,NaN,,2024/04/17 15:42,stripe_export,partial refund
901198,883,user560@gmail.com,40,Sek,,,,paid,SWISH,adyen,pi_MZRSACAX0YCT,,RCPT_P65W6WJ,2024/03/17 12:41,,n/a,NO,visa,,NULL,,,square_export,partial refund
901199,65,norahans@email.com,40,EUR,,2.66,NULL,Paid,invoice,adyen,,,,,NaN,NULL,NULL,,,2,,,stripe_export,partial refund
901200,672,saralind737@company.se,35,sek,8.75,"1,50",32.48,PAID,cash,square,,,,2024-01-24 22:51,n/a,n/a,,mastercard,4487,,,,,NaN
901201,380,mariamal848@company.se,15,EUR,,1.94,,failed,Klarna,adyen,pi_04VHFOZM00P2,,RCPT_I4AYXSI,2024-01-20T07:59:00,,NULL,SE,amex,,,,2024-01-20 07:59,manual_sheet,manual correction
901202,,liamande293@outlook.com,20,Sek,,,,payed,cash,NaN,ch_QV5S9FWK4J,,,16/03/2024 18:43,n/a,NaN,GB,amex,NaN,1,yes,2024/03/16 18:43,,duplicate
901203,144,user7893@email.com,15,Sek,,,,PAID,bank transfer,square,ch_O4R8ZC53AI,INV-202402-5121,n/a,Feb 29 2024 18:51,,re_U9CK8PL7LG,,mastercard,,NaN,NaN,,stripe_export,partial refund
901204,1061,saralind@email.com,25,SEK,,"1,50",22.77,paid,bank_transfer,adyen,,INV-202401-7622,,2024/01/04 14:46,NaN,,SE,,,NULL,0,2024/01/04 14:46,stripe_export,partial refund
901205,327,pedrosil@gmail.com,25,SEK ,,2.23,22.77,FAILED,bank transfer,adyen,,INV-202401-2795,NaN,2024-01-09T22:20:00,NaN,,,,,,NaN,2024/01/09 22:20,,partial refund
901206,240,NULL,35,Sek,8.75,2.52,,Refunded,Klarna,adyen,NULL,NULL,,2024-03-30T20:53:00,,NaN,ES,,NaN,1,NaN,NULL,,NULL
901207,999,jonasnil950@outlook.com,15,€,3.75,"1,50",,Paid,n/a,adyen,pi_E11IMLTKJUW4,,,2024-03-05T16:32:00,n/a,,,visa,6434,one,,,square_export,NULL
901208,24,NULL,25,sek,,2.23,n/a,failed,SWISH,square,ch_QQ259HCM3F,,RCPT_2KL5U1K,,,n/a,PT,visa,,,0,2024/04/21 21:15,,duplicate
901209,1003,mariamal123@company.se,20,€,5.0,,,Paid,invoice,square,,,,2024-01-11T19:00:00,,re_AER4EZ7TSS,,VISA,NaN,3,1,,manual_sheet,NULL
901210,738,user5365@gmail.com,15,EUR,NULL,1.94,,Pending,Klarna,klarna,,,RCPT_S90IGSP,17/04/2024 21:59,NULL,NaN,SE,,,,,2024-04-17 21:59,pos,partial refund
901211,154,,20,SEK,n/a,2.08,,pending,swish,square,pi_KJ9X3UGMYK9L,,,21/04/2024 12:57,,n/a,NO,mastercard,,NULL,,2024-04-21 12:57,,
901212,69,,40,SEK,10.0,NaN,,Pending,swish,adyen,,,,07/03/2024 08:50,,NULL,GB,VISA,,3,n/a,,,
901213,71,ellaberg@gmail.com,60,EUR,15.0,3.24,,Refunded,bank transfer,stripe,pi_48QCF2UDSHS3,,RCPT_SFRVEES,2024-02-04 20:35,,,NO,mastercard,,,1,NaN,square_export,
901214,789,anagarci@gmail.com,NULL,SEK ,15.0,,,failed,Card,klarna,,INV-202402-8956,RCPT_LXAHPMY,,NULL,,GB,amex,,1,NULL,2024/02/03 09:41,pos,duplicate
901215,888,,40,€,,,37.34,paid,,manual,pi_40MK7N6V5V4Z,INV-202401-9977,n/a,05/01/2024 09:42,,re_3CVHP5VU35,NULL,,,3,0,2024-01-05 09:42,,manual correction
901216,336,fridakar@email.com,35,Sek,,,32.48,failed,card,manual,NULL,,,2024-01-22 18:24,,,,,,n/a,no,2024-01-22 18:24,square_export,
901217,678,user7382@email.com,20,SEK,,"1,50",,payd,SWISH,stripe,ch_KPQU61R0ND,,,Jan 04 2024 16:28,n/a,NULL,GB,,,2,,2024-01-04 16:28,manual_sheet,
901218,71,user7102@gmail.com,60,sek,15.0,,,paid,SWISH,adyen,,,,2024/03/25 19:11,,n/a,,,8747,,1,2024/03/25 19:11,pos,
901219,224,user4938@email.com,40,€,10.0,2.66,,failed,bank_transfer,adyen,ch_YSNNBYPUVN,INV-202402-7498,,29/02/2024 11:23,,NULL,,,NaN,1,0,,manual_sheet,duplicate
901220,78,elinsven140@company.se,60,SEK,,3.24,56.76,refunded,invoice,square,,,,Apr 14 2024 14:14,n/a,,,mastercard,,1,n/a,2024/04/14 14:14,pos,
901221,336,elinsven653@email.com,60,€,15.0,,NaN,Paid,swish,manual,,,,2024-03-29T08:46:00,n/a,NULL,GB,,9707,3,1,2024/03/29 08:46,square_export,partial refund
901222,851,ellaberg709@gmail.com,15,Sek,3.75,,,refunded,,adyen,,,,2024/02/26 08:46,n/a,NaN,,,,2,1,,pos,partial refund
901223,968,erikholm707@gmail.com,35,SEK ,8.75,2.52,NaN,FAILED,bank_transfer,adyen,,,,2024/05/09 11:18,n/a,n/a,SE,VISA,,1,no,2024/05/09 11:18,pos,NaN
901224,545,user1910@gmail.com,,SEK ,5.0,2.08,,FAILED,card,adyen,n/a,INV-202401-6015,,,,NULL,,VISA,NaN,,NaN,,square_export,
901225,1023,n/a,"60,00",sek,,3.24,,payed,card,manual,ch_TYCC4VQO0W,NULL,,,,,,VISA,,NaN,,,pos,
901226,1171,user2673@gmail.com,35,SEK ,,,,payed,Klarna,klarna,NULL,,,2024-03-25 11:20,NaN,re_O6RLNSLIAN,GB,,NaN,,,2024-03-25 11:20,manual_sheet,
901227,897,ellaberg709@gmail.com,25,sek,,"1,50",22.77,FAILED,card,stripe,,,,2024-02-01 09:32,,,ES,VISA,,,n/a,n/a,stripe_export,manual correction
901228,84,linchen450@email.com,40,Sek,,,,refunded,NULL,klarna,ch_KNBX7F44SI,,,Jan 25 2024 07:46,n/a,,NO,visa,4772,3,,2024-01-25 07:46,,manual correction
901229,710,oliviali438@outlook.com,15,SEK,3.75,NULL,,Pending,cash,stripe,ch_I2SW5FPELA,,,2024-05-07 18:24,,,,amex,,NaN,no,,stripe_export,
901230,173,liamande@email.com,40,sek,,2.66,n/a,FAILED,Card,manual,ch_BZYXPIR3UE,,,,NaN,re_QE8U11LMVN,ES,,NaN,,NULL,2024/04/25 12:40,pos,
901231,685,mariamal848@company.se,25,EUR,NaN,,,payd,bank transfer,klarna,,,,2024-02-02 22:56,NaN,n/a,NO,VISA,2385,one,,2024/02/02 22:56,,manual correction
901232,139,,20,sek,5.0,"1,50",,paid,cash,square,ch_20PJ5TV6GB,,RCPT_KVMKGQB,2024-01-20T14:17:00,,n/a,NO,mastercard,1848,3,,2024/01/20 14:17,NULL,manual correction
901233,989,linchen450@email.com,40,sek,10.0,,,refunded,SWISH,adyen,,INV-202404-9326,RCPT_38NJPX4,2024-04-04 13:53,2024-04-04 13:53,n/a,,amex,,1,yes,2024/04/04 13:53,stripe_export,
901234,1138,norahans@email.com,25,SEK ,6.25,"1,50",NULL,Paid,Card,klarna,pi_RLAVLF1QBG3C,,,2024/05/03 19:52,NaN,NaN,,visa,6494,2,no,,manual_sheet,n/a
901235,100,mariamal803@email.com,35,€,8.75,NULL,32.48,FAILED,,adyen,ch_NMVOIUDJ0R,INV-202403-6072,RCPT_0IGXELL,,,,,mastercard,3884,n/a,1,,manual_sheet,
901236,470,noaherik@email.com,35,SEK,,2.52,,FAILED,invoice,stripe,,,RCPT_H0F6JQA,04/05/2024 07:48,n/a,,,NaN,,,,,stripe_export,duplicate
901237,1055,user787@gmail.com,60,Sek,n/a,"1,50",,payed,swish,manual,ch_NLXDDJC58Q,,,2024/03/28 09:24,n/a,,,amex,NULL,,NULL,2024/03/28 09:24,manual_sheet,NaN
901238,267,mikaelås460@gmail.com,NaN,sek,5.0,,17.92,Pending,swish,adyen,ch_EOF0Z5BEOW,,,2024-02-10T13:00:00,NaN,NULL,PT,,,3,,2024/02/10 13:00,square_export,
901239,375,norahans581@company.se,15,sek,3.75,,,failed,Klarna,manual,pi_ZL5ZBCDHMGM1,,,Mar 03 2024 20:12,n/a,,,mastercard,7997,NaN,1,2024-03-03 20:12,stripe_export,
901240,505,,60,SEK ,NaN,n/a,56.76,paid,card,,,,RCPT_RTQLXK5,NULL,n/a,NaN,ES,amex,3116,n/a,yes,NULL,manual_sheet,NULL
901241,986,,15,SEK,3.75,1.94,13.06,payd,Klarna,klarna,pi_UB5THO2VJGWI,,,10/03/2024 07:26,,,PT,amex,,2,no,2024-03-10 07:26,manual_sheet,
901242,8,sofiaand@gmail.com,35,sek,,2.52,,NaN,Card,manual,pi_NNV05NHQLRBL,INV-202404-4442,RCPT_JEFNOKH,17/04/2024 15:01,n/a,NULL,ES,NaN,,NULL,,2024-04-17 15:01,stripe_export,partial refund
901243,175,luispere308@outlook.com,60,SEK ,,,,PAID,SWISH,manual,pi_XJG28Y2D47UI,,,2024-02-15T10:17:00,NaN,NaN,,amex,,3,no,2024/02/15 10:17,,partial refund
901244,778,user2382@email.com,15,Sek,,"1,50",,pending,SWISH,NULL,ch_475HGFEEUN,,RCPT_T5FN6Q2,27/04/2024 09:57,n/a,re_K158CPJ8CN,n/a,visa,8880,one,,2024-04-27 09:57,,
901245,867,elinsven320@gmail.com,NaN,SEK,n/a,1.94,,payd,SWISH,square,,,,2024/02/08 08:25,n/a,n/a,,,,n/a,NULL,2024/02/08 08:25,pos,
901246,82,luispere@email.com,15,Sek,,"1,50",,PAID,invoice,,pi_L1HC0UKRLTAA,INV-202404-2964,,,n/a,re_7QAM8JWY8S,ES,VISA,,one,n/a,2024/04/24 10:03,,
901247,919,noaherik@email.com,60,SEK ,,,,PAID,bank_transfer,manual,pi_UBMGD1EIE6AK,,RCPT_PR9JBPY,,,,ES,amex,,,NaN,2024-02-14 07:58,square_export,manual correction
901248,822,user1599@email.com,15,SEK,,,NULL,FAILED,cash,adyen,ch_IQG6UNCXVR,,,2024-02-28T21:54:00,,re_V7ZWMK1PUH,,visa,,one,no,,manual_sheet,
901249,251,NaN,35,Sek,8.75,"1,50",,Refunded,card,,,,,2024-03-23T22:11:00,NULL,n/a,PT,VISA,,,NULL,,,
901250,634,jonasnil@gmail.com,40,SEK ,10.0,,37.34,failed,swish,stripe,,n/a,,Apr 30 2024 20:01,,n/a,ES,NULL,,one,,2024/04/30 20:01,square_export,partial refund
901251,948,oskarber957@company.se,35,sek,8.75,,,FAILED,bank transfer,square,n/a,,RCPT_O7Z0K77,,,,n/a,mastercard,,,,2024-01-29 07:10,stripe_export,NaN
901252,147,n/a,20,SEK ,,2.08,,pending,Klarna,stripe,,,,19/02/2024 09:59,,NULL,ES,mastercard,n/a,,0,2024/02/19 09:59,manual_sheet,
901253,11,,15,SEK ,,,n/a,Pending,bank transfer,stripe,,,RCPT_ZSFLEA8,2024/01/03 18:57,,NaN,n/a,mastercard,,,,2024-01-03 18:57,,manual correction
901254,277,elinsven889@gmail.com,60,€,15.0,3.24,,Refunded,swish,square,ch_PBCFK2CM20,,RCPT_IM4BBTP,2024-04-29T22:24:00,,,,n/a,,n/a,no,NaN,manual_sheet,
901255,1082,saralind@email.com,25 SEK,Sek,6.25,,,FAILED,swish,square,n/a,NULL,,Apr 13 2024 07:44,,re_18RL5B04SD,,amex,,,NaN,2024/04/13 07:44,NULL,manual correction
901256,800,anagarci@email.com,40,EUR,,,37.34,FAILED,bank transfer,stripe,ch_CM8RMUILSB,INV-202403-6889,,2024/03/07 18:22,NaN,n/a,NO,NULL,3607,NULL,,2024/03/07 18:22,,
901257,217,ahmedali393@gmail.com,35,EUR,8.75,,,paid,swish,klarna,pi_3HSN1YIMMEYX,,,Feb 23 2024 22:18,,,GB,mastercard,1261,1,0,,square_export,partial refund
901258,1145,elinsven10@gmail.com,60,€,,"1,50",,Paid,cash,manual,,INV-202401-6219,RCPT_CXPZXC0,2024/01/20 22:04,,n/a,PT,,,1,1,,n/a,n/a
901259,190,ellaberg261@gmail.com,20,EUR,5.0,NaN,,pending,swish,klarna,,,,,,,SE,NULL,NaN,1,,2024/03/08 16:59,pos,manual correction
901260,647,karinlun968@outlook.com,25,NaN,,2.23,,payed,bank transfer,adyen,ch_ZG4ZML8UUE,,RCPT_AYPXX03,2024/02/17 22:38,,n/a,PT,amex,,1,0,2024/02/17 22:38,,
901261,1063,erikholm@email.com,15,SEK,3.75,,,payed,bank_transfer,square,,,,2024-03-01T14:45:00,NaN,,,amex,,2,n/a,,manual_sheet,
901262,398,user8921@gmail.com,40,,,"1,50",,PAID,n/a,stripe,NaN,,RCPT_LPIF4KX,27/02/2024 15:24,,NULL,SE,,,1,0,2024-02-27 15:24,stripe_export,
901263,531,karinlun@gmail.com,20,Sek,,,,payd,cash,square,,INV-202402-4979,NaN,26/02/2024 21:36,,,,,6714,3,,,stripe_export,duplicate
901264,1138,,35,SEK,NaN,,NaN,PAID,,adyen,ch_GEWB126R7P,INV-202402-2205,,,NULL,,NULL,VISA,,1,n/a,,pos,partial refund
901265,1011,ahmedali594@email.com,25,SEK,,,,payd,SWISH,NaN,ch_3KJF6SELFT,,,Feb 26 2024 22:15,,,GB,VISA,,n/a,n/a,,pos,n/a
901266,92,fatimakh509@gmail.com,60,Sek,,,,FAILED,Klarna,klarna,,,,24/04/2024 22:43,,n/a,GB,,5954,2,n/a,2024-04-24 22:43,stripe_export,duplicate
901267,1042,NULL,35,€,,,,payd,bank_transfer,klarna,,,,13/04/2024 11:48,,n/a,NaN,NaN,n/a,,yes,2024-04-13 11:48,manual_sheet,manual correction
901268,1050,maríalóp21@company.se,20,SEK,5.0,,,Pending,swish,manual,,n/a,RCPT_PW6ODEE,2024-03-05T21:38:00,,NULL,PT,visa,,2,,2024/03/05 21:38,square_export,
901269,1039,davidsto885@company.se,60,sek,NaN,,,failed,SWISH,square,,n/a,,Jan 15 2024 22:44,,n/a,ES,amex,,,NULL,2024/01/15 22:44,pos,
901270,928,user6075@gmail.com,15,€,,1.94,,Pending,cash,square,,,RCPT_JWIM6VQ,04/03/2024 13:28,n/a,,n/a,VISA,2934,1,,,manual_sheet,
901271,563,jonasnil@email.com,35,SEK ,,,NaN,refunded,bank transfer,manual,,,,2024-04-03T07:31:00,,,SE,VISA,,n/a,,2024/04/03 07:31,stripe_export,duplicate
901272,1130,NaN,25,EUR,,"1,50",,Pending,invoice,square,pi_OPE40TYU5HUZ,INV-202403-1151,,2024-03-20T09:10:00,,NULL,n/a,,,,,2024-03-20 09:10,stripe_export,
901273,1155,mikaelås734@outlook.com,60,SEK ,15.0,3.24,,Refunded,SWISH,klarna,ch_4GXNTOKD2C,n/a,RCPT_K99H0F0,25/04/2024 10:38,,,,VISA,,2,,2024-04-25 10:38,pos,partial refund
901274,205,user5875@email.com,15,EUR,3.75,NULL,,paid,bank transfer,stripe,,,,2024-01-02T10:07:00,NaN,,PT,visa,,one,no,2024-01-02 10:07,,n/a
901275,239,user6600@gmail.com,25,€,6.25,NaN,,FAILED,bank_transfer,square,ch_41BMG60R8X,NaN,,May 07 2024 17:49,n/a,NULL,NO,VISA,3397,3,1,,,NaN
901276,169,saralind733@gmail.com,60,EUR,15.0,3.24,56.76,Paid,bank transfer,klarna,ch_0A8EK5HMIW,INV-202401-6088,,2024-01-29T17:53:00,NaN,n/a,NaN,,,,,2024-01-29 17:53,manual_sheet,duplicate
901277,44,user9224@email.com,40,Sek,NaN,,37.34,payd,cash,manual,ch_93EC0RP0YX,INV-202404-3037,,2024-04-08 14:13,NULL,,PT,mastercard,8136,,1,2024/04/08 14:13,pos,
901278,677,karinlun@gmail.com,40,Sek,,,,payd,cash,manual,,INV-202403-7754,,25/03/2024 09:25,,,NO,,,,NULL,2024/03/25 09:25,pos,NULL
901279,397,user6363@email.com,25,SEK,6.25,2.23,,Paid,Klarna,manual,,,,2024-02-21T21:16:00,,NULL,NO,,9663,NaN,,2024-02-21 21:16,pos,manual correction
901280,,luispere582@gmail.com,25,EUR,,2.23,,Paid,cash,stripe,,,RCPT_L7YDCPJ,,n/a,,SE,VISA,,n/a,yes,2024/03/31 15:28,,duplicate
901281,394,ahmedali@gmail.com,35,SEK,,2.52,32.48,PAID,bank_transfer,adyen,,,,2024-04-24T13:14:00,NaN,,PT,,NaN,2,NULL,,,
901282,701,luispere@email.com,25,€,6.25,"1,50",,paid,invoice,manual,pi_BOAFFF1WJRBL,,NULL,2024-03-01 14:18,,NaN,n/a,,,,yes,2024-03-01 14:18,stripe_export,
901283,732,karinlun@gmail.com,25,Sek,6.25,2.23,n/a,pending,card,klarna,,,RCPT_36NWIBF,2024-03-29 18:42,,NULL,NO,mastercard,,NaN,,2024/03/29 18:42,pos,manual correction
901284,959,pedrosil440@email.com,,EUR,10.0,"1,50",,payd,SWISH,klarna,pi_2G1PWOGBHIPA,,,,,,GB,,,2,yes,2024/03/05 14:38,NULL,
901284,155,user1617@email.com,60,SEK ,,NULL,,Paid,bank transfer,square,,,,,,,NO,,,1,NaN,,,n/a
901286,555,user732@gmail.com,35,sek,,,,n/a,invoice,manual,pi_SRU87JVJRGV8,,NULL,2024-03-23 15:28,NULL,n/a,,mastercard,8943,,yes,n/a,pos,
901287,351,mariamal123@company.se,20,Sek,,,,PAID,card,manual,ch_9TB6UWZOIM,INV-202404-9572,RCPT_X17I1BT,,,NaN,GB,mastercard,7050,,,2024/04/26 17:40,pos,partial refund
901288,406,ahmedali@email.com,"25,00",€,,n/a,,payed,SWISH,stripe,,,RCPT_EKHTR9Z,12/02/2024 12:30,,re_XHBDKCK513,,,,,yes,,manual_sheet,
901289,1039,saralind694@outlook.com,35,SEK,,2.52,32.48,Refunded,bank_transfer,adyen,ch_SC5J5W3NW7,,n/a,,NULL,n/a,,amex,,2,,2024-02-23 21:46,square_export,partial refund
901290,324,jonasnil@email.com,40,Sek,,,,refunded,Klarna,klarna,,,,2024-02-06T20:26:00,NULL,,GB,amex,3268,3,yes,2024-02-06 20:26,square_export,
901291,467,linchen450@email.com,15,EUR,3.75,,,PAID,SWISH,manual,,,,,NULL,n/a,PT,VISA,,2,1,NaN,stripe_export,partial refund
901292,801,sofiaand850@gmail.com,35,sek,8.75,,n/a,payd,SWISH,manual,ch_UZ2A7U92RF,n/a,RCPT_CKIH38Z,yesterday,n/a,NULL,NULL,,8454,one,,2024/02/08 10:37,pos,n/a
901293,399,NaN,60,SEK,,3.24,,payd,Card,manual,ch_ZGGID4PZI6,,RCPT_S2GS9SW,Feb 01 2024 11:26,n/a,,,NaN,,2,NaN,2024-02-01 11:26,stripe_export,manual correction
901294,116,,60,NaN,,,56.76,paid,card,adyen,ch_NP7W48F01T,INV-202402-1825,,Feb 07 2024 10:53,NULL,NaN,SE,mastercard,,1,yes,2024/02/07 10:53,manual_sheet,partial refund
901295,373,davidsto285@company.se,60,sek,15.0,,56.76,payed,bank transfer,square,ch_DQCSN9YHJ0,,RCPT_LDVUBGH,,,re_424QIXY2Z9,ES,,,1,yes,2024-03-13 14:42,pos,partial refund
901296,924,maríalóp333@email.com,25,€,,2.23,,payd,Card,manual,,INV-202403-9473,,2024-03-29 18:43,,NaN,,VISA,,3,NULL,2024-03-29 18:43,manual_sheet,
901297,884,jonasnil950@outlook.com,35,Sek,,"1,50",,pending,Klarna,square,pi_U1351HGZYB27,NULL,,2024-01-07T11:58:00,NULL,NULL,NULL,NULL,,,,n/a,,partial refund
901298,879,user514@gmail.com,20,Sek,,,,pending,bank transfer,square,NaN,,RCPT_07KJR3U,Apr 18 2024 10:02,NaN,,NULL,mastercard,,one,n/a,2024/04/18 10:02,stripe_export,duplicate
901299,394,fatimakh@gmail.com,20,SEK,5.0,,17.92,payed,bank_transfer,klarna,pi_H3FSJ4EEX08X,,,2024/04/28 16:36,NaN,,ES,,,one,1,2024/04/28 16:36,square_export,
901300,15,user8045@gmail.com,35,Sek,,2.52,n/a,failed,invoice,klarna,,,RCPT_J0PMKJ6,,n/a,,,,8937,n/a,,2024/02/18 17:25,manual_sheet,
901301,54,user7440@gmail.com,40,SEK ,10.0,,,payed,bank transfer,klarna,pi_0DOVMBMI42ZG,,,,,NaN,,VISA,,3,,,pos,
901302,260,oskarber@email.com,15,EUR,3.75,,,pending,bank transfer,manual,,INV-202401-2910,RCPT_M00PKF9,2024-01-28 20:14,,re_7QZRAGGR3T,NO,,,2,yes,,square_export,
901303,817,mariamal803@email.com,25,sek,6.25,NULL,,payed,bank_transfer,,pi_RZ7QLG93L9VT,,,2024-01-27T09:54:00,,n/a,ES,VISA,1462,2,yes,2024-01-27 09:54,manual_sheet,
901304,,user2721@gmail.com,35,€,8.75,,32.48,Paid,Klarna,manual,,,RCPT_XMWWKWG,Jan 14 2024 12:44,,n/a,GB,,8860,,,2024-01-14 12:44,manual_sheet,duplicate
901305,37,linchen129@outlook.com,35,sek,,NaN,32.48,Refunded,,stripe,ch_4N5VZS5CBV,,,May 04 2024 15:47,,n/a,NULL,VISA,,,,2024/05/04 15:47,stripe_export,manual correction
901306,852,ellaberg261@gmail.com,35,SEK,,,,refunded,swish,adyen,,INV-202401-7709,,2024-01-12 17:48,n/a,,SE,VISA,9560,,n/a,,pos,partial refund
901307,349,karinlun@gmail.com,35,SEK,,2.52,,Refunded,SWISH,manual,,,,2024/04/19 16:38,,NaN,NO,NULL,,2,NULL,2024-04-19 16:38,manual_sheet,NULL
901308,,oskarber957@company.se,35,EUR,8.75,NaN,32.48,FAILED,Klarna,stripe,NaN,,,2024-04-15 17:44,NaN,NaN,ES,,9665,NaN,no,2024-04-15 17:44,square_export,manual correction
901309,778,karinlun255@gmail.com,60,SEK ,,,,failed,SWISH,stripe,,,,,,NaN,ES,mastercard,,NaN,yes,,,
901310,4,,20,€,,,17.92,refunded,bank_transfer,klarna,ch_N9JKA38T2L,INV-202401-3051,,03/01/2024 10:30,n/a,,SE,amex,NULL,,,2024/01/03 10:30,stripe_export,
901311,171,luispere582@gmail.com,35,SEK,,,,paid,card,klarna,ch_BGFXXDVE35,,,01/04/2024 17:57,NaN,,,n/a,,one,NULL,2024/04/01 17:57,pos,
901312,608,user2773@email.com,25,€,,,NaN,FAILED,Card,square,,,NULL,09/02/2024 15:45,n/a,NaN,GB,,,NULL,yes,2024/02/09 15:45,pos,partial refund
901313,1068,saralind737@company.se,35,SEK ,,"1,50",,PAID,invoice,square,,,,2024/01/28 09:34,,n/a,GB,mastercard,,NULL,,2024/01/28 09:34,,partial refund
901314,470,ellaberg952@outlook.com,15,SEK ,,n/a,13.06,payd,invoice,stripe,NaN,,,20/04/2024 08:24,NULL,,GB,amex,1795,1,,2024-04-20 08:24,pos,partial refund
901315,502,luispere308@outlook.com,40,SEK,,2.66,,PAID,SWISH,stripe,,INV-202401-9244,NULL,2024/01/15 16:54,,n/a,SE,,,3,no,2024-01-15 16:54,square_export,
901316,320,user6984@email.com,35,sek,8.75,,,FAILED,swish,manual,,,,14/04/2024 09:18,,NULL,,NULL,,3,NULL,NULL,,partial refund
901317,,user6121@gmail.com,,SEK ,,,NaN,payed,invoice,square,pi_KON5YRFO9Z04,INV-202403-4118,,2024/03/31 10:51,NaN,n/a,PT,,,n/a,n/a,2024/03/31 10:51,,
901318,280,mariamal848@company.se,20,SEK ,,2.08,,pending,card,stripe,,INV-202402-7963,RCPT_88MJ7ED,,NULL,n/a,ES,,6921,NULL,,2024-02-10 14:22,square_export,
901319,233,fatimakh322@outlook.com,35,Sek,n/a,,32.48,pending,bank transfer,adyen,,INV-202404-9199,,2024/04/12 17:47,n/a,NaN,GB,visa,NaN,1,n/a,2024-04-12 17:47,,partial refund
901320,1176,ahmedali594@email.com,20,Sek,NaN,,,Paid,SWISH,adyen,,INV-202402-9964,RCPT_0LWI9XY,,,,PT,VISA,,2,1,2024/02/25 19:57,stripe_export,
901321,,ahmedali@gmail.com,15,SEK ,,,,payed,card,square,,NULL,,2024/04/10 20:23,NULL,NULL,NaN,NaN,3385,one,0,2024/04/10 20:23,stripe_export,
901322,696,NULL,20,SEK,,"1,50",,payd,Klarna,stripe,n/a,,,26/03/2024 20:41,n/a,re_C810LTSTSP,SE,VISA,1385,one,0,2024-03-26 20:41,stripe_export,NULL
901323,905,NULL,"40,00",Sek,10.0,"1,50",,failed,bank_transfer,manual,ch_R4YWIRPSQX,,,,,,NO,mastercard,6559,,NaN,2024/03/13 17:46,square_export,partial refund
901324,527,luispere@email.com,60,Sek,NULL,3.24,56.76,FAILED,Klarna,klarna,ch_PXR4WEYUHN,,,2024-04-24 17:08,NULL,NaN,PT,mastercard,,1,yes,2024/04/24 17:08,NULL,partial refund
901325,99,oscarber554@outlook.com,60,SEK ,NaN,"1,50",,Refunded,swish,NaN,,,,08/02/2024 22:58,,,ES,VISA,NaN,3,yes,,stripe_export,NaN
901326,1031,user9933@email.com,15,sek,3.75,1.94,,refunded,invoice,adyen,ch_OBACTTTKV7,NaN,RCPT_PQQH8VU,08/01/2024 17:25,,NaN,,VISA,1703,3,yes,2024-01-08 17:25,manual_sheet,manual correction
901327,834,ahmedali@gmail.com,35,NULL,,,,failed,bank_transfer,adyen,,,,2024-05-08T14:00:00,,,,visa,1919,n/a,yes,,square_export,
901328,742,sofiaand221@company.se,60,€,n/a,,,PAID,swish,klarna,,INV-202404-4857,,2024/04/05 15:28,NaN,,,visa,,one,NULL,2024-04-05 15:28,stripe_export,manual correction
901329,375,user6809@email.com,35,€,8.75,"1,50",32.48,paid,Card,klarna,ch_K9ZDQMDGWT,n/a,RCPT_2NR0HV4,21/03/2024 22:24,,NaN,NO,NaN,1054,,NaN,2024-03-21 22:24,square_export,duplicate
901330,624,saralind135@email.com,25,SEK ,6.25,,22.77,Refunded,Card,klarna,n/a,INV-202401-4989,RCPT_JT36OUK,Jan 01 2024 09:19,,n/a,NO,NULL,,,NULL,2024/01/01 09:19,manual_sheet,
901331,559,user3963@gmail.com,40,Sek,,NaN,,pending,Klarna,square,ch_JWG94JYZ6N,,NULL,,,,,,,,,2024-03-27 14:07,manual_sheet,
901332,1071,fatimakh971@email.com,n/a,€,,2.08,17.92,Paid,NULL,stripe,pi_Q1URYND85QCQ,INV-202402-4074,,Feb 16 2024 19:30,NULL,NULL,n/a,,,,,,NULL,
901333,1016,karinlun413@email.com,,EUR,,2.66,,NULL,card,stripe,,,,2024/04/25 18:34,NaN,NaN,,,9226,NaN,,NaN,manual_sheet,
901334,290,norahans647@email.com,25,EUR,6.25,2.23,,PAID,bank transfer,NULL,ch_ZU5EBQEH5A,,,2024-03-27T20:26:00,,NULL,NO,VISA,7116,,,,,
901335,299,user8068@gmail.com,,SEK ,,2.08,17.92,FAILED,Card,stripe,,INV-202404-4585,RCPT_OSVW9R7,05/04/2024 11:25,NaN,,,,,,,NaN,manual_sheet,
901336,303,pedrosil440@email.com,35,SEK ,,,,refunded,swish,adyen,,,,Feb 06 2024 22:04,,,,,,3,,,,partial refund
901337,564,noaherik618@outlook.com,60.00,n/a,,3.24,,payd,swish,adyen,,NaN,,2024-05-10T10:00:00,NaN,NaN,GB,,,1,1,2024-05-10 10:00,manual_sheet,partial refund
901338,184,,40,SEK ,,,,payed,Klarna,manual,,NULL,RCPT_3AIHLVP,,,re_PGN52RLO9A,SE,visa,NULL,NULL,NULL,2024/04/18 12:36,stripe_export,duplicate
901339,229,elinsven661@email.com,20,€,5.0,,17.92,pending,cash,stripe,pi_ABO9N3SAX631,INV-202401-4916,,03/01/2024 10:42,,n/a,GB,,9403,3,,2024-01-03 10:42,,duplicate
901340,553,elinsven491@email.com,15,SEK ,,,,failed,cash,klarna,,,RCPT_KDL7V6U,,NULL,,SE,,,,NaN,2024-01-24 18:12,pos,duplicate
901341,719,NaN,15,EUR,,,,n/a,invoice,klarna,,,NaN,2024/02/07 10:30,NULL,NULL,PT,,NULL,one,,2024/02/07 10:30,stripe_export,partial refund
901342,408,user5541@email.com,40,,,,37.34,payed,cash,,,,,2024/01/21 15:45,,,SE,NULL,NULL,2,,2024/01/21 15:45,square_export,duplicate
901343,998,oliviali438@outlook.com,35,SEK,8.75,"1,50",,failed,bank transfer,manual,,,,2024-05-09 14:51,NULL,n/a,,visa,8597,,1,2024-05-09 14:51,stripe_export,duplicate
901344,635,user9032@gmail.com,15,SEK,NaN,,13.06,Pending,Klarna,square,pi_JN89A3VECO9H,,,Apr 27 2024 17:55,NaN,,GB,VISA,,NULL,,2024/04/27 17:55,manual_sheet,n/a
901345,606,ellaberg261@gmail.com,25,SEK ,6.25,,22.77,refunded,bank_transfer,manual,,,,Apr 14 2024 14:33,,NaN,,amex,3135,NULL,n/a,,manual_sheet,NaN
901346,111,mariamal755@email.com,35,EUR,8.75,2.52,32.48,Pending,bank transfer,adyen,ch_O84AU9ZKZ0,NULL,,2024/03/25 13:15,,re_E9HHZF9SE7,NaN,,,one,yes,,stripe_export,partial refund
901347,864,emmajoha610@email.com,60,NaN,,,56.76,,invoice,adyen,,,,,,,NaN,mastercard,n/a,,NULL,,manual_sheet,manual correction
901348,270,user7885@gmail.com,60,EUR,,,,payd,Card,adyen,ch_BEGLATQ4HM,,n/a,,,re_BDA3L811CB,ES,amex,8509,,,,square_export,
901349,690,ellaberg959@outlook.com,25,€,6.25,,,payed,cash,adyen,NULL,,,2024-03-27T16:41:00,NULL,NaN,SE,,,one,NaN,2024/03/27 16:41,square_export,manual correction
901350,1175,ellaberg@email.com,40,SEK ,,,37.34,refunded,Card,klarna,NULL,INV-202402-2173,RCPT_PZL358K,,,NULL,SE,,,,,2024-02-17 10:58,pos,manual correction
900818,99999,oscarber791@outlook.com,40,€,NULL,,,failed,SWISH,square,,NaN,NULL,,,n/a,NULL,,,,0,2024-03-07 14:14,pos,manual correction
900457,484,davidsto885@company.se,15,,3.75,"1,50",13.06,failed,bank transfer,klarna,NULL,,,,,,,NULL,2714,,,2024-04-21 07:32,manual_sheet,manual correction
901120,877,,35,Sek,,"1,50",32.48,payed,cash,square,ch_5AG8ROSU4T,,RCPT_7L9WOJ0,2024-03-14T14:47:00,,NaN,SE,visa,2500,3,,,stripe_export,partial refund
901182,301,saralind438@company.se,15,Sek,3.75,,13.06,Pending,SWISH,stripe,,,RCPT_ZS0A58F,NaN,n/a,,SE,,,3,0,2024/01/19 18:34,manual_sheet,manual correction
900994,1003,mikaelås@gmail.com,15 SEK,sek,NaN,NULL,,FAILED,,,,n/a,,2024-02-20T22:25:00,NULL,,,visa,,,NULL,,manual_sheet,
900635,939,user4091@gmail.com,20,€,n/a,,,PAID,swish,adyen,,,,2024/03/29 14:39,NULL,NaN,ES,,,NULL,,2024/03/29 14:39,manual_sheet,manual correction
900341,687,NaN,40,Sek,10.0,"1,50",,failed,SWISH,manual,pi_TDKHP7JC6QBD,,,,,,,amex,,,,2024-03-08 19:00,square_export,
901011,709,mikaelås460@gmail.com,25,SEK,,"1,50",,Paid,bank_transfer,square,n/a,,RCPT_YFTMK0F,,,NaN,NO,amex,,,0,2024/05/04 18:23,pos,
900045,283,fatimakh311@gmail.com,15,€,,,,FAILED,Card,square,,INV-202403-4760,,,n/a,n/a,,n/a,4081,,yes,,,
901155,1101,user5263@email.com,60,sek,,"1,50",,PAID,swish,klarna,,INV-202405-4363,,,n/a,,,visa,,,0,,,NULL
901170,918,oliviali782@email.com,60,EUR,15.0,3.24,56.76,Pending,Klarna,adyen,pi_MGMEKHBCZWFA,,,Jan 23 2024 16:54,n/a,NaN,,n/a,NaN,NaN,n/a,2024-01-23 16:54,,manual correction
901049,190,NULL,25,SEK,,,22.77,Refunded,Card,adyen,pi_9MJJEJ1WA0Z9,,,Jan 25 2024 15:32,NULL,n/a,SE,NaN,,,0,,square_export,partial refund
900362,535,ellaberg@email.com,25,Sek,,,22.77,paid,Card,square,pi_K5WRSJW5O8MS,,n/a,2024/02/03 18:25,,re_7AKH0MTK1Z,,,,,NaN,,manual_sheet,
901087,816,erikholm@gmail.com,35,€,8.75,,32.48,Paid,bank transfer,stripe,ch_KVG48CE8D2,,,2024/03/21 10:37,NULL,NULL,SE,,,,0,2024-03-21 10:37,pos,manual correction
900610,1186,mikaelås698@email.com,35,EUR,8.75,,32.48,Pending,SWISH,klarna,pi_2IBRI58DV8LL,,,02/03/2024 07:49,n/a,,NULL,,,NaN,,2024/03/02 07:49,stripe_export,duplicate
900342,780,mikaelås495@outlook.com,25,SEK,,,22.77,pending,bank_transfer,stripe,ch_42YOC7RR7Q,,,2024-01-08T11:55:00,,,NULL,,n/a,one,yes,2024-01-08 11:55,pos,
901234,1138,norahans@email.com,25,SEK ,6.25,"1,50",NULL,Paid,Card,klarna,pi_RLAVLF1QBG3C,,,2024/05/03 19:52,NaN,NaN,,visa,6494,2,no,,manual_sheet,n/a
900246,328,n/a,,sek,,,,Paid,swish,square,ch_19ISOJEYZ1,,,05/04/2024 15:23,n/a,n/a,GB,NULL,n/a,,0,,pos,
900180,578,karinlun@email.com,35,EUR,NULL,"1,50",,paid,swish,manual,,,,,,,GB,VISA,NULL,1,,2024-01-20 15:36,square_export,
900554,855,elinsven320@gmail.com,35,EUR,8.75,,,Pending,Klarna,square,,INV-202401-7589,RCPT_7OBA89F,13/01/2024 16:37,,NaN,,amex,n/a,,,2024-01-13 16:37,square_export,
900469,1097,oliviali224@outlook.com,35,,8.75,"1,50",,payd,bank transfer,adyen,NaN,,,2024-05-03 12:23,,,SE,VISA,8725,1,yes,,,
900939,257,user6436@gmail.com,25,€,,,,payed,swish,adyen,pi_O9K8O9RTW4D4,,,yesterday,NULL,NULL,ES,visa,,one,,,manual_sheet,manual correction
900361,976,user6748@email.com,25,€,6.25,n/a,n/a,paid,card,klarna,pi_E500SMGKXHG6,INV-202401-7595,NaN,02/01/2024 17:36,,,PT,visa,,2,,2024-01-02 17:36,,manual correction
900816,512,oskarber759@company.se,60,€,,,56.76,Paid,swish,square,ch_XS9BFJ2X9G,INV-202403-6592,,NaN,,NULL,,,,,n/a,2024/03/12 17:25,,partial refund
900351,219,,15,EUR,NULL,,,FAILED,bank transfer,adyen,ch_60NI10IBA9,,,Apr 05 2024 12:12,NaN,,,,,2,no,NULL,manual_sheet,
900938,705,user3368@gmail.com,15,SEK,3.75,,13.06,Refunded,Klarna,,,,RCPT_G0M3N3A,2024-04-18 12:36,n/a,NULL,ES,VISA,,,no,,pos,
900699,1198,user1813@gmail.com,60,Sek,15.0,3.24,,Pending,Klarna,klarna,,,RCPT_7IJLPK8,16/02/2024 08:18,NULL,NULL,,,,,0,2024/02/16 08:18,stripe_export,manual correction
900417,26,maríalóp@gmail.com,15,NaN,NaN,"1,50",13.06,failed,swish,stripe,,INV-202401-2941,,Jan 27 2024 14:48,,NULL,,amex,,,1,,manual_sheet,partial refund
